adult,backdrop_path,genre_ids,id,original_language,original_title,overview,popularity,poster_path,release_date,title,video,vote_average,vote_count
False,/51qFJvQC1wZyCsPY3jFbtzWApub.jpg,[27],512064,en,Anne,A mentally ill woman with a severe personalty disorder develops a strange relationship with her dolls. She becomes victim to insomnia and even self-mutilation leaving her son to unfold the strange truth about Anne's illness.,2.602,/1nK9yBYMEkhCiMUioFRHRyP6KBL.jpg,2019-03-07,Anne,False,3.1,12
False,/fSOx3U1EUhJ3I4QnbldBwyqxEkw.jpg,"[18, 10749]",447034,en,Vita & Virginia,"Socialite Vita Sackville-West and literary icon Virginia Woolf run in different circles in 1920s London. Despite the odds, the magnetic Vita and the beguiling Virginia forge an unconventional affair, set against the backdrop of their own strikingly contemporary marriages; which inspired one of Woolf's most iconic novels, 'Orlando'.",5.387,/kNsMRldqZgsinyFjwNn1UzC0iln.jpg,2019-08-23,Vita & Virginia,False,7.0,30
False,/ozGJGYoJjWQ1y7zjZOiKHaPjAMh.jpg,[35],565326,en,Before You Know It,"In 1993 New York City, dysfunctional co-dependent sisters discover that the mother they thought had died when they were young is alive and starring on a popular daytime soap opera.",3.39,/jAM1OSLm1AoVoXyLdbnkBlRSCdi.jpg,2019-08-30,Before You Know It,False,7.0,1
False,/dzQs8wMHF61O9YvkDVXI9gNksjY.jpg,[27],648819,en,A Psycho's Path,A small California desert town is being stalked by a motiveless psychopath who roams its streets killing at random. Captain Peters and his small police force are on the case searching for his whereabouts before he kills again.,5.91,/kRiztGxEiVnrGi3LQFhTzli2zxu.jpg,2019-11-15,A Psycho's Path,False,0.0,0
False,/90kZ8H7qScKHOzWTqWqYUGQfmxR.jpg,[53],600881,es,El hijo,Painter Lorenzo's life spirals out of control as he fears his wife is trying to isolate him from their infant son.,5.225,/vcytE1v9e4RGjdhDYobbkFUNJxB.jpg,2019-07-26,The Son,False,5.3,58
False,/1sf7nbo1WYRN9Tw0yphVbW2w2go.jpg,"[9648, 10770]",590123,en,Aurora Teagarden Mysteries: A Very Foul Play,"At a gathering of mystery and true crime fans, Aurora Teagarden’s nephew, Phillip, is accused of murder when an unplanned onstage blackout during the play in which he is performing ends, revealing Phillip holding the bloody knife that has just killed one of the other performers.  12th installment in Aurora Teagarden Mysteries",3.952,/3gmqD6qBvmxnDX2owAmnmtSTAay.jpg,2019-08-18,Aurora Teagarden Mysteries: A Very Foul Play,False,8.5,4
False,/ts0Bju0uQtRXSZEZRjHonitP9qa.jpg,"[16, 35]",532953,en,Purl,"Purl, an earnest ball of yarn, gets a job at a fast-paced, male-centered startup company. Things start to unravel as Purl tries to fit in with this tight-knit group, but she must ask herself how far is she willing to go to get the acceptance she yearns for and if, in the end, it is worth it.",4.444,/joXAnXkoR2v2LzB4vx33WCNba24.jpg,2019-01-18,Purl,False,6.7,58
False,/2zl0iS3qFix696job6bI4juwRpJ.jpg,"[35, 18, 27, 10749]",552504,en,Zoo,A couple trying to save their marriage during a zombie apocalypse.,3.643,/sxd0D0NnTB5TZklh9MQ1CX7QZ5D.jpg,2019-04-05,Zoo,False,5.6,14
False,,[],633873,en,Scandalous,"The sensational true story of the most infamous tabloid in US history, a wild, probing look at how one newspaper's prescient grasp of its' readers darkest curiosities led it to massive profits and influence.",4.658,/5KmjX1tSmnedKlL0QWT7xxziDE0.jpg,2019-11-15,Scandalous,False,0.0,0
False,/lrTKanWOB7tyOrK2m93pffSJoaS.jpg,[99],606215,en,The Black Godfather,"Follows the life of Clarence Avant, the ultimate, uncensored mentor and behind-the-scenes rainmaker in music, film, TV and politics.",2.65,/3BQArnXPwM5nHeS1tlGKLY7eapP.jpg,2019-06-07,The Black Godfather,False,8.1,5
False,/r1zkXclXRldtzTqg6wM7e0X7Sqy.jpg,[27],464001,en,The Wake,"A group of friends attend the wake of a child they accidentally killed with their car. Once at the wake, they find themselves trapped and stalked by a masked assailant.",2.625,/73QJi3atWyro0nOXUGXRhvLsMgi.jpg,2017-07-04,The Wake,False,0.0,11
False,/24hJrdVUUM8y33esim4FyNentYI.jpg,[99],631143,en,QT8: The First Eight,"A detailed account of the life and artistic career of legendary filmmaker Quentin Tarantino, from his early days as a video club manager to the scandalous fall in disgrace of producer Harvey Weinstein. A story about how to shoot eight great movies and become an icon of modern pop culture.",5.993,/rGPwMYUeygsUAmo0NS8IPlhQEfH.jpg,2019-10-21,QT8: The First Eight,False,7.0,1
False,/1JoF4CuorEtns7zEnLCUysM04hf.jpg,[53],574883,en,An Affair to Die For,A weekend get-away for two lovers turns into a nightmare of psychological mind games when their infidelity is discovered.,4.212,/Vo4vUGaE081biscSRiacl9agmE.jpg,2019-02-01,An Affair to Die For,False,5.3,17
False,,[],648719,en,UFC Fight Night 164 - Blachowicz vs. Jacare,205 lbs.: Jan Blachowicz vs. Ronaldo Souza |  205 lbs.: Mauricio Rua vs. Paul Craig |  155 lbs.: Jared Gordon vs. Charles Oliveira |  185 lbs.: Antonio Arroyo vs. Andre Muniz | 185 lbs.: Markus Perez vs. Wellington Turman,3.904,/eeYZp0sJKc1oqtsYXkgSXgnO82d.jpg,2019-11-16,UFC Fight Night 164 - Blachowicz vs. Jacare,False,0.0,0
False,,"[27, 53]",546724,en,We Summon the Darkness,"The film is set in the Midwest against a backdrop involving a killing spree thought to be orchestrated by a satanic cult. Three best friends embark on a road trip to a heavy-metal show, where they bond with three aspiring musicians and head off to one of the girls’ country home for an afterparty. A night of fun and youthful debauchery takes a deadly turn as bodies begin to pile up, with each side thinking the other hides the killer.",4.134,/cuNUTCaeCkyRvE2CjdiayElMbTl.jpg,2019-12-31,We Summon the Darkness,False,0.0,0
False,/8MZKF3ibAIkVgeOBdT8Gi32NxWs.jpg,"[28, 18]",611048,en,WWE Extreme Rules 2019,"Extreme Rules 2019 is an upcoming professional wrestling pay-per-view and WWE Network event produced by WWE for their Raw and SmackDown brands. It will take place on July 14, 2019 at the Wells Fargo Center in Philadelphia, Pennsylvania. It will be the eleventh event under the Extreme Rules chronology.",2.923,/5iI0mAwkduTOpHeMq6LkcGjDUuB.jpg,2019-07-14,WWE Extreme Rules 2019,False,8.4,5
False,,"[27, 99]",630291,en,VHS Nasty,"In the 80’s, a legendary cult following like no other developed during the VHS era, those that loved The Video Nasty! Explore all the greatest cult video titles such as Faces of Death to Cannibal Holocaust.",4.878,/zpRw90uIokHJ2DxWvTmPDsN8E94.jpg,2019-09-10,VHS Nasty,False,0.0,0
False,/clNr5dOUmK7uyTKt1lNWexCYVQb.jpg,[27],644672,en,Pickaxe,"1982: The survivors of a series of brutal killings in a small town thought mass murderer Alex Black was dead and buried after the townspeople put an end to him. But teenagers experimenting with the occult awaken the monster from his grave and he begins another rampage of terror with his favorite tool, a pickaxe. Only those who have faced him before have any chance of stopping Alex Black once and for all.",4.191,/cGRfYcJXB8LU7Wj4DxZI5dOR7JS.jpg,2019-01-01,Pickaxe,False,0.0,0
False,/kMvnBCfMff6VQjQCVwwX7LPHtMb.jpg,[53],609338,en,Radio Silence,"Relationship Therapist, Dr. Jill Peterman, had the highest-rated call-in radio show when her world was pulled out from under her following the on-air suicide of a female caller named Alexis. Shaken to her core, Dr. Jill walked away from her show vowing she would never go back. That is until Stuart, the station's General Manager, pleads with her to reboot the show in an effort to bring followers back to the station. Still haunted by what happened, Jill agrees to help her friend out and believes this will be the perfect remedy to put her year-long anxiety to rest. As Jill starts to settle back into her show, mysterious call-ins start happening forcing her to believe there could be a copy-cat out there. What Jill begins to uncover is a web of secrets and lies stemming from the mysterious voice she has come to know as Alexis.",2.546,/e62fYkHvFDQXU4kFbAMfFXUuIBn.jpg,2019-04-12,Radio Silence,False,5.5,25
False,/dCJn8v0S5X4oy5Ozg8kTdlGCKcV.jpg,"[99, 10402]",588226,en,Woodstock: Three Days That Defined a Generation,"50 years after the legendary fest, Barak Goodman’s electric retelling of Woodstock, from the point of view of those who were on the ground, evokes the freedom, passion, community, and joy the three-day music festival created.",3.994,/ejPrzjG17UrYHjUn8xE3EAYnoDl.jpg,2019-05-24,Woodstock: Three Days That Defined a Generation,False,7.7,17
False,/n7fqTR8KtWGZi5FornA2AKkPJNz.jpg,[],643938,en,Mistletoe & Menorahs,"When a determined toy company executive, Christy, must learn about Hanukkah in a hurry in order to land a big account, she enlists the help of her co-worker's friend Jonathan, who happens to also be in desperate need of turning his bachelor pad into a Christmas Wonderland to impress his girlfriend's father.",4.044,,2019-12-07,Mistletoe & Menorahs,False,0.0,0
False,/jc64XQudNeNsQbSwb1XtpY9ujxl.jpg,"[27, 9648, 53]",590164,en,Mercy Black,"Fifteen years after conjuring an imaginary phantom known as Mercy Black, a repentant woman returns to her hometown to live with her sister and young nephew. But as Mercy continues to haunt her and the death count rises, she must face her deepest terror and discover the truth of her past before Mercy Black claims her nephew. Daniella Pineda, Austin Amelio, Elle LaMont, Miles Emmons, Lee Eddy, and Janeane Garofalo star in this terrifying story of regret, redemption, and the dark side of belief.",3.52,/6e0eblwQS11J5ZBb5PNoigCKWGB.jpg,2019-03-31,Mercy Black,False,5.1,27
False,/4iqQBJxpLQEj5WF4V0PYd2iO5mO.jpg,[10749],626301,en,Matchmaker Christmas,"As the Christmas party for a book publishing company approaches, editor Maggie volunteers to help her boss Amanda find a date. Matchmaking is a bit of a hobby for Maggie, but she is thrown off her game when Jaxson, her old boyfriend from her college years, shows up at her work — as a newly signed, successful author. Maggie would love to deny she feels anything for him still, but Jaxson isn’t making it easy. She’ll have to face her decisions of the past, along with Amanda eyeing Jaxson, to bring together the perfect matches at Christmas.",4.55,/5AYieDYNPhNqiCUcL0fXrhsLWWB.jpg,2019-12-14,Matchmaker Christmas,False,0.0,0
False,/1RX0hTKyPTPMNDmgYf17LVoSP3x.jpg,[878],614715,en,2177: The San Francisco Love Hacker Crimes,"A man wakes up after an attempt on his life, with no memory of who he is. He suddenly finds himself on the run with his would-be assassin. His wife, a hard-edged, cool-headed police officer, begins a desperate search to find him. A move that could end her career.",3.015,/tT7Xovu3sqzkKs0AJyJiny8nLPq.jpg,2019-07-09,2177: The San Francisco Love Hacker Crimes,False,0.0,0
False,/gcZhRRsXYnjzrYJwLJSyeb7jgb3.jpg,[18],463157,en,Jellyfish,"In Margate, England, life is not easy for teenager Sarah Taylor, between being bullied at school, being exploited by a dominant boss and having to take care of her depressive mother and her two siblings. But Sarah finds a way to channel her growing despair and fight adversity when her drama teacher gives her a new purpose.",3.245,/vfTlJE4vZHgqQERjQbZ1W8JkHM5.jpg,2018-04-20,Jellyfish,False,8.7,10
False,/bz9BjFqu0odM9qjOL0Vc3HITi4W.jpg,[35],592348,en,The Trap,A man returns home to Atlanta to help and turn around his family's struggling restaurant with the help of a new chicken recipe.,4.212,/4x1ggUFGyBEGC6p2qvog38eCaie.jpg,2019-04-01,The Trap,False,4.9,29
False,,[18],646743,en,Rachelle's House Pt. 2,"After the events of the first film, Jonathan, an innocent 16 year old boy, is a complete mess. However, a hope arises after his father receives a text from Rachelle, who has just gotten out of the hospital. In a desperate attempt to fix things, he's goes back to the place where all his problems started.",5.248,,2019-11-28,Rachelle's House Pt. 2,False,0.0,0
False,/vNYnOjQJykFModnm0e7jpnVTryG.jpg,[99],554967,fr,Varda par Agnès,"An unpredictable documentary from a fascinating storyteller, Agnès Varda’s last film sheds light on her experience as a director, bringing a personal insight to what she calls “cine-writing,” traveling from Rue Daguerre in Paris to Los Angeles and Beijing.",5.264,/99xU63PePSbtffV5CUqPQYu84XY.jpg,2019-09-28,Varda by Agnès,False,8.6,12
False,/uk4Tb0SrJFBowZgi0zCj2szm78M.jpg,"[18, 10749, 10751, 10770]",626310,en,Two Turtle Doves,"Dr. Sharon Hayes searches for a beloved family heirloom in a small Christmas town. When she unexpectedly discovers an adorable little girl and her disheartened father, she realizes that Christmas miracles really do happen.",3.918,/hmZQPFc0GXbHvzHuofPksWK0isX.jpg,2019-11-01,Two Turtle Doves,False,0.0,0
False,/znV9hAFBVH5dl49RIGy1hHsQUs7.jpg,[35],581958,en,Amy Schumer: Growing,"Amy Schumer's live stand-up set performed in Chicago where she jokes about marriage, pregnancy and personal growth.",3.3,/zZJYPkiCI0PFv8tUc8qViyC2oKx.jpg,2019-03-19,Amy Schumer: Growing,False,6.5,45
False,/4q4PeZzovaZ418KBARiuxDimm8p.jpg,"[12, 16, 35, 10751]",522887,en,Manou the Swift,"The little swift Manou grows up believing he's a seagull. Learning to fly he finds out he never will be. Shocked, he runs away from home. He meets birds of his own species and finds out who he really is. When both seagulls and swifts face a dangerous threat, Manou becomes the hero of the day.",5.806,/boUXx3KWFkhYe8OllT1VCfI2kpu.jpg,2019-05-31,Manou the Swift,False,6.8,4
False,/bPwnn6anCunMyRGprmcoA7JuCxi.jpg,"[27, 53]",585604,en,Wake Up,"When a psychiatric doctor researches a young girls' diary to find out why she murdered her entire family, he begins to fall into the same state of insomnia and confusion that led her to lose her mind.",2.506,/fEkm1mCazidlLODeGVgxkz4lWwz.jpg,2019-01-19,Wake Up,False,4.1,5
False,/2eBptXo5yl9npMd40mn6hjQShQw.jpg,"[35, 18]",601801,hi,Chopsticks,A gifted but insecure woman is in for a transformative experience when she enlists the help of an enigmatic con artist to recover her stolen car,2.504,/q8ufAWw9Ewy97sbcaunxcs4Q6WM.jpg,2019-05-31,Chopsticks,False,6.4,20
False,/jLihDNNL0izIcV7dCoEqgt6TIEv.jpg,[27],600892,en,The Odds,"A young woman enlists in an underground game of pain endurance in the hope of winning the million dollar prize. She soon learns the real opponent is the man who's running the game, as he employs horrific methods to manipulate and defeat her.",3.228,/194hQHMIxAHlCUb0xhPBiYhrrw4.jpg,2019-06-04,The Odds,False,6.2,10
False,/4srcbGDQhvKh9g3Z7nezvGfZXTI.jpg,"[80, 18, 36, 10749]",481117,en,The Brawler,"The true story of underdog boxer, Chuck Wepner, who gets a shot to fight the champ, Muhammed Ali.",3.861,/f3nJWpGpxgTR66lLvcoFMsZZuFY.jpg,2019-01-18,The Brawler,False,5.0,6
False,/iN4r5yyYWDNJrdgxXl738pYfhmt.jpg,[37],628784,en,Once Upon a Time in Deadwood,"A notorious gunslinger is slipped a slow-acting poison by an heiress and told he has three days to track down and rescue her sister, who has been kidnapped by a gang of hoodlums and holds the antidote.",4.239,/meiO1ubAPBcHouNSSBisTThd27p.jpg,2019-10-01,Once Upon a Time in Deadwood,False,4.0,1
False,,[10749],627483,en,Rediscovering Christmas,"Mia is a window dresser in a big city department store, living and breathing Christmas for months to get the store ready for the holidays. But now that the season is actually near, all she wants is a tropical beach getaway with her sister Sara. However, plans change when Sara begs for Mia's help putting on the annual Snowflake festival in their home town in Vermont. Just when she thought she was out - Santa pulls her back in!",4.494,,2019-12-15,Rediscovering Christmas,False,0.0,0
False,/d07GC77PhODrbo7sR4myUFbr7Mj.jpg,"[28, 878]",482034,en,Riot Girls,"In an alternate 1995, a mysterious disease has wiped out all of the adults. In this new age, two gangs are pitted against each other in a brutal war for territory, resources and survival. ​",4.054,/4b4gPmANpH26aeWSQYlg1YpVbXu.jpg,2019-09-13,Riot Girls,False,4.6,6
False,/o2GdB7rVzEjkheqPlXD6RyaiDHu.jpg,[],642553,en,To Be of Service,"A documentary film about veterans with PTSD who find that, after other treatments fall short, a service dog helps them return to an independent feeling life.",3.661,/iVVsVb9UUzhG8HuF9cRS9ULwpZm.jpg,2019-11-01,To Be of Service,False,0.0,0
False,/5l31e1JjJitPZZLJub7WtbW5dsR.jpg,"[18, 10749, 10770]",626280,en,Radio Christmas,"When her Philadelphia radio station is closed for repairs during the holidays, DJ Kara Porter is forced to broadcast from the small town of Bethlehem. Desperate to increase her numbers and get promoted outside of Radio Christmas – a year-round Christmas station, Kara seeks to uncover the identity of the town's Secret Santa, an anonymous benefactor that saved all of Bethlehem's Christmas festivities. Along the way, she discovers the true meaning of family, community, love and of course, Christmas.",4.389,/9lObIVlM3oyy96ZPX08JBrDD3YY.jpg,2019-11-09,Radio Christmas,False,4.5,2
False,/yjSO3pez5Y6jveO5M8Sspd8hzjy.jpg,[35],642661,en,Arsenio Hall: Smart and Classy,"In his first stand-up special, Arsenio Hall discusses getting older, the changing times and culture, social issues and even bothersome baby toes.",4.434,/r0LpBvpZOXKCuI2zyJkSP0aAGaT.jpg,2019-10-29,Arsenio Hall: Smart and Classy,False,6.0,4
False,/2VHMHkEIBNC0jhScbYlafKeVOcu.jpg,"[10749, 10770]",570189,en,One Winter Proposal,"Cara and Ben return to the resort where they fell in love a year earlier. They invite her friend Megan, hoping she'll reconnect with Ben's friend Sean, now the resort's doctor. During the trip Cara finds a jewelry receipt, leading her to expect a proposal from Ben, but a misunderstanding may ice his plan.",2.461,/nmoISl7P17nHREr5aCogmm1COaI.jpg,2019-01-12,One Winter Proposal,False,7.2,8
False,/y1WIEyWYN6djFv4ebIx3gKWuJyw.jpg,"[878, 53]",600836,en,Project Ithaca,Five strangers awaken to find themselves trapped aboard an alien spaceship that seems to be harnessing their terror to power the ship. They begin to understand that these species have been abducting humans for decades and possibly centuries.,4.331,/b1ku6nZmy3XEtPWA3HnrQ4zuJRk.jpg,2019-06-07,Project Ithaca,False,5.8,12
False,/mLon2n6Vgehg6RdlCCZMzweRI99.jpg,[27],517166,en,The Axiom,"At the risk of her group's safety, a young woman travels into a National Forest where her sister has become trapped in a multi-dimensional world of monsters.",4.525,/yvjNGoFJcUQD5qStnjIpn424GxD.jpg,2018-12-07,The Axiom,False,5.9,19
False,/wXi3KtVDiTCXXtf0odDCRDW6pOf.jpg,"[35, 27]",530076,en,Corporate Animals,"Disaster strikes when the egotistical CEO of an edible cutlery company leads her long-suffering staff on a corporate team-building trip in New Mexico. Trapped underground, this mismatched and disgruntled group must pull together to survive.",3.974,/nFiJwUXiKLcsblGKvUPHyGjLEn7.jpg,2019-09-20,Corporate Animals,False,5.2,11
False,/w1mFmoZ5ZS5O5HrpifBHDFuA6Bh.jpg,"[27, 53]",580630,en,Girl on the Third Floor,"Don Koch tries to renovate a rundown mansion with a sordid history for his growing family, only to learn that the house has other plans.",2.692,/qeEptluyFULHQLRFnVPKgp8ecLb.jpg,2019-03-10,Girl on the Third Floor,False,4.8,17
False,/nAUAqoaP2qrCdQWNecoXIQ3U93O.jpg,"[16, 10751, 18]",574074,en,Kitbull,"An unlikely connection sparks between two creatures: a fiercely independent stray kitten and a pit bull. Together, they experience friendship for the first time.",3.759,/8qblK8VqWOxrUWeJYkBszqYmW12.jpg,2019-01-18,Kitbull,False,8.3,53
False,/jPh2rJw92Tfgdnra2mU5d54Tgvx.jpg,[],639633,en,UFC on ESPN 6: Reyes vs. Weidman,205 lbs.: Dominick Reyes vs. Chris Weidman |  145 lbs.: Yair Rodrigues vs. Jeremy Stephens |  265 lbs.: Greg Hardy vs. Ben Sosoli |  155 lbs.: Joe Lauzon vs. Jonathan Pearce |  125 lbs.: Maycee Barber vs. Gillian Robertson |  205 lbs.: Deron Winn vs. Darren Stewart,4.131,/qfLxepfg1TTx8v2nhQ7pHDjnDH2.jpg,2019-10-18,UFC on ESPN 6: Reyes vs. Weidman,False,7.0,1
False,/dk8J1nBPjj5b3gDVAFgjjOYmrHd.jpg,"[35, 18]",537792,en,Papi Chulo,A lonely TV weatherman strikes up an unusual friendship with a middle-aged Latino migrant worker.,3.456,/i8m5Kn8o0LeNQLhxuNlBU6B3Kh1.jpg,2019-06-07,Papi Chulo,False,6.2,8
False,/xvNR7JKO1RnV7XipScN6OYk5OPp.jpg,[53],502805,en,Ladyworld,"After a catastrophic event, eight girls find themselves stranded in a house without electricity. As they run out of food and water, their sanity begins to crumble, and soon they regress to their baser instincts.",2.88,/zF3TesrjJ95LkQvfH1xP835ggj5.jpg,2018-09-22,Ladyworld,False,9.0,1
False,,[],545635,en,Garrison 7: The Fallen,"When an elite special forces commander accidentally uncovers an insidious military conspiracy, his family is brutally murdered. Now the target of an intergalactic manhunt, they will stop at nothing to silence him.",3.604,/t57cpr8fN1DBi4EPu9ebqXQdXtA.jpg,2019-12-31,Garrison 7: The Fallen,False,0.0,0
False,/cXcuFmyZGJWlBX5ww92Heaa9S9u.jpg,"[16, 12, 878, 9648, 18]",526426,ja,メイドインアビス 旅立ちの夜明け,"The enigmatic Abyss is an unforgiving and deadly place. Despite the dangers, it still captures the imagination of explorers such as Riko who wishes to follow in her mother's footsteps and trains hard to become a Cave Raider. One day, she receives news that her mother died in the Abyss, yet a mysterious note tells Riko that her mother may still be alive. Vowing to uncover the truth about her mother's fate, Riko embarks on a journey with a humanoid robot boy named Reg. Together, they will discover if they have what it takes to survive where so many others have perished.",2.973,/2eORQu53KDtej7VvAm4462PmwT7.jpg,2019-03-15,Made in Abyss: Journey's Dawn,False,10.0,2
False,/b5baVPtwY8NuI0bptZaReuVdXh4.jpg,[99],514734,en,General Magic,"A tale of how the great vision and epic failure of General Magic, the ""greatest dead company in Silicon Valley"", changed the lives of billions.",3.468,/3bgwKDO3B3Bv6vyUwxL2kXVqrkt.jpg,2019-05-09,General Magic,False,8.2,9
False,/9PIiB9qNSmRvB6W7ETCv6AJGiFu.jpg,"[10749, 10770]",601383,en,A Feeling of Home,"Web entrepreneur Abby hides her Texas roots to convince a backer she's from New England, a task complicated by a trip home and an unexpected reunion with Ryan, her high school sweetheart.",2.425,/4hTNVmpEJe5F5BrjW08zptMqXNb.jpg,2019-05-11,A Feeling of Home,False,7.2,7
False,/8nsk04y7BH6cvft5UPjbjEu8MAw.jpg,"[80, 18, 9648]",477016,en,Out of Blue,"The hunt for a killer draws a detective into an even larger mystery: the nature of the universe itself. Mike Hoolihan is an unconventional New Orleans cop investigating the murder of renowned astrophysicist Jennifer Rockwell, a black hole expert found shot to death in her observatory.  As Mike tumbles down the rabbit hole of the disturbing, labyrinthine case, she finds herself grappling with increasingly existential questions of quantum mechanics, parallel universes, and exploding stars - cosmic secrets that may hold the key to unraveling the crime, while throwing into doubt her very understanding of reality.  Awash in dreamlike, neo-noir atmosphere, this one-of-a-kind thriller is both a tantalizing whodunnit and a rich, metaphysical mind-bender.",3.218,/k74DaMtAhnjeOGX6LIXsvwMStfK.jpg,2019-03-22,Out of Blue,False,5.2,18
False,/lNScjwDQDqyTOolHeY9NvCaZrVa.jpg,[99],597237,en,Calum Von Moger: Unbroken,"To many in the bodybuilding world, Calum Von Moger is seen as the future of the sport. A two time Mr. Universe champion who has proven himself to have one of the greatest physiques currently on the professional stage; Calum was catapulted into social media stardom. Known for his resemblance to Arnold Schwarzenegger and dubbed Arnold 2.0.  But a sudden and tragic bicep tear brought his training and goals to a grinding halt. Losing dozens of pounds of muscle and unable to train until fully recovering – Calum was forced to reassess his bodybuilding path and find a way to fight back up to the top. Calum Von Moger: Unbroken chronicles his rise, fall, and now recovery as he moves into a promising career in television and film.  Showcasing a man with an indomitable will that overcomes all the hurdles in his path and taking him to a place that both skeptics and doctors thought was impossible.",3.217,/aaHxTzR44BhOzB1geddwKU2a8tW.jpg,2019-05-10,Calum Von Moger: Unbroken,False,7.3,9
False,/4rorbsMf9geqFOeKhG8VttDqwAH.jpg,"[35, 99]",568693,en,The Amazing Johnathan Documentary,"What begins as a documentary following the final tour of a dying magician—""The Amazing Johnathan""—becomes an unexpected and increasingly bizarre journey as the filmmaker struggles to separate truth from illusion.",3.846,/gduS1BqSJ2Jg6XiG9HvR1IAtu60.jpg,2019-08-16,The Amazing Johnathan Documentary,False,5.7,12
False,,"[28, 878, 53]",609024,en,San Andreas Mega Quake,"Scientists make a horrible discovery: The ""Big One"" is coming in two days, with it, California will sink to the ocean. Their only hope is to rupture a volcano that will displace the earthquake's energy and build a new crust on the surface. But as fore-shocks turn California into chaos, it's a race against time the scientists might not win.",2.831,/bXWk1U1TBhXtD0VVkTOG86ZoZ3Q.jpg,2019-04-03,San Andreas Mega Quake,False,4.9,5
False,/5FdV75lUefV3dt4qpK5uFUiZIg1.jpg,"[35, 18]",575381,en,Changeland,"Follow two estranged best friends on an epic, life-changing adventure in Thailand as they're reminded that there's no problem that friendship and a few rounds in a Muay Thai boxing ring can't fix.",2.41,/zbH4zrlQS4AVwfUkz8ZTcNX1CSp.jpg,2019-06-07,Changeland,False,6.4,5
False,/vPK8ZCyQ7gQ34ve6Yk2EdmM0dx2.jpg,[99],639834,en,League of Legends Origins,"Fans, experts and creators of “League of Legends” detail the game’s rise from free demo to global esports titan.",4.427,/9jB42Dvqo3ITaHlbS4VDRS7EnLl.jpg,2019-10-16,League of Legends Origins,False,7.5,12
