adult,backdrop_path,genre_ids,id,original_language,original_title,overview,popularity,poster_path,release_date,title,video,vote_average,vote_count
False,/12r1Oi9NRBgvguZYE1mpFXkdsh6.jpg,"[80, 53, 18, 9648]",609189,en,Into the Ashes,"With an honest job and a loving wife, Nick Brenner believed he had safely escaped his violent, criminal history. But his old crew hasn't forgotten about him or the money he stole, and when they take what Nick now values the most - his wife - he has nothing left to lose. Confronted by the town sheriff, who is also his father-in-law, Nick must decide if he will stay on his new path or indulge in his need for revenge and force his enemies to pay for what they have done.",4.851,/xSTsGP8EUVk26L1khj6uOv2n3f9.jpg,2019-07-19,Into the Ashes,False,4.8,20
False,,[],631414,en,A Family Christmas Gift,coming soon!,5.563,,2019-12-20,A Family Christmas Gift,False,0.0,0
False,,[10749],630926,en,"New Year, New Me",Aimee Teegarden focuses on new beginnings and midnight kisses in this New Years-themed movie.,4.646,,2019-12-28,"New Year, New Me",False,0.0,0
False,/zxY1yP9FjJpV7T3hxqBBI5WNydx.jpg,"[18, 10752]",403300,en,A Hidden Life,"The Austrian Blessed Franz Jägerstätter, a conscientious objector, refuses to fight for the Nazis in World War II.",7.994,/rdG4jfH0rxkB2FgkYmjj9V4Q31M.jpg,2019-12-13,A Hidden Life,False,0.0,0
False,/9Eo76yn771UKKNdmfg04XuK0yHk.jpg,"[27, 9648, 53]",456529,en,Jacob's Ladder,"After losing his brother in combat, Jacob Singer returns home from Afghanistan -- only to be pulled into a mind-twisting state of paranoia. Singer soon realizes that his sibling is alive but life is not what it seems.",4.779,/wIlmYRxrIVBo90ITVBCCbTqUZE3.jpg,2019-08-23,Jacob's Ladder,False,5.8,16
False,/5IvdKtZiUN8lBvWKzQRu5ycQOM0.jpg,[99],541576,en,Meeting Gorbachev,"Mikhail Gorbachev, former president of the Soviet Union, sits down with filmmaker Werner Herzog to discuss his many achievements. Topics include the talks to reduce nuclear weapons, the reunification of Germany and the dissolution of his country.",3.872,/c26Fxzsj39wXVqxeKEUhWuAIlrT.jpg,2019-05-03,Meeting Gorbachev,False,8.5,6
False,/svlMtjtTjzrJscBddEvZ7sFACum.jpg,"[18, 9648, 53]",516630,en,The Standoff at Sparrow Creek,"After a mass shooting at a police funeral, reclusive ex-cop Gannon finds himself unwittingly forced out of retirement when he realizes that the killer belongs to the same militia he joined after quitting the force. Understanding that the shooting could set off a chain reaction of copycat violence across the country, Gannon quarantines his fellow militiamen in the remote lumber mill they call their headquarters. There, he sets about a series of grueling interrogations, intent on ferreting out the killer and turning him over to the authorities to prevent further bloodshed.",3.929,/uCyDJGQ54vcCclNqa6nLcSqH3DQ.jpg,2019-01-18,The Standoff at Sparrow Creek,False,6.6,34
False,,"[99, 10402]",601516,en,ReMastered: The Lion's Share,"After discovering the family of Solomon Linda, the writer of ""The Lion Sleeps Tonight,"" a reporter tries to help them fight for fair compensation.",4.844,/lI2g8uRCVUFvchfq8wbwu39tQOx.jpg,2019-05-17,ReMastered: The Lion's Share,False,6.9,5
False,/aIgSmuJg33djRkNpVuIiPjB45sU.jpg,"[35, 27, 53]",520905,en,Tone-Deaf,"A woman leaves for a quiet weekend in the country after losing her job and imploding her latest dysfunctional relationship.  She rents a country house from an old-fashioned widower who’s struggling to hide his psychopathic tendencies. Soon, two generations collide with terrifying results.",7.297,/1yHOLVfLHnbAHYqxV2PwtE32kBm.jpg,2019-03-10,Tone-Deaf,False,5.7,21
False,/5Gtga5OPnLM9rJKCB2O2vBpZf5C.jpg,"[28, 878]",589594,en,Abduction,"A man steps out of a park fountain in Ho Chi Minh City with no recollection of who he is or where he came from. As he wanders through the city, piecing together clues to his past, he is relentlessly pursued by mysterious figures.",5.5,/f5xajzsFuTnXfx3dTHsMA8F9FF2.jpg,2019-03-20,Abduction,False,4.5,11
False,/vOjLYl87djbEieifpZNwFSqLcP6.jpg,"[16, 14, 10749]",573699,zh,白蛇：缘起,The story follows the Chinese fable the Legend of the White Snake and focuses on a hunter and a snake disguised as a human hunter.,5.383,/9nxs7YlmGERa9dQbRPZXopfcp51.jpg,2019-11-29,White Snake,False,7.6,16
False,,[18],592128,en,Mob Town,"The story about the famed meeting of the heads of the Mafia in 1957 in upstate Apalachin, NY.",4.31,/gMygFT7GbqI3NH6YpEgRnnoWvQx.jpg,2019-12-13,Mob Town,False,0.0,0
False,,[35],582313,en,Ex Gratia,"When you’re in a relationship, you often share clothing items like sweatshirts, or t-shirts. When  you break up, you want it back, but the interaction is just too awkward. Curtis, a nerd with a  secret agenda, breaks into people’s homes to retrieve them for those that have been dumped. One  night, he breaks into a home and meets Sam, a curious frat boy who wants to get to the bottom of  the burglar’s identity. An unexpected friendship is born when identities are revealed, and Curtis  gets a new teammate.",5.388,,2019-12-02,Ex Gratia,False,0.0,0
False,,[10749],630922,en,An Unforgettable Christmas,Twilight's Ashley Greene leads this brand-new holiday movie.,4.577,,2019-12-19,An Unforgettable Christmas,False,0.0,0
False,/fFI2MuuA2gRRFuYVKMdVWojPmHW.jpg,"[18, 9648, 53]",411144,en,We Have Always Lived in the Castle,"In Shirleyville, Vermont, during the sixties, sisters Merricat and Constance, along with their ailing uncle Julian, confined to a wheelchair, live isolated in a big mansion located on the hill overlooking the town, tormented by the memories of a family tragedy occurred six years ago. The arrival of cousin Charles will threaten the fragile equilibrium of their minds, haunted by madness, fear and superstition.",6.297,/ejp1MQSlekBjH3bBJrBlWItpmQW.jpg,2019-05-17,We Have Always Lived in the Castle,False,5.3,62
False,,[],642749,en,Jeff Garlin: Our Man in Chicago,"Comedian Jeff Garlin (unintentionally) celebrates his 37th year of stand-up and shares his learnings on love, loss, success and food addiction.",5.616,/uuuOK7WxR6KAAsoyNidiV3kqusS.jpg,2019-11-12,Jeff Garlin: Our Man in Chicago,False,6.7,3
False,/uDR8SzmElPEBNeCDzolg6M8KAkb.jpg,[99],509904,en,Roll Red Roll,"At a 2012 pre-season high-school football party in Steubenville, Ohio, a young woman was raped by members of the beloved high school football team. The aftermath exposed an entire culture of complicity—and Roll Red Roll maps out the roles that peer pressure, denial, sports machismo, and social media each played in the tragedy.",4.293,/3ZW55n8xCLNdzFstezMHPvU7zDX.jpg,2019-03-22,Roll Red Roll,False,7.1,21
False,/4cmC0Pe090HODu4AHEL9AZqKz9q.jpg,"[99, 10402]",617773,en,Western Stars,"The incomparable Bruce Springsteen performs his critically acclaimed latest album and muses on life, rock, and the American dream, in this intimate and personal concert film co-directed by Thom Zimny and Springsteen himself.",5.376,/aT5lsPynkYhDgFZH48jdNLobnZY.jpg,2019-10-25,Western Stars,False,7.8,6
False,/nRy3xj6BqoQxu6x9XJfq4XQUZrA.jpg,[99],553645,en,ReMastered: Devil at the Crossroads,"Robert Johnson was one of the most influential blues guitarists ever. Even before his early death, fans wondered if he'd made a pact with the Devil.",5.764,/mZHuM1rUJcXHRMgff35gGZmu7xF.jpg,2019-04-26,ReMastered: Devil at the Crossroads,False,7.2,28
False,/jQ6Rsrm89QmTJoRZLaqmpOwcxzF.jpg,[99],565719,en,Hail Satan?,"A look at the intersection of religion and activism, tracing the rise of The Satanic Temple: only six years old and already one of the most controversial religious movements in American history. The Temple is calling for a Satanic revolution to save the nation's soul. But are they for real?",4.422,/lwP8CMOfPJhkMyxELgX2D2aDZfy.jpg,2019-04-19,Hail Satan?,False,7.4,25
False,,[35],582314,en,She Hears White Petals,"She Hears White Petals follows the theatre production of a 20th century play, recently discovered in the attic of a famous playwright. This dark comedy focuses on the frustrations and efforts of the actors and director as they deal with challenges that threaten the production and the wellbeing of everyone involved.",5.129,,2019-12-02,She Hears White Petals,False,0.0,0
False,/rjmoBwFOyeOiF8qK9sazDmlvUst.jpg,"[10749, 10770]",626327,en,Holiday for Heroes,A woman and a soldier exchange letters for a year before their worlds collide.,5.278,/bzOiSChaO0eU7zBn45IJN5fTiYB.jpg,2019-11-08,Holiday for Heroes,False,3.5,2
False,/s9YhmrLZ9ndEig1UuMwbMgC3JgE.jpg,[27],491132,en,Before Someone Gets Hurt,"Tim and his team are the rising stars of the ghost hunting game. One thing they all like better than a good haunt is a great prank. When the team arrives at a new investigation, they cannot figure if the occurrences are part of some elaborate master prank or if the house is actually haunted. Unfortunately, they don't find the answer until it is far too late.",3.839,/dUgoy8qSCZ5Y5pBiu5ipufvS16d.jpg,2018-07-01,Before Someone Gets Hurt,False,7.5,14
False,,[18],575958,en,Mickey and the Bear,"In Anaconda, Montana, a strong-willed teenage girl navigates a loving but volatile relationship with her veteran father. In a desperate search for independence and her own identity, she risks family, heartbreak, and her standing in the only place she can call home.",4.481,/tk9PKt6tjPVx6jJmWdGR1XG4RTp.jpg,2019-11-13,Mickey and the Bear,False,0.0,0
False,,"[99, 18, 36, 27, 10402, 53]",636674,en,Jesus,A graphic self portrait of the self and the darkest parts of the human subconscious by looking at the last day of life of GG Allin.,5.453,/xFtnTctnPS9TEby1oR1WeQgozqM.jpg,2019-12-01,Jesus,False,0.0,0
False,/qIKjPZ4EvK8mQh4IUHwgLT2Imtc.jpg,"[878, 53]",586707,en,Life Like,"An idealistic attractive young couple acquires a stunning, life-like robot for guilt free help, but as the three grow closer, their perception of humanity will be altered forever.",4.023,/uOVGbT6TR8qiZiruX66yBRXq9Nv.jpg,2019-05-14,Life Like,False,5.7,20
False,/9cRnfqZRBPg6HxY3baYjwGu4AzH.jpg,"[9648, 53]",543915,en,The Boat,A lone fisherman on his daily run finds himself lost in a thick fog which proves impossible to navigate. The worst is yet to come when his encounter with a seemingly abandoned sailboat becomes a fight for survival against an enemy unknown.,3.322,/AtPo855ENI0AeOXhkCHBEgTPMEa.jpg,2018-09-22,The Boat,False,5.3,18
False,,[],627494,en,When Calls the Heart Christmas 2019,"(5th holiday movie based on the television series, starring Erin Krakow, Jack Wagner, Pascale Hutton, Kavan Smith, Kevin McGarry, Chris McNally, Martin Cummins, Andrea Brooks and Paul Greene)",4.42,,2019-12-25,When Calls the Heart Christmas 2019,False,0.0,0
False,/fJzryEkRsqfZwj0smPSYL5HpGnq.jpg,[99],503257,en,Pick of the Litter,"Follows a litter of puppies from the moment they're born and begin their quest to become Guide Dogs for the Blind, the ultimate canine career. Cameras follow these pups through a two-year odyssey as they train to become dogs whose ultimate responsibility is to protect their blind partners from harm.",3.495,/9TQQ6hq4igBLXKEuFE2woI3rRY.jpg,2018-01-19,Pick of the Litter,False,7.6,12
False,/9VVyZl0ul9ZGn6iLDkRNzuFVvvj.jpg,[99],566368,en,One Child Nation,"Through interviews with both victims and instigators, Nanfu Wang, a first-time mother, breaks open decades of silence on a vast, unprecedented social experiment that shaped — and destroyed — countless lives in China.",6.446,/7sDzvNmjdJ9ShTPta5GhmZBIFwb.jpg,2019-08-09,One Child Nation,False,7.7,10
False,/yzvEeS1pyFH56p31Kc1NdrlVBvD.jpg,[99],642036,en,No Lye: An American Beauty Story,No Lye: An American Beauty Story is a documentary that chronicles the rise and decline of the black-owned ethnic beauty industry in America.,6.933,/tZKLBC9eWJDoxspuF0emkgbyPLG.jpg,2019-11-28,No Lye: An American Beauty Story,False,0.0,0
False,/npLi4Vuteu9lbdfeDxtxiaVHKAr.jpg,"[27, 53]",628707,en,Trick,A detective tries to track down a masked killer who reappears every Halloween to wreak bloody havoc.,7.019,/5e6x6ijLUYYWqGSX07EHIplyaP3.jpg,2019-10-18,Trick,False,5.3,7
False,,"[28, 12, 878]",451079,en,Micro,"A group of graduate students are lured to Hawaii to work for a mysterious biotech company — only to find themselves miniaturized and cast out into the rainforest, with nothing but their scientific expertise and wits to protect them.",4.564,,2019-12-31,Micro,False,0.0,0
False,/6Ezl3krpK1V1hW5gVZuSeioLQHo.jpg,[10749],626318,en,Christmas Town,"Lauren Gabriel leaves everything behind in Boston to embark on a new chapter in her life and career. But an unforeseen detour to the charming town of Grandon Falls has her discover unexpected new chapters - of the heart and of family - helping her to embrace, once again, the magic of Christmas.",6.44,/5OQaU5p8Sdi0DEU9oufQ756stFU.jpg,2019-12-01,Christmas Town,False,0.0,0
False,/r7IMgW20peKG9eqTsyaTInwZ5lZ.jpg,[18],517434,en,American Exit,"A dying father takes a road trip with his son, to try to rebuild his relationship before he dies.",3.338,/sRqff9JyOG4q03IeNHP5JKNcfat.jpg,2019-05-14,American Exit,False,6.3,6
False,,[99],523646,en,Lost in America,A documentary about the epidemic of homeless youth in America.,3.58,/uuYbvFXJmUzf6RapECyCcDAv3oK.jpg,2019-11-15,Lost in America,False,0.0,0
False,/aVAytJlQamO5wR55HnVjliJ9Ofu.jpg,"[28, 53]",634452,en,Art of Deception,"After uncovering the CIA’s ruthless master plan for world domination by gaining complete mind control over the entire population, top scientist Joseph Markham is ultimately left with a choice: save the lives of billions…or the life of his wife, who has been kidnapped, interrogated, and brutally tortured but continues to viciously fight for her life. As a nationwide manhunt ensues, deadly assassins pursue, and one man’s decision will determine the fate of the world. Art of Deception is about a fight for life, love and world dominance.",7.615,/5G102gLrSbjSxu0ECK7my21rynv.jpg,2019-10-08,Art of Deception,False,4.3,3
False,/2hFglgvKIW8nj52PW9YMQZSMHYn.jpg,"[12, 16, 35, 10751]",533715,ru,Большое путешествие,"A goofy stork mistakenly delivers a baby panda to the wrong door. A bear, a moose, a tiger and a rabbit set on an arduous but fun-filled adventure through the wilderness to return the panda to its rightful home.",5.05,/ekNS6gLvwdG0tU9Q5ovXjLcUL9x.jpg,2019-11-01,The Big Trip,False,6.6,5
False,/de51GG0AQZj8dUm00aQUi4wisBr.jpg,"[27, 53]",463843,en,Sweetheart,"Jenn has washed ashore a small tropical island and it doesn’t take her long to realize she’s completely alone. She must spend her days not only surviving the elements, but must also fend off the malevolent force that comes out each night.",5.184,/xyPPBPkGbZxfS6UM4PjR5bnVfwR.jpg,2019-01-28,Sweetheart,False,5.6,12
False,/6ogNP2NPN7C1LccE8PhjGaNMvdM.jpg,[35],620725,en,Jexi,"Phil's new phone comes with an unexpected feature, Jexi...an A.I. determined to keep him all to herself in a comedy about what can happen when you love your phone more than all else.",5.757,/pdYhXJPoV0Kvwdih74lejHPTyWL.jpg,2019-10-11,Jexi,False,7.3,18
False,/jlNR5Xcw9EWsezxxrXOUvrjVa7r.jpg,"[18, 27]",644009,en,One Winter Night,An Orthodox Jewish mother and her daughters fall prey to the malevolent forces that preside over a rural community.,4.776,/zivEeRopKwjvkvpYFDDs13Ndc5J.jpg,2019-12-13,One Winter Night,False,0.0,0
False,/dNPJMRVJnDl0Rr1mQvTDt98tazP.jpg,[18],499566,en,A Million Little Pieces,A young drug-addled writer approaching the bottom of his descent submits to two months of agonizing detox at a treatment center in Minnesota.,4.273,/loC9ptPrTT1e09frmddn6LU612d.jpg,2019-12-06,A Million Little Pieces,False,0.0,0
False,/5NTE4ZyckTSKLjEMxRClKcqe2yK.jpg,[35],642203,en,Seth Meyers: Lobby Baby,SNL alumnus and subversive master of late-night Seth Meyers comes out from behind the desk to share some lighthearted stories from his own life.,4.526,/i8g5RDvLwIjU3ui1r3CSoIJlqza.jpg,2019-11-05,Seth Meyers: Lobby Baby,False,7.4,17
False,,[18],620639,es,La hija de un ladrón,"Sara has been alone all her life. She’s 22, has a baby, and wants to form a normal family with her young brother and the father of her child. Her own father, Manuel, decides to come back into their lives after years of absence and his release from prison. Sara knows he’s the main obstacle to her plans and she makes a difficult decision: to distance him from herself and her brother.",5.24,/rYnhoXDmgt07qfqyJOhYOPqlfUh.jpg,2019-10-21,A Thief's Daughter,False,0.0,0
False,/6L4LISre666baQA9kFpfRTwDNuJ.jpg,[99],628039,en,"Hello, Privilege. It's Me, Chelsea","In this documentary, Chelsea Handler explores how white privilege impacts American culture -- and the ways it’s benefited her own life and career.",5.539,/x0tfMxPdkjFYort1BzkGJb7uGmg.jpg,2019-09-13,"Hello, Privilege. It's Me, Chelsea",False,5.4,16
False,,"[10749, 10751]",643076,en,Christmas Coupon,"Alison Grant begins teaching ice skating students on a friend's frozen pond after being fired from her rink job. On the first day of class her old high school sweetheart and now famous hockey player, Ivan Hall, unexpectedly shows up when he brings his niece for her skating lessons. While an initially cold reunion ensues, eventually Alison warms up to Ivan again. Dove Family Approved for all ages.",5.851,/4zonX18Cp8WwuVmx3QBM2zSC8F0.jpg,2019-12-02,Christmas Coupon,False,0.0,0
False,/voFUDCuXSGiZvV0esx6uQqWBH8h.jpg,"[80, 10749]",433499,en,Finding Steve McQueen,"In 1972, a gang of close-knit thieves from Youngstown, Ohio attempt to steal $30 million in illegal contributions. Based on the true story of the biggest bank heist in US history.",7.535,/uhmNHWTVniHHYKTsWSvSir19K1z.jpg,2019-03-15,Finding Steve McQueen,False,6.3,26
False,/9gyZJVNuaryqw8LVuRJ8hPUgXyg.jpg,[99],639007,en,The Portal,Documentary approach follows six people (and a robot) who transform their lives using stillness and mindfulness.,4.32,,2019-11-15,The Portal,False,0.0,0
False,,"[27, 53]",649120,en,My Name is Charlie Raine,"""My Name is Charlie Raine"" follows Charlie, a strange character that spends his free-time on an unusual hobby. Murdering people. After meeting Arabella, the female lead, Charlie catches an attraction towards her and slowly starts showing her his darker side.",7.531,/n7QkIvT587IBDdwVN5E1gfiIIYt.jpg,2019-11-25,My Name is Charlie Raine,False,0.0,0
False,/gVocq4M7VZogxINyW7x2BYySzyG.jpg,"[27, 53]",513421,en,Discarnate,A neuroscientist's obsession with a drug that expands the human mind inadvertently unleashes a deadly supernatural force on his team.,5.351,/5NAWW7zTG0zhrBfHk0sTy1hQlFb.jpg,2019-03-05,Discarnate,False,4.4,16
False,/JcRmVJ27ULgJz8Bvbkhv5HUWvC.jpg,"[18, 14]",635489,en,Full Count,"An unfortunate chain of events forces Milton Young to give up his dream of playing professional baseball and return home to the town he fought hard to escape. Once home, Milton faces insurmountable economic and personal hardships, only to be faced with an even greater challenge: defending himself against a Tragic crime that could send him to prison for life. What emerges is a heart-warming story about perseverance, faith, triumph, and the struggle to never let go of a dream.",6.411,/kHJ4q4e6d28KXzG8SWHT1CKB8F0.jpg,2019-10-25,Full Count,False,0.0,0
False,/6I25iC056xJiIlEkW4pio5z3Gnv.jpg,[18],507990,en,Run the Race,"Reeling from his mother’s death and his father’s abandonment, Zach, an All-State athlete, finds glory on the football field, working to earn a college scholarship and the brothers’ ticket out of town. When a devastating injury puts Zach—and his dreams—on the sidelines, David laces up his track cleats to salvage their future and point Zach toward hope.",3.57,/1myP5YdjENipbKZYbONxZwPN8KK.jpg,2019-02-22,Run the Race,False,7.7,15
False,/oCRlslQW3AlC8jOc9Wc964g9oXa.jpg,"[10749, 10770]",631420,en,The Mistletoe Secret,"Aria Eubank convinces a famous travel writer to do a feature story on her beloved hometown, however, when the travel guru and his ghostwriter both show up, Aria finds her heart torn between Sterling Masters and Alex Barlett, the man who has genuinely fallen for her.",4.409,/upyKcV61QJGIZFLXvACcCQVixAm.jpg,2019-11-10,The Mistletoe Secret,False,7.0,2
False,/cz9TAWdvlXwCJQ5cNBaQDU9coC7.jpg,[35],502149,en,Being Frank,A seventeen-year-old boy blackmails his father after discovering his secret second family,4.902,/3f9yRUkhYOAmPm5QRv6Oh6M6W0t.jpg,2019-06-14,Being Frank,False,7.4,8
False,/bveDvCEwfZ1lUNBv1QYWyHtDZtH.jpg,"[10770, 10402, 18]",557648,en,Rent,"The story of several friends in New York City facing financial poverty, homophobia, AIDS, and, of course, rent.",6.73,/bBeKKzRYmGVa3beJvzu85wZaVgA.jpg,2019-01-27,Rent,False,6.4,29
False,/a0F9luz7x1i6YFOYIhJJ9KzfpSN.jpg,"[28, 35, 27]",532649,en,Book of Monsters,"Sophie's 18th birthday becomes a bloodbath when monsters descend upon her house, devouring the guests and killing anyone who tries to leave. To survive the night, Sophie must face her destiny: monsters are real and she's the only one who can stop them.",3.198,/2yTwzpgMFteCVpNqFbNyDQyyLjv.jpg,2019-03-19,Book of Monsters,False,5.4,15
False,/iNbekyXaKSdI5J5fAELuPPGXxn0.jpg,[18],575813,zh,少年的你,"Nian is trying to get into shape for the state Gaokao exam. Her chances of getting a spot at university depend on her score and the constant bullying of her classmates is not helping much. Bei’s world is the street, with all its dark corners. A night-time encounter brings the shy schoolgirl together with the street-savvy trickster, Bei. When Nian’s school nemesis turns up dead, the new allies come under suspicion.",3.554,/8tfYgXxJyLQcXvz22zqqhX0ezbc.jpg,2019-11-08,Better Days,False,8.4,5
False,/iiu2uXbqAf2LXmEWqAqcnzaWjcu.jpg,"[28, 12, 878, 10770]",630322,en,Battle at Big Rock,A family's camping trip at Big Rock National Park is disrupted by dinosaurs.,5.428,/aFV96H0IiLnq5Q9hUY6H9jEkJzV.jpg,2019-09-15,Battle at Big Rock,False,7.3,29
False,,"[35, 18, 14, 10749]",623740,en,A Christmas Carol,Modernized take on Charles Dickens' novella.,6.841,/ntT5NMphz2u89aQoiTKKqpLiCvv.jpg,2019-12-02,A Christmas Carol,False,0.0,0
False,/wlZDpmnfVtdL8Jvcwu5BKKpM0vg.jpg,"[10749, 10770]",626307,en,Merry & Bright,"Cate, CEO of the Merry and Bright Candy Cane Company, meets Gabe during the busy Christmas season. She assumes Gabe is the suitor her well-meaning mother is trying to set her up with when in reality, he works for Empire Corporate Recovery, which has been hired to take a closer look at Merry and Bright's operation and find ways to make the company more profitable. As Cate and Gabe begin to work together, they find ways to elevate the business and find that they have more in common than savvy business sense.",4.181,/fAmRlmyNeigZBvAob5nw1OygGhM.jpg,2019-11-02,Merry & Bright,False,7.0,2
False,/duaRjNWKR3QjZOaWhHKxk9ZDIz3.jpg,[35],625128,en,Bill Burr: Paper Tiger,"Comedian Bill Burr talks male feminists, outrage culture, robot sex, and cultural appropriation in this standup comedy special shot in London.",5.495,/lgMykFh36wwlxkAvoIbB0utdvf5.jpg,2019-09-10,Bill Burr: Paper Tiger,False,7.3,32
False,/i42FWbAW3aQMpU6LTl0VCKfJfOm.jpg,"[53, 878]",462920,en,Perfect,A young man with a violent past enters a mysterious clinic where the patients wildly transform their bodies and minds using genetic engineering.,3.224,/5MFyTN89LOkCxgc7L846jK3ayz4.jpg,2019-05-17,Perfect,False,8.3,3
False,/9gHlUrKbNGAaMrcx6HHZdOf3rIM.jpg,[35],440762,en,Jay and Silent Bob Reboot,Jay and Silent Bob embark on a cross-country mission to stop Hollywood from rebooting the film based on their comic book counterparts Bluntman and Chronic.,7.354,/eO4TdjHlTXuu68qWodv5TOE0ae1.jpg,2019-10-15,Jay and Silent Bob Reboot,False,7.5,8
False,/aY15qmHdkkHat8ew54BJ2iA5HMu.jpg,"[18, 10749]",565391,en,The Tomorrow Man,"Ed Hemsler spends his life preparing for a disaster that may never come. Ronnie Meisner spends her life shopping for things she may never use. In a small town somewhere in America, these two people will try to find love while trying not to get lost in each other’s stuff.",4.464,/7YVxf3nUxrJ2xX4SU7Efp7LqPZ5.jpg,2019-05-22,The Tomorrow Man,False,5.5,11
False,/tlSmpcCQQ9bFnrSKoJDsBiB5Yx3.jpg,"[27, 53]",505060,en,The Gallows Act II,"When Ana Rue transfers to a prestigious new acting school, she encounters a malevolent spirit after participating in a viral challenge.",4.322,/h2OCcYwUGqSBvqHjE3QBtTNeKXY.jpg,2019-10-25,The Gallows Act II,False,5.8,6
False,,"[10402, 35]",607181,en,Kinky Boots: The Musical,"Inspired by true events, this huge-hearted hit tells the story of two people with nothing in common – or so they think. Charlie is a factory owner struggling to save his family business, and Lola is a fabulous entertainer with a wildly exciting idea. With a little compassion and a lot of understanding, this unexpected pair learn to embrace their differences and create a line of sturdy stilettos unlike any the world has ever seen! But in the end, their most sensational achievement is their friendship.",3.984,/20QfQHWGw0ZSfYaSinnsJoiVZCd.jpg,2019-06-25,Kinky Boots: The Musical,False,9.5,11
False,/7biz71TRrY2Iyqqz95gLDkLBSJd.jpg,[99],604927,en,Liberty: Mother of Exiles,A look at the history of the Statue of Liberty and the meaning of sculptor Auguste Bartholdi's creation to people around the world.,4.401,/53ELyruFO45zyvbJfyVtDYbN1aw.jpg,2019-10-24,Liberty: Mother of Exiles,False,8.0,1
False,/bUwwofZUjJ50WFYo2CisXgUadUt.jpg,[35],537734,en,The Weekend,"An acerbic comedian becomes romantically entangled with her ex, his new girlfriend, and another guest during a weekend getaway.",5.157,/6IJ9UcJjUjMW6UOvQ99MllDZhoN.jpg,2019-09-13,The Weekend,False,7.0,4
