adult,backdrop_path,genre_ids,id,original_language,original_title,overview,popularity,poster_path,release_date,title,video,vote_average,vote_count
False,/rHAh0bb8FVTcpP5wknik6LXHEez.jpg,"[27, 53]",365995,en,Inside,"Completely on her own, Sarah spends her time at home, waiting for the approaching birth of her child. But one night, a stranger breaks into her home, ready to snatch her still unborn baby from her.",5.959,/hh6dCr2gQFh6qnBIzXXgQLKQ1Tn.jpg,2018-01-12,Inside,False,4.8,94
False,/ixHpSNNcpZ9gmPXwzqwlsVHIgu2.jpg,"[80, 27, 53]",471493,en,Ryde,"Technology brings us closer. Or perhaps it brings strangers, a little too close. But how much can you really trust someone? With a new ride share service, you never know who will be getting in a car with. Or if you'll ever get out.",3.949,/iRiUofTb8i7oka6t3vIXeIyYvcO.jpg,2017-09-15,Ryde,False,4.5,52
False,/1NNEK95hXDmjUkPX2u8ZaAaKd3p.jpg,[99],413765,en,David Lynch: The Art Life,"An intimate journey through the formative years of David Lynch's life. From his idyllic upbringing in small town America to the dark streets of Philadelphia, we follow Lynch as he traces the events that have helped to shape one of cinema's most enigmatic directors.",4.793,/pgtQceTZKylB2B237t18h2pOXpE.jpg,2017-03-31,David Lynch: The Art Life,False,7.1,72
False,/zaVBBLjYV7FkpQvZGKG1F4PPGC8.jpg,[16],434757,pt,Barbie Video Game Hero,"Get ready to power up! When Barbie magically gets pulled into her favorite video game, she is excited to see she's transformed into a fun roller-skating character. In the game, she meets Cutie, the lovable cloud-shaped friend, and Bella, the roller-skating princess. Together, they soon discover a mischievous emoji is trying to take control of the game. As they travel from level to level, Barbie must rely on her amazing gaming skills and out-of-the box thinking to save her team and beat the game!",7.091,/fByc0TUhm31qWVYnvvmzpGKnefZ.jpg,2017-02-01,Barbie Video Game Hero,False,6.2,57
False,/c4jwzF8rAD3c2YpPlRwrDAxWzT3.jpg,"[28, 10751, 14, 12, 35]",471968,ru,Последний богатырь,"Ivan is an ordinary guy who is transferred from modern Moscow to the fantasy world Belogorye. In this parallel universe where characters of Russian fairy tales live, magic is an integral part of daily life, and arguments are settled with the help of sword . Unexpectedly, Ivan finds himself in the middle of a battle between good and evil, and he must discover why everyone thinks that he must play the main role in upcoming events...",5.936,/ynMOyBo8xrWQiMvMJUhge4hVlse.jpg,2018-09-30,The Last Warrior,False,6.8,60
False,/kdiMDVw8WrZyb2pQqmgHXLtqTm3.jpg,"[18, 27, 53]",438436,en,Most Beautiful Island,Most Beautiful Island is a chilling portrait of an undocumented young woman's struggle for survival as she finds redemption from a tortured past in a dangerous game.,5.746,/g8RFV3wqigvgXqcVihyz6w0cLLV.jpg,2017-11-03,Most Beautiful Island,False,5.4,51
False,/cxeYjWtq97AwqMMlGhWWYSy5uci.jpg,"[10751, 14, 16, 35]",459159,en,Hotel Transylvania: Puppy!,The residents of Hotel Transylvania find their world turned upside-down when youngster Dennis gets a surprise monster-sized pet.,4.331,/sNxIazoQqDQukfQqkYxTgx9DRbu.jpg,2017-07-28,Hotel Transylvania: Puppy!,False,6.2,65
False,/4Ol5RwjIO96w4qC4WlK9iH7G3bf.jpg,"[27, 878, 28, 9648]",327253,en,The Gracefield Incident,"On August 16, 2013, the Supreme Court mandated the CIA to declassify files that had been kept secret for the past 75 years. Visual records of documented paranormal events were released to the public. The following incident took place in Gracefield, Quebec.",6.371,/lWZsV3dJfpWlEQG1Yn7GUSmrxdh.jpg,2017-07-21,The Gracefield Incident,False,5.0,58
False,/AfKs5Tzuvk4rGtsM16aPcdPYesL.jpg,[35],432959,en,Jim Gaffigan: Cinco,America's king of clean comedy delivers wickedly funny jokes in his fifth hour-long special.,4.476,/mfGQ4j5f6AN9HwI0DPXlv5V3gvS.jpg,2017-01-10,Jim Gaffigan: Cinco,False,7.2,45
False,/bhg1MGVy9gVVH6QlyUDRNxtHdpp.jpg,"[10402, 99]",426410,en,Score: A Film Music Documentary,"Music is an integral part of most films, adding emotion and nuance while often remaining invisible to audiences. Matt Schrader shines a spotlight on the overlooked craft of film composing, gathering many of the art form’s most influential practitioners, from Hans Zimmer and Danny Elfman to Quincy Jones and Randy Newman, to uncover their creative process. Tracing key developments in the evolution of music in film, and exploring some of cinema’s most iconic soundtracks, 'Score' is an aural valentine for film lovers.",4.844,/hlass0Pq1j6WD6JAucH3mXBoWo4.jpg,2017-06-16,Score: A Film Music Documentary,False,7.6,49
False,/b48yqgYlaA9EZdCjh1EAtPe12fY.jpg,"[28, 18, 10752]",405965,en,An Ordinary Man,A war criminal in hiding forms a relationship with his only connection to the outside world - his maid.,3.562,/qoGRUnru2gMh8WOK74zINPT80A5.jpg,2017-10-28,An Ordinary Man,False,5.7,23
False,/2GQUfRpv9nQt4DRqS00mFoOBEly.jpg,"[28, 80, 53]",363343,hi,रईस,"Set in the early ’80s and ’90s in Gujarat, India, ‘Raees’ is a fictitious story of a crime lord named Raees, who builds an entire empire from scratch, and a police officer who is determined to bring him down.",6.87,/zFYFUfnoXWxeA3n7v4acEqgk2iE.jpg,2017-01-25,Raees,False,6.6,106
False,/vK0rFoaRZF6ytvf0HknZFYlOf64.jpg,"[10749, 18, 10770]",453217,en,Home for Christmas Day,"Jane is a single mother dead set on protecting her teenage daughter Betsy from the harsh realities of life. When Betsy falls in love with an enlisted man, Jane tries her best to steer Betsy away from heartache. Little does Jane realize she and her daughter are about to learn important lessons of the heart and that taking chances can sometimes lead to the most extraordinary happy endings.",6.781,/cAExvJmnDWFqdJy89Kn90fQP0lo.jpg,2017-07-16,Home for Christmas Day,False,6.3,22
False,/88AMo7QXZxQ2Zt4BsTeUiGiQ8jh.jpg,[27],483737,en,Totem,A teen must resort to extreme measures to protect her family from a supernatural entity.,5.442,/2eMZjYxEGXS6xj4hRtxBmaPPi3z.jpg,2017-11-10,Totem,False,4.7,69
False,/sXY3BM8bmdXHhpmUqe03nSzIDVW.jpg,[99],473408,en,Joan Didion: The Center Will Not Hold,"Griffin Dunne’s years-in-the-making documentary portrait of his aunt Joan Didion moves with the spirit of her uncannily lucid writing: the film simultaneously expands and zeroes in, covering a vast stretch of turbulent cultural history with elegance and candor.",3.97,/eEU7XsmFLR0YqUf0mTHcd0ZRrUI.jpg,2017-10-11,Joan Didion: The Center Will Not Hold,False,7.3,20
False,/8UE6AwT9UE9VBJgqwxihiO1MUXk.jpg,"[28, 878]",443109,en,Oceans Rising,"A scientist builds a massive ark after his warnings of an Earth-destroying flood are ignored. But when it's evident the disaster will occur, those who maligned the scientist now turn to him in desperation, boarding the ark and seeking his answers before the world drowns in a never ending sea.",5.122,/2HbxuEVgQNh5vfQOhB6nifuByPs.jpg,2017-01-19,Oceans Rising,False,3.7,42
False,/at9iu2Is9oFO6wJLzRJFUICwOWb.jpg,[27],459068,en,Darkness Rising,"Nearly murdered as a child by her mother, a woman (Katrina Law) returns to the house where her mom went mad.",5.064,/jPUJ0kRIVDiY9E10r9AEcqKtqmC.jpg,2017-06-30,Darkness Rising,False,3.8,40
False,/ffkIQx9BAijIiJtzeAZW9XDcpv8.jpg,"[80, 18]",453270,it,A Ciambra,"Pio Amato, a 14 year-old member of a small Romani community in  southern Italian town of Gioia Tauro in Calabria, is in a hurry to grow up. Pio follows his older brother Cosimo everywhere and from him he learns how to hustle and how to navigate the streets of his hometown. One night Pio sets out to prove to his brother that he is as good or better than him but, when things go wrong, a series of events will forever change the way he sees the world.",5.075,/bIkDmCWDIWyHAQgKCZpuD5d8kKl.jpg,2018-01-19,The Ciambra,False,7.4,82
False,/5MnVTlHxNq7b3alxoNxp53ocLo3.jpg,[14],458354,en,Sleeping Beauties,"Awakened from a curse after 400 years, Sleeping Beauty (Sarah Hunter) marvels at the wonders of the new century. She falls in love with a famous architect who is working to restore the castle she once lived in, but finds there are enemies plotting against her. Giving in to her long pent-up sexual desires, Beauty cannot resist the lustful advances of both men and women and after 400 years, she's ready to explore everything and everyone!",5.983,/asvkeRwacvjvoUtlGc715tUQlzB.jpg,2017-07-27,Sleeping Beauties,False,4.3,4
False,/6q1QRvsbgWJR1y23IscRPOZ83Bt.jpg,"[35, 18]",426264,en,The Trip to Spain,Steve Coogan and Rob Brydon embark on a road trip along the coast of Spain.,5.021,/74RSdBGWdtbdClQ2NGJeTTyO7fq.jpg,2017-04-22,The Trip to Spain,False,6.8,47
False,/fGQr2maSQIjLw4RET6XzOKKO9bo.jpg,"[28, 878, 27]",461955,en,Rakka,"""Rakka"" is the story of broken humanity following the invasion of a technologically superior alien species. Bleak harrowing and unrelenting, the humans we meet must find enough courage to go on fighting.",6.828,/4wVeP9BHsQul7CRgdrfiUt1Rds1.jpg,2017-06-14,Rakka,False,7.1,99
False,/hRIWza0mi7myTxZWq7I5GoBWFd1.jpg,"[28, 12, 878]",393306,en,The Veil,"Set in a war-torn land where tribal factions live in fear of annihilation, the film tells the story of a deadly warrior leading a destructive war campaign. When he is betrayed by his own and left for dead, he is healed by a mysterious princess and taken in by a hidden tribe that believes he was chosen to wage a final battle.",5.512,/pAQ9ovHthGEWv61DKil8GjQeEcP.jpg,2017-01-19,The Veil,False,4.0,47
False,/AM0ZMglFUJknBXBUiPgEVEe0iQ.jpg,"[18, 9648, 53]",393172,en,Bottom of the World,"A mysterious disappearance of a young woman leads her boyfriend on a journey for truth and perhaps his own unknown reality in this dark, hypnotic mystery that transcends the limitations of traditional narrative.",4.372,/wUgO5MVsdFIqwvuako55rnfoM1Y.jpg,2017-03-31,Bottom of the World,False,5.3,59
False,/masCZracUmRKVDFovPoFo9ePNry.jpg,"[16, 14, 10752]",492606,en,Game of Thrones: Conquest & Rebellion,HBO's animated history of Westeros brings to life all the events that shaped the Seven Kingdoms in the thousands of years before Game of Thrones' story begins.,3.838,/b3HXxFnhy0pamuDY9rqJ4mk7L1t.jpg,2017-12-12,Game of Thrones: Conquest & Rebellion,False,8.1,41
False,/1GcgM16djXnnnVc6dXApgg9OfNr.jpg,"[18, 53]",492258,en,Cocaine Godmother,"At the age of 17, Griselda Blanco, made her way to the U.S. with a fake passport with her first husband Carlos. Living in Queens with her three sons, Griselda became enticed by the money the drug world offered, and quickly became embroiled with local drug runners. Griselda masterminded the use of beautiful women, the elderly and children as the mules and created false-bottom suitcases to smuggle cocaine from Colombia.",4.185,/BYD6DT0dwtLFXkuCk7SqfAZrqv.jpg,2018-01-20,Cocaine Godmother,False,6.7,36
False,/1bjoIR8Yb3qDrflszNWlz9uo2JF.jpg,"[28, 18, 27, 53]",433945,ja,東京喰種 トーキョーグール,"A Tokyo college student is attacked by a ghoul, a super-powered human who feeds on human flesh. He survives, but has become part ghoul and becomes a fugitive on the run.",4.961,/tMs8ZJ2dNJ0fExF7ISXJvOov4Y6.jpg,2017-07-16,Tokyo Ghoul,False,6.3,87
False,/7Sd7DcY9xQoH2uXTbWuhgnse2e1.jpg,[99],411007,en,Abacus: Small Enough to Jail,"The incredible saga of the Chinese immigrant Sung family, owners of Abacus Federal Savings of Chinatown, New York. Accused of mortgage fraud by Manhattan District Attorney Cyrus R. Vance, Jr., Abacus becomes the only U.S. bank to face criminal charges in the wake of the 2008 financial crisis. The indictment and subsequent trial forces the Sung family to defend themselves – and their bank’s legacy in the Chinatown community – over the course of a five-year legal battle.",5.638,/4u00FWfh8dUruEB7C3KCaV3FtOH.jpg,2017-05-19,Abacus: Small Enough to Jail,False,7.2,43
False,/oKbRCdh9PgXUhGW4uTHQmnLwXUJ.jpg,"[18, 53]",396940,en,Super Dark Times,"Teenagers Zach and Josh have been best friends their whole lives, but when a gruesome accident leads to a cover-up, the secret drives a wedge between them and propels them down a rabbit hole of escalating paranoia and violence.",6.352,/7sJoNicLJ9EZwetp5ucjS8qQ9g1.jpg,2017-09-29,Super Dark Times,False,6.4,281
False,/9kxEuXr6FJOZNty5KKwnaitHVDk.jpg,[28],438455,en,The Archer,"Archer champion Lauren Pierce escapes a corrupt juvenile correctional facility with Rebecca, a fierce but alluring inmate. Together they must survive a desperate warden who is bow-hunting his prey to make sure his secret stays buried",5.355,/qTwm9XOaLAW1JYcJLwnN3jU4YAk.jpg,2017-03-11,The Archer,False,5.6,42
False,/MT0EYPfnUeuXj8Eo17rZbPHRVW.jpg,"[28, 53]",450519,en,The Fast and the Fierce,"When terrorists plant a bomb on a commercial flight, the passengers aboard the plane must fight to keep the plane in the air and all the passengers alive: the bomb is rigged to detonate whenever the plane dips below 800 feet.",4.985,/fAYKtIztKn3JaF4Na2l5jYhNCDb.jpg,2017-04-04,The Fast and the Fierce,False,5.8,13
False,/eueGmwuhRC5dVEM5mJ8luHsi15g.jpg,"[53, 27, 9648]",359228,en,Ghost House,A young couple go on an adventurous vacation to Thailand only to find themselves haunted by a malevolent spirit after naively disrespecting a Ghost House.,6.418,/7EPOZv9bQjNVjFvk8lPGkcTubgO.jpg,2017-08-25,Ghost House,False,5.0,69
False,/rYyIqfx6BNpb7s0Wy5OqddCsKEQ.jpg,"[28, 18]",440777,en,Female Fight Club,A former fighter reluctantly returns to the life she abandoned in order to help her sister survive the sadistic world of illegal fighting and the maniac who runs it.,6.443,/iI9c8XNdPuwB4RYbHMd62QNhoRK.jpg,2017-08-08,Female Fight Club,False,5.3,20
False,/oblNjaUZj1zN8mkvbchjPcT3LfS.jpg,"[35, 18, 10749]",459225,en,The Feels,A lesbian bachelorette weekend goes awry when one of the brides admits she's never had an orgasm.,4.24,/kGXlwLByql7ReWfxLEmJxzHDKeG.jpg,2017-06-09,The Feels,False,5.7,55
False,/j1uA9K21Dhu86mqyys8vqGgAB3u.jpg,[99],455008,en,AlphaGo,"The ancient Chinese game of Go has long been considered a grand challenge for artificial intelligence. Yet in 2016, Google's DeepMind team announced that they would be taking on Lee Sedol, the world's most elite Go champion. AlphaGo chronicles the team as it prepares to test the limits of its rapidly-evolving AI technology. The film pits man against machine, and reveals as much about the workings of the human mind as it does the future of AI.",5.257,/mBebKFGVVuv6tDnUP8F5wKqxuNA.jpg,2017-04-21,AlphaGo,False,8.0,39
False,/9NNY9oXn5rqk3VZDLQgTdBvwoHq.jpg,[18],439154,fr,Sage femme,"Claire is a midwife and has devoted her life to others. At a moment when she is preoccupied by the imminent closure of the maternity clinic where she works, her life is further turned upside down when Béatrice, her father's former mistress, turns up on the scene. Béatrice is a capricious and selfish woman, Claire's exact opposite.",4.836,/wBrJGrTmUaGeJVPxAqJT2iZHQCA.jpg,2017-07-28,The Midwife,False,6.0,75
False,/eoHTf17hCLjHsqf0XVN5vnHpuTc.jpg,"[27, 53]",406107,en,Dead Awake,"Kate Bowman (Jocelin Donahue) is an average social worker who is investigating in the mysterious deaths of people who died in their sleep. Shortly before their deaths, the victims all reported a supernatural force that appeared to them while they were suffering from sleep-paralysis. When Kate investigates further into the case, she opens herself up to the creature's wrath, and soon finds herself, and her family suffering from an ancient evil.",5.357,/apBhaUivEub9Ghx7sj7UqQCFYH4.jpg,2017-05-12,Dead Awake,False,4.9,59
False,/6uB09CiDcydAcwmJvxFRbxM1O2q.jpg,"[10770, 10749, 18]",474974,en,Miss Christmas,"Holly Khun, known to Chicago as “Miss Christmas,” always finds a beautiful tree for the plaza, but this year’s was damaged, and the lighting ceremony is in 10 days. Hoping for a miracle, she combs through fan mail, and finds Joey McNary of Klaus, Wisconsin, has the perfect tree. Off she goes to Klaus, where she meets Joey’s handsome dad Sam.",4.522,/9ofVV2WG7P5qqo2hFoqMNNYZ4sI.jpg,2017-11-05,Miss Christmas,False,6.0,31
False,/o1gNOkgyQhsdK0x6FcpoV7TR35C.jpg,[99],477331,en,Long Shot,"When Juan Catalan is arrested for a murder he insists he didn't commit, he builds his case for innocence around raw footage from a popular TV show. A documentary.",7.029,/8LDeHrG8RBluJ7IkPgBaOMkU3fl.jpg,2017-09-03,Long Shot,False,7.2,48
False,/bZCjHladJ7miq1TlHb4MR0FQh0n.jpg,[878],457665,en,Alien Invasion: S.U.M.1,"An aggressive race of aliens took over Planet Earth and humanity's at its end, living in giant bunkers below ground. Young Military rookie S.U.M.1 (Iwan Rheon) is sent to the surface to save a group of unprotected survivors.",4.445,/seQLYvclDfR4UDfqGFDQWdbAy9M.jpg,2017-12-01,Alien Invasion: S.U.M.1,False,4.8,37
False,/aLGAH12ubqzXmGcjansziJTeIZ9.jpg,"[28, 35, 80]",558144,en,Deadpool: No Good Deed,"Deadpool sees an opportunity to save the day, but it doesn't go entirely as planned.",6.284,/pCppdEvpMkUg2acR5bgriekUgGN.jpg,2017-03-02,Deadpool: No Good Deed,False,7.3,65
False,/ammTJ2aUmj5NYBtrZhM40DE3L8E.jpg,"[10749, 35]",431093,en,Everybody Loves Somebody,"On the surface, Clara Barron seems to have it all: a job as an OB-GYN; a great house in LA; and a loving family. But, the one thing Clara doesn't have figured out is her love life. Pressured by a family wedding in Mexico, Clara asks a co-worker to pose as her boyfriend for the weekend festivities,- only to be caught by surprise when her ex- boyfriend (and family favorite) suddenly shows up after disappearing from her life completely. Torn, Clara must decide between going back to the past or open her heart to new and unexpected possibilities.",6.913,/rLi117ZKdtXE54G2AmYaDkCeKhi.jpg,2017-02-17,Everybody Loves Somebody,False,6.5,86
False,/hxSuiXSsBWuAjR2rRMw4oOJw6jF.jpg,"[18, 36]",445040,en,My Friend Dahmer,"Jeffrey Dahmer struggles with a difficult family life as a young boy. During his teenage years he slowly transforms, edging closer to the serial killer he was to become.",6.34,/c6HoPIBcRv9l2tPB8hbivq71Nw.jpg,2017-11-03,My Friend Dahmer,False,6.4,206
False,/5SyFg482Fc6j6nJrSR0RSCOCnwt.jpg,"[80, 18, 9648, 10770]",436398,en,Dead Over Heels: An Aurora Teagarden Mystery,"Librarian and real crime buff Aurora “Roe” Teagarden never liked Detective Sergeant Jack Burns, but she also never wanted to see him dead. When his body is found outside of Aurora’s home, she then becomes  the main suspect. Determined to find the killer and clear her name, Aurora can't help but to get  involved once again.",5.549,/p6TUrrWS9R2pNGRw7NMw2cyLqkv.jpg,2017-03-19,Dead Over Heels: An Aurora Teagarden Mystery,False,6.8,24
False,/rswj69fWsrFYwG6TZ8dR3v9ymsU.jpg,[],464339,en,Bad Date Chronicles,"Leigh runs the website ""Bad Date Chronicles,"" which allows people to anonymously post horrible date experiences. When rival blogger Conner becomes the subject of one of her posts, they agree to date each other to see which one is the ""bad dater.""",4.54,/uMvguzujg3inTx0aVMo3gbf82Hj.jpg,2017-07-01,Bad Date Chronicles,False,5.3,7
False,/bISHqlXNKa1HTiRM5dfyNSvMMHz.jpg,"[35, 18]",408272,en,Catfight,The rivalry between two former college friends comes to a head when they both attend the same glamorous event.,6.277,/97Zbegv8V4uM0CwEQvwtMhpqlF5.jpg,2017-03-03,Catfight,False,5.5,90
False,/uckUoRartDQYpsP208EaNKE8HqH.jpg,"[18, 36]",400020,fr,Le jeune Karl Marx,"26 year-old Karl Marx embarks with his wife, Jenny, on the road to exile. In 1844 in Paris, he meets Friedrich Engels, an industrialist’s son, who has been investigating the sordid birth of the British working class. Engels, the dandy, provides the last piece of the puzzle to the young Karl Marx’s new vision of the world. Together, between censorship and the police’s repression, riots and political upheavals, they will lead the labor movement during its development into a modern era.",4.825,/4VwBXiCzXKJyHfRdVBb843m23dx.jpg,2017-06-11,The Young Karl Marx,False,7.0,133
False,/vV3BeSdFFLCLfpr78sS1a1jkOPP.jpg,"[18, 10749]",342472,en,1 Mile To You,"After a teenager's friends die in an accident, he finds running allows him to remember them perfectly. Running, however, also brings him notoriety. He is caught between keeping the past alive and making new memories in the present.",5.574,/by5sJxbg7HXdqSm05oYT54AsZTg.jpg,2017-04-07,1 Mile To You,False,6.5,114
False,/iBl3hhtHC7qQX7jGphIAYLpmpPC.jpg,"[35, 10749, 16, 14]",430214,ja,夜は短し歩けよ乙女,"A boy falls in love with his junior in a Kyoto college club, and struggles daily to be noticed by her. However, she is naive and unsophisticated and is completely indifferent to him.",5.283,/cDp45WZNqgAli3u4GTnUhsqFn5K.jpg,2017-08-19,"Night Is Short, Walk on Girl",False,7.8,57
False,/pkjtFdzeqEYfp6XHpaSyF4wxijT.jpg,[35],478054,en,Def Comedy Jam 25,"In this special live event, giants of stand-up come together to commemorate the 25th anniversary of Russell Simmons's groundbreaking ""Def Comedy Jam.""",4.428,/n4NtEw3QcdKAwYGeastBjyTNy9b.jpg,2017-09-26,Def Comedy Jam 25,False,6.3,20
False,/iG48zN4pfyDKBlMmBcFSigqkJKZ.jpg,"[16, 35, 9648, 37, 10751]",427564,en,Scooby-Doo! Shaggy's Showdown,"When the Scooby gang visits a dude ranch, they discover that it and the nearby town have been haunted by a ghostly cowboy, Dapper Dan, who fires real fire from his fire irons. The mystery only deepens when it’s discovered that the ghost is also the long lost relative of Shaggy Rogers!",6.712,/qgaWuOIMCm9OhM55dVMC8HHa6RK.jpg,2017-02-14,Scooby-Doo! Shaggy's Showdown,False,6.7,38
False,/4RFYwgJmo9dTnJ6AUNE3l7MFFLz.jpg,[28],437291,en,Savage Dog,"A story set in Indochina in 1959, a lawless land controlled by the criminal class: Vietnamese warlords and European war-criminals. Den-Dhin-Chan Labor Camp is run by four such dangerous men. The worst prison in the land, it is here that an Irish, former-champion boxer Martin Tillman has made a name for himself fighting tournaments, on which wealthy criminals gamble in high stakes events. When Tillman is due for release, he just wants to return home, but the corrupt forces running the jail will do everything in their power to keep him locked down. When all that Tillman holds dear is taken away in a vicious act of violence, he is forced to confront the men responsible and take his revenge.  The birth of a legend.",4.075,/yY2MV8dYotYtLYMiTcMvdxpNX5I.jpg,2017-08-04,Savage Dog,False,5.3,50
False,/2L6oKOhaf1Q5mk6UkJjtuROMbXj.jpg,[99],433878,en,The Mars Generation,Aspiring teenage astronauts reveal that a journey to Mars is closer than you think.,4.45,/czL0pSnPEEJJsjrJzg8q86ALvnE.jpg,2017-01-20,The Mars Generation,False,7.2,21
False,/iWrg4in89n2gVKoLmNwtDu4tyPU.jpg,[28],434119,ko,공조,"When a crime organization from North Korea crosses borders and enters South Korean soil, a South Korean detective must cooperate with a North Korean detective to investigate their whereabouts.",3.838,/begGZaUaxdUConId1554D9D8gms.jpg,2017-02-03,Confidential Assignment,False,6.8,34
False,/exxM5UndORdibgneCdTDZHDOIre.jpg,"[10751, 35, 18, 53]",431867,en,Bitch,"The provocative tale of a woman who snaps under crushing life pressures and assumes the psyche of a vicious dog. Her philandering, absentee husband is forced to become reacquainted with his four children and sister-in-law as they attempt to keep the family together during this bizarre crisis.",5.747,/dsFUHJgMVViUsRggDThtwRPmS9i.jpg,2017-01-20,Bitch,False,5.2,31
False,/sbTSoXIzhvnSQkCGpJZYti4ufwO.jpg,[99],385805,en,Betting on Zero,Controversial hedge fund titan Bill Ackman is on a crusade to expose global nutritional giant Herbalife as the largest pyramid scheme in history while Herbalife execs claim Ackman is a market manipulator out to bankrupt them and make a killing off his billion dollar short.,4.867,/oNG4VITQkGd9iXHv0Ds7vmZdGYp.jpg,2017-03-17,Betting on Zero,False,7.4,60
False,/toTfiaJqTn3sJENPEkAeRCLMpIa.jpg,"[27, 53, 10749]",486011,en,Like.Share.Follow.,"Garrett is a rising YouTube star. Shell is a deeply emotional fan. When they begin a romantic relationship, he's forced to question whether opening your life to strangers online is an invitation to community and rescue... or to stalking, obsession and madness.",5.923,/eKNTz46POFW5tDh74oLj0lLkxaM.jpg,2017-10-31,Like.Share.Follow.,False,5.3,70
False,/gQbGKZMHfK4B9tn43eJQN9gHJrl.jpg,"[28, 12, 16, 80, 10751, 9648]",438058,th,名探偵コナン から紅の恋歌,"Bombing case at Nichiuri TV in autumn. The Satsuki Cup, which crowns the winner of Japan's Hyakunin Isshu, is currently being filmed inside the facility. The incident results in a big commotion and, while the building is burning to ashes, the only people left inside are Hattori and Toyama Kazuha. They get rescued just in time by Conan , who rushes to the scene. Both the identity and purposes of the bomber are unknown.",6.275,/qTC98aqIJltte2SBnRTq1CsJL1D.jpg,2017-12-31,Detective Conan: Crimson Love Letter,False,7.0,32
False,/pJdw1uY7Hha3rZky9LIDJnd7v00.jpg,"[10751, 16]",447113,en,Monster High: Electrified,"When Clawdeen dreams of opening a salon made for monsters and normies, Frankie has the perfect place - an abandoned power station outside town. But the idea sparks negative voltage when Moanica plots to ruin the whole thing, and replace the celebration with something a little more... shocking! Luckily the ghouls have a secret weapon on their side...Twyla, the daughter of the Boogey Man, and the perfect ghoul to unearth any mystery. Along with the most voltageous salon ever! So catch every twist, turn, zap and blast...because the Monster High ghouls are about to get ELECTRIC!",5.911,/rRzePOVZ0wd2CUFeoiP3ge0gPka.jpg,2017-03-27,Monster High: Electrified,False,7.0,30
