adult,backdrop_path,genre_ids,id,original_language,original_title,overview,popularity,poster_path,release_date,title,video,vote_average,vote_count
False,/p9paOfrUrXaOH0yvRvJte8bdNts.jpg,"[10749, 18, 10770]",549304,en,Marrying Father Christmas,"When Miranda Chester sets off to find information on her biological father two Christmases ago, she never imagined her investigation would lead her to both the love of her life, Ian McAndrick, and the family she had always longed for, including Margaret Whitcomb and half-brother Peter Whitcomb. After her romantic engagement last Christmas, Miranda prepares for a Christmas wedding surrounded by this new family. While Miranda finalizes the details of her big day, Margaret forges a surprising romance with a friend from the past. Miranda’s wedding plans are quickly complicated when a mysterious visitor who claims to have ties to her late parents reaches out to her just days before her wedding. As Miranda’s wedding approaches, she must decide if she wants to spend one of the most momentous days of her life with this new family connection, and must carefully navigate the first steps into the next chapter of her life with Ian.",3.377,/eCPTze9HO349g3FzGk8XFnReh9Z.jpg,2018-11-04,Marrying Father Christmas,False,5.1,11
False,/4tKYSRlwnDDUDw1DRLVena7J9C8.jpg,"[28, 53]",515237,en,Death Kiss,"A vigilante with a mysterious past becomes a one-man army in a crime-infested town as he takes the law into his own hands, at the same time protecting a young mother and her daughter. He sets his sights on a local kingpin, setting up an action-packed and fateful confrontation.",3.951,/4ewwnbHLMvggNlUlDNi4jkkqQ2X.jpg,2018-05-04,Death Kiss,False,5.6,14
False,/gmCqVEvEE32fqBw8M1TZdpxtxOS.jpg,"[878, 10770]",352548,en,5th Passenger,"Set in the aftermath of an oppressive class war, a pregnant officer aboard an escape pod must struggle to survive with her remaining crew when a mysterious and vicious life form attacks, determined to become the dominant species.",4.521,/f8hfZCD2fSsz6LE6FA5uk5mMv11.jpg,2018-05-30,5th Passenger,False,4.9,18
False,/1cJjCJsHchk2uzoFWEr4LJMIH0.jpg,"[27, 53]",513224,en,The Executioners,"Four female friends spend the night in a mansion. Their joy is quickly shattered when three men break in and cruelly attack them. As the night takes a darker turn, they find themselves relishing in the violence they had once suffered.",4.167,/djdo5SqDkGwiNhLIpmMzbXfRGek.jpg,2018-03-27,The Executioners,False,5.0,13
False,/mR0FxUh6ghmR3gZTyq3gFtQtXmy.jpg,"[18, 878]",514547,en,White Chamber,"The United Kingdom. Soon. Civil war rages. A woman wakes up in a blindingly white cuboid cell. Using its sophisticated functionality, her captor tortures her for information; information she claims not to have - or does she?",2.989,/yZjmCwmfHMjCE2ojON2dgeTkvDP.jpg,2019-03-29,White Chamber,False,4.7,18
False,/qvlToqIqsAY0qcFtGXXK1v2xDFl.jpg,"[35, 18]",483435,en,All About Nina,"Nina Geld's passion and talent have made her a rising star in the comedy scene, but she's an emotional mess offstage. When a new professional opportunity coincides with a romantic one, she is forced to confront her own deeply troubled past.",2.987,/qcOV7ALpm0CiIyeTxP3Ncjrc7HA.jpg,2018-09-28,All About Nina,False,6.8,19
False,/nLRGsXpf0uieHDXzTvr9PZQRqDh.jpg,"[36, 53]",519956,en,The Last Witness,"An ambitious young journalist uncovers the horrific slaughter of 22,000 Polish officers during World War II, a secret kept hidden for far too many years.",4.958,/v4d6UHuQ2gpsaN38pMSZ42Fj6hi.jpg,2018-05-29,The Last Witness,False,6.5,31
False,/aeelTQu3cFnqf6O04R3s00Z6Ffb.jpg,"[27, 53]",552660,en,No Escape Room,A father and daughter check out a small town escape room and discover there is something sinister about the place.,3.928,/yP0mfM0MafLVMD36kgbvZpr9gbz.jpg,2018-10-06,No Escape Room,False,6.3,38
False,/kGsnFKXDXsU4xw0cjZNoZ9gA1hu.jpg,"[27, 53]",534271,en,The Cleaning Lady,"As a means to distract herself from an affair, a love-addicted woman befriends a cleaning lady, badly scarred by burns. She soon learns, these scars run much deeper than the surface.  Long version of Jon Knautz short movie.",3.133,/v5hLkrvU9TmljxnOvJnX7xonJKY.jpg,2019-05-31,The Cleaning Lady,False,6.0,20
False,/skvRXbeyO8kabIf1N2IYpMW3oJV.jpg,"[28, 18, 878, 53]",472715,en,The Last Man,"Tov Matheson is a war veteran with PTSD who perceives that the apocalypse is coming. After starting a relationship with a dubious Messiah, he leaves his normal life and begins the construction of a shelter underground, training himself, in an extreme way, at the cost of losing everything and making people believe he is insane. When he also believes it, something extraordinary happens.",5.895,/bBrr6RwxmfjZyWTEe3AaguEKbMO.jpg,2019-01-18,The Last Man,False,3.9,12
False,/Uxsw2VqpHQqdrQGibrQl5VVk0X.jpg,"[18, 878, 53]",419407,en,Astral,A detached university student faces the consequences of astral projection when he uses it to reconnect with his dead mother.,4.906,/50yO1vqWSZrz36KK5Z2IaU8SsIC.jpg,2018-10-13,Astral,False,5.0,29
False,/mt2tkEiosA8mjNb479klupkdlS6.jpg,"[53, 10770]",514307,en,The Midwife's Deception,"Jina, a midwife, is a dream come true for seven-month pregnant Sara until secrets unfold and Jina may want more than only delivering the baby.",3.39,/nBAiFdtJglEUBkFGpn0ThLjQCUY.jpg,2018-03-18,The Midwife's Deception,False,4.0,4
False,/bSpYVgqWE8gZdaLHNXwMhWexqWb.jpg,[35],457243,en,The Long Dumb Road,Two guys serendipitously meet at a time when they both find themselves at personal crossroads and decide to embark on an unplanned road trip across the American Southwest.,4.596,/nGfKFEnKqSVaM0I2xxUnDeLx7t4.jpg,2018-11-09,The Long Dumb Road,False,5.7,27
False,/vl4xE0LZfBX7D5mY4WHsEmxNJJZ.jpg,[99],494632,en,Making Fun: The Story of Funko,"From a small garage in Redmond, Washington, to the furthest corners of the earth, Funko's story is one that is centered around the fans and the global community that arose from their unique passion - a story that spans twenty years full of joy, ambition, adversity, and... well... toys.",3.326,/eFRat6UHOf79v0HAklnUBWsN2MT.jpg,2018-01-22,Making Fun: The Story of Funko,False,6.6,27
False,/uvY0uqCH2l74zvehPLdgFiIPRYa.jpg,"[28, 18, 36, 53, 10749, 10752]",366964,en,Mohawk,A young Mohawk woman and her two lovers battle a squad of American soldiers hell-bent on revenge.,5.617,/hGZE7BeHzTOarIbjSzlGbIc8sPr.jpg,2018-03-02,Mohawk,False,5.4,30
False,/rBzCTfbBsCIpxBBTjuVrIUsVaQo.jpg,[27],546476,en,Sick for Toys,"Roy is the nice guy who finishes last. Sick of his current situation, he accepts an invitation to have Christmas dinner with the beautiful and strangely alluring Emilia. Once at dinner, Roy realizes that Emilia and her oddball brother Edward are not what they seem.",2.953,/1kXU5KmQp56XmZG876zLU87RPqB.jpg,2018-05-05,Sick for Toys,False,5.3,11
False,/waoV6Bo7aJiXPEUOtB1pBhf0iSV.jpg,[53],542905,en,Ride,"A night in Los Angeles becomes a psychological war for survival when an Uber driver, James, and his passenger, Jessica, pick up Bruno, who is charismatic but manipulative.",3.42,/skyZpGolECdQD3KrtqjYHLHC4to.jpg,2018-10-05,Ride,False,5.8,38
False,/lWRt82Uc5AU2TKyeyQjUrRsv9Eg.jpg,[99],511972,en,"Love, Gilda","Diaries, audiotapes, videotapes and testimonies from friends and colleagues offer insight into the life and career of Gilda Radner -- the beloved comic and actress who became an icon on Saturday Night Live.",4.738,/jJVp7JvPkFLeXKuS2YSLIC2zuK4.jpg,2018-04-18,"Love, Gilda",False,7.3,24
False,/h858Q0sJwIyePN5p4AgIlN052wF.jpg,[35],503758,en,Most Likely to Murder,"Billy, the coolest kid in high school, comes back to his hometown 15 years later to find he’s no longer cool and the girl he still has feelings for now dates the former town outcast. Billy becomes obsessed with proving the outcast is a murderer.",4.586,/uozkm1AvcEo8ZKU3UKam06YWmbc.jpg,2018-03-12,Most Likely to Murder,False,5.9,19
False,/9tAHLA86FezgxF71GWpfxLRQwX8.jpg,[53],443849,en,Winter Ridge,"Tearing himself away from the bedside of his coma-bound wife, a police Sergeant investigates a series of age-related murders, only to discover that time can be far more destructive and cruel than the idealistic killer........",3.855,/zAIaeLJ8oAwIcFygWbpC4mNeGtK.jpg,2018-09-18,Winter Ridge,False,5.5,11
False,/mroWWloxjaVcguWfeCtBqaroWdS.jpg,"[35, 10749]",345935,en,Half Magic,"Three women use their newly formed sisterhood to fight against sexism, bad relationships and low self-esteem. Through embracing their wild adventures, they learn the secret to ultimate fulfillment.",2.926,/5yXOWl7sATagtvsJkpOGCblZ0an.jpg,2018-02-23,Half Magic,False,5.7,18
False,/ooRzUysAHZvkYPtiWpc7Jpx6qX4.jpg,[27],345921,en,Headgame,"A group of young people awake, locked inside a warehouse with cameras screwed into their heads. It becomes apparent that they are unwilling competitors in a deadly game, and they will need to murder each other if they hope to survive.",4.638,/fDFVANRnIcBNvokOMZlfhCFjWl.jpg,2018-02-20,Headgame,False,4.6,21
False,/6PJEG9uyYxFgmQpHcK2t3tk6B80.jpg,[27],503430,en,Curse of the Witch's Doll,"Adeline Gray’s attempt to escape bombing leads her to a derelict, creepy manor in the woods. When Adeline’s young daughter goes missing, a series of inexplicable events lead her to believe a haunted doll holds a vengeful soul; the soul of a murdered Witch. As Adeline’s desperate search continues, she soon realizes she too is at the mercy of The Witch’s Doll.",3.039,/l0i4JKc6pscQO1F6ub0MRQ76WhI.jpg,2018-02-06,Curse of the Witch's Doll,False,3.0,9
False,/9s6GdoHYOYo2oZ1o0vLNKDzA0T6.jpg,"[35, 10402]",550416,en,Flight of the Conchords: Live in London,New Zealand’s 4th Most Popular Parody Duo are back for a mutha-uckin’ special concert  live at the London Apollo.,3.823,/m3lJEwPM8i2oFjwNaGyc0PFrzUz.jpg,2018-10-06,Flight of the Conchords: Live in London,False,8.0,10
False,/x2JRdUjA0HjFDL4IHgYFQLNwGFc.jpg,"[80, 53]",513180,en,Witness Unprotected,"Sam is a divorced freelance photographer who is struggling to put her daughter, Laurie, though college. She takes any job, even the dangerous ones, to keep the paychecks coming. Her latest assignment, given to her by a private investigation firm, goes horribly wrong when Sam suspects the subject of her stakeout may have been the victim of foul play.",2.918,/A3aE6yKnTBBy6NYtBVmyprbnwbJ.jpg,2018-02-13,Witness Unprotected,False,4.2,5
False,/ya2I5AYyhnEqS3zrE9Ymr8AIJ10.jpg,[27],457685,en,Island Zero,"A fishing community on a remote Maine island finds itself suddenly cut off from the rest of the world after the ferry stops coming. When people start to vanish, the terrified survivors realize that someone - or something - is hunting them.",4.25,/oYq8516uhbRo17MLWQA60xZXzrj.jpg,2018-05-15,Island Zero,False,4.4,18
False,/yxx8sL7RenKr7yf7JqaXa21AenZ.jpg,"[28, 12, 18, 14, 9648, 53]",518764,en,Animal World,"Drifting aimlessly through life, Kaisi (Li Yi Feng) has racked up debts of several million having borrowed money from his friends. Lured with the promise of writing it all off, Kaisi leaves his ailing mother and childhood sweetheart Qing (Zhou Dongyu) to board the ship Destiny and attend a gambling party controlled by the mysterious Anderson (Michael Douglas).  All players join the game with stars. For each game they lose, their opponent captures a star. Everyone is holding daggers behind their backs plotting dirty means by which to overcome their opponents. The game quickly deteriorates into a slaughter and Kaisi must battle save his own skin…",5.052,/kxc25B05Gq4CbCoWbyTFf9iF0wn.jpg,2018-06-13,Animal World,False,7.2,43
False,/zN05EihXyKa0HyEik79HLCYWFFg.jpg,"[27, 9648, 53]",549935,en,Head Count,"During a weekend getaway to Joshua Tree, a group of teenagers find themselves under mental and physical assault from a supernatural entity that mimics their appearances as it completes an ancient ritual.",3.736,/7oXyBgTZJGQ9eKmysvr0CnemYDP.jpg,2018-09-24,Head Count,False,5.8,24
False,/ho6e9gv7zAMeDq1xXvKgqXRHcje.jpg,[99],511014,en,United Skates,"When America's last standing roller rinks are threatened with closure, a community of thousands battle in a racially charged environment to save an underground subculture.",2.886,/bChxuC8FfiaiXlrmxo5XQErABvg.jpg,2018-04-19,United Skates,False,7.9,8
False,/dUbfgTJQYXPOiWM3KzWnwGS0lw9.jpg,"[10770, 99]",554175,en,Derren Brown: Sacrifice,Illusionist Derren Brown concocts a psychological experiment in which he tries to manipulate an ordinary person into taking a bullet for a stranger.,4.394,/8v342kElMy6Lp3pW02FeiOY2LAn.jpg,2018-10-19,Derren Brown: Sacrifice,False,8.0,21
False,/wPZ6FQaBxPrk0jfz5c2hynO8Vkt.jpg,"[99, 10402]",563708,en,Springsteen On Broadway,"Springsteen on Broadway is a solo acoustic performance written and performed by Tony Award, Academy Award, and 20-time Grammy Award winner Bruce Springsteen. Based on his worldwide best-selling autobiography 'Born to Run,' Springsteen on Broadway is a unique evening with Bruce, his guitar, a piano, and his very personal stories. In addition, it features a special appearance by Patti Scialfa. Netflix will allow global audiences to see the show critics have been raving about from anywhere they are.",3.371,/ng9F8AbD82ldwwdZpCvTAUAQ0rr.jpg,2018-12-16,Springsteen On Broadway,False,8.3,20
False,/xQDxubtOio6Z58aV1v4SpabbsvZ.jpg,"[878, 28, 53]",526475,en,Astro,A science-fiction story of a billionaire's private space exploration program returning to Earth with an abducted extraterrestrial from a newly discovered alien planet.,4.242,/1lVpbd1P0YoYrMQUdw27cO8OW5D.jpg,2018-06-08,Astro,False,4.8,8
False,/hHSG6q7nP8B7ENYDLH8mGuAgVF9.jpg,[18],407719,en,Golden Exits,An intersectional narrative of two families in Brooklyn and the unraveling of unspoken unhappiness that occurs when a young foreign girl spending time abroad upsets the balance on both sides.,6.705,/qdNtpveLDAlODfs4o4blrN7XsxV.jpg,2018-02-09,Golden Exits,False,6.3,24
False,/xbUqVCfP03yT0o7rz89vyvfIUpj.jpg,"[53, 53, 18]",539196,en,We Belong Together,A recovering alcoholic college professor trying to put his life back together meets a seductive new student. She offers him a sensual escape from reality until he realizes she may be insane.,2.872,/r615jPBywGrKOZuDXq1d0M8aiFS.jpg,2018-07-28,We Belong Together,False,5.4,6
False,/nYM30bR4YW3PQxBNzMXiUUtKaKw.jpg,[99],502157,en,The Bill Murray Stories: Life Lessons Learned from a Mythical Man,"One man’s journey to find meaning in Bill Murray’s many unexpected adventures with everyday people, rare and never-before seen footage of the comedic icon participating in stories previously presumed to be urban legend.",4.408,/bQ0k7yeY5EWCLOyF3JAK0HZnCqz.jpg,2018-03-10,The Bill Murray Stories: Life Lessons Learned from a Mythical Man,False,7.3,22
False,/aZqm4LRVRQMeCJpWmb6RkGSptmR.jpg,[878],529483,en,Encounter,"A group of friends uncover an otherworldly object in a rural field, which they soon discover holds greater secrets than they could imagine.",3.475,/jXHbWM1Og9AYqJojIIXHxmEqJf5.jpg,2018-02-15,Encounter,False,3.2,16
False,/wUuKQqhrvUCQyDv2lSgiD6V28DY.jpg,[35],542694,en,Bert Kreischer: Secret Time,"Comedian Bert Kreischer is ready to take his shirt off and ""party hardy"" with his debut Netflix Original stand-up special, Bert Kreischer: Secret Time. Considered one of the best storytellers of his generation, Bert regales the audience at the Trocadero Theatre in Philadelphia with stories about zip-lining with his family, his daughter practicing softball with an imaginary ball, and upstaging ex-NBA player Ralph Sampson at a childhood basketball camp.",4.265,/AsntCXSeitfQTokjEmuT5LEyd2v.jpg,2018-08-24,Bert Kreischer: Secret Time,False,7.3,17
False,/mM03AveeSm4nmcDtfDjVDIOuqO9.jpg,"[35, 10770, 10749]",497515,en,Cooking with Love,"Optimistic and cheerful TV producer, Kelly, doesn’t have time for love. Bad boy celebrity chef, Stephen, doesn’t have time for anything besides cooking. Fun with a side of love ensues as Kelly and Stephen are paired on a children's cooking show.",3.543,/so43k3eqIbJDPLbdnmU4QAP9h1z.jpg,2018-02-11,Cooking with Love,False,6.3,10
False,/lnvVx026VDlpOPCaDuIW5dYsU8V.jpg,[99],504769,en,The Redeemed and the Dominant: Fittest on Earth,"In 2017, the fittest athletes on Earth took on the unknown and unknowable during four of the most intense days of competition in CrossFit Games history.  ""The Redeemed and the Dominant: Fittest on Earth"" captures all the drama as the top athletes resembling chiseled Grecian gods descend on Madison, Wisconsin, to face a series of trials.  Hercules faced 12; they take on 13.  Emotions run high as a throng of Australian athletes rise to the top.  By the end of the competition, some learn tough lessons - that all that glitters isn't gold, or even bronze - and some learn that they're even stronger than they realized.  The best among them enter the pantheon of the CrossFit giants and earn the right to call themselves the ""Fittest on Earth""",3.665,/wiXmLNpcUe75gkdyJ5gr1JfhZbg.jpg,2018-03-23,The Redeemed and the Dominant: Fittest on Earth,False,7.8,14
False,/5PJWfJOZz9NsJdciBeo1LKjOsqQ.jpg,"[18, 53]",451918,en,Little Woods,"For years, Ollie has illicitly helped the struggling residents of her North Dakota oil boomtown access Canadian health care and medication. When the authorities catch on, she plans to abandon her crusade, only to be dragged in even deeper after a desperate plea for help from her sister.",4.226,/nbmevOFXOtx3n2pfj4gtSxpcSFh.jpg,2018-04-21,Little Woods,False,6.3,16
False,/o5WRdRzlzlpuYTgMHdXmnWcdtiY.jpg,[35],557606,en,John Leguizamo's Latin History for Morons,"In this one-man Broadway show, John Leguizamo finds humor and heartbreak as he traces 3,000 years of Latin history in an effort to help his bullied son.",3.301,/2vaH0fwLJYd2uQTAsAWJ72Fj5Hb.jpg,2018-11-05,John Leguizamo's Latin History for Morons,False,7.2,18
False,/xVZWdrTLM4aPk78Wk44qyNbyMJn.jpg,[35],497520,en,Tom Segura: Disgraceful,"Tom Segura gives voice to the sordid thoughts you'd never say out loud, with blunt musings on porn, parking lot power struggles, parenthood and more.",3.119,/qFWRrec2LlKglSd3cnz9uKvl6oS.jpg,2018-01-12,Tom Segura: Disgraceful,False,7.1,21
False,/2oI5YyrFV7L5nZgYAHQnHgPh0WR.jpg,[53],466174,en,Knuckleball,"Alone, and targeted on an isolated farm, 12 year old Henry finds himself at the center of a maelstrom of terror, and a dark family legacy, when his secretive grandfather dies suddenly in the night.",2.974,/sAxyuS0A9527vBSiv3IZCpqi38R.jpg,2018-04-17,Knuckleball,False,6.1,16
False,/Ype3w5AyVA16v7DNGCjHbZb0MX.jpg,[35],521512,en,Tig Notaro: Happy To Be Here,"Comedian Tig Notaro unleashes her inner prankster in a playful stand-up special packed with funny anecdotes, parenting confessions and more.",3.686,/nHJZms4jVjyIIW3jRmc2qkPTYBk.jpg,2018-05-22,Tig Notaro: Happy To Be Here,False,6.2,23
False,/v0w9oNzDahImv3MD0OyYdUT70R5.jpg,"[10749, 10751, 10770]",550073,en,Hope at Christmas,"Sydney Ragsdale, recently divorced, decides to spend Christmas in a house she inherited with her young daughter. As Sydney begins to spend more time at the local bookstore, she meets a teacher, Mac, who also fills in for the town Santa. Mac tries to make Christmas wishes come true, and this year Sydney is at the top of his ‘nice’ list. As a new opportunity with the bookstore unfolds, Mac helps Sydney open herself up to life, love, and believing in the spirit of Christmas again.",5.001,/ylrt2AjyunjjsU4ZQQeTNaJH41H.jpg,2018-11-20,Hope at Christmas,False,6.6,8
False,/h0CPUoUrJxA1DCpYIhagO8SWm55.jpg,[35],532374,en,Jim Jefferies: This Is Me Now,"The gleefully irreverent Jefferies skewers “grabby” celebrities, political hypocrisy and his own ill-advised career moves in a brash stand-up special.",4.888,/gs10pb13Mo03O3eYvLgfYhDHpYX.jpg,2018-07-13,Jim Jefferies: This Is Me Now,False,7.1,38
False,/xw8hpRttw101BSvna9kz8JQSiUX.jpg,[10749],510938,en,The Matchmaker's Playbook,Wingman rule number one: don’t fall for a client.,3.16,/2Ye7aeL8Qz9EhQq8kRyIyicxGOQ.jpg,2018-03-15,The Matchmaker's Playbook,False,6.3,14
False,/1XuTrifbdOrhAQLC9SrCSuojHe1.jpg,"[18, 14, 10749, 10770]",535809,en,A Shoe Addict's Christmas,"As Christmas approaches, a department store worker whose life lacks fulfillment meets her guardian angel, who offers her a chance to change her circumstances by magically transporting her to Christmases past whenever she tries on a new pair of shoes.",5.711,/dXy55JISYOfUKZdpKG1A8yegHzw.jpg,2018-11-25,A Shoe Addict's Christmas,False,6.9,15
False,/a4niJNmrK7fAtV59F75OxbVvgiE.jpg,"[18, 10749, 10770]",550032,en,Christmas Wonderland,"Heidi, who initially left her small town of Pleasant Valley with the dream of one day becoming a successful painter, has put her own art on hold to excel as an art gallery curator. Now, a week before the gallery’s big Christmas party, she must return home to watch her niece and nephew. She comes face to face with her high school love, Chris, now a teacher, and offers to help him find a new last-minute location for the Christmas dance.",3.532,/3QwvhdOZSNJdHbHcL9aIwp3l9mD.jpg,2018-12-02,Christmas Wonderland,False,7.7,9
False,/d9JHm0q7wZrAsseBceucOTqqI2O.jpg,[99],503150,en,Eating Animals,An examination of our dietary choices and the food we put in our bodies.,4.235,/tppzVmguu02QAjXM957XVqKrvgl.jpg,2018-06-15,Eating Animals,False,7.3,8
False,/tR5q64eudIqq7UZ4QdIxYG6zmgj.jpg,"[28, 12]",534094,en,In Like Flynn,"A chronicle of Errol Flynn's pre-Hollywood sea adventures up the east coast of Australia. His crew includes his best friend Rex, a wild and visceral young man, the Dook, a proper young gent from Cambridge, and Charlie, the ageing and depressed previous owner of the boat. Flynn and company encounter beautiful virgins, underground boxing clubs, police raids, bar brawls, cannibals and man-eating sharks, while being forced to smuggle opium to survive.",4.297,/oPMEpcDlZVGa8xBhUUHteaPrvHw.jpg,2019-01-25,In Like Flynn,False,6.0,10
False,/2BcIBRpD2XoTvFCh4624AZ41Cpt.jpg,"[12, 16, 35, 10751]",499088,en,Maya the Bee: The Honey Games,"When an overenthusiastic Maya accidentally embarrasses the Empress of Buzztropolis, she is forced to unite with a team of misfit bugs and compete in the Honey Games for a chance to save her hive.",5.177,/aBfeHekIIjC4mFlark5MWJWDyZn.jpg,2018-04-27,Maya the Bee: The Honey Games,False,7.0,23
False,/vfdkUySTAyjugOJ9LvgDfH3JpWg.jpg,"[9648, 53]",502167,en,Don’t Leave Home,An American artist’s obsession with a disturbing urban legend leads her to an investigation of the story’s origins at the crumbling estate of a reclusive painter in Ireland.,3.776,/3Y296xLDoTOsts35P3dGErBrZbL.jpg,2018-03-10,Don’t Leave Home,False,5.0,18
False,/xs1FnNBNhMBQckKqMJBIYWpnnDr.jpg,"[53, 10770]",487088,en,Devious Nanny,"A woman tries to protect her family after her husband has an affair with their nanny. As her husband's co-workers are killed, she discovers everything is not what it appears to be.",2.833,/XNk6SG77YyNodXZcR3Z9HPeaTR.jpg,2018-03-02,Devious Nanny,False,7.5,6
False,/h9BvniZownOb9V2Ujw0UoX33Ccs.jpg,[10749],531836,en,Pearl in Paradise,"Magazine photographer Alex Anderson and author Colin Page head to Fiji in search of the illusive blue pearl that Colin wrote about in his bestselling novel Pearl in Paradise. Alex stands to land the creative director position if she can photograph the pearl for the magazine’s 30th anniversary issue, and Colin hopes that by writing a guest article about the long-lost gem he can boost sales of his failing other books and not lose his publisher. As the two head off to their search, neither is aware yet that finding love could be the rarest adventure of all.",2.832,/A19g63NzdhCrgk8s8Oa3SVhEQux.jpg,2018-08-18,Pearl in Paradise,False,5.1,19
False,/9dx7vTeoUO6CrMHMn8qxq87GTDU.jpg,"[18, 53, 10749]",528998,en,Affairs of State,"A young campaign aide gets in way over his head when he sleeps with the wife of a presidential candidate, sending him into a downward spiral of corruption and blackmail. He is left fighting not only for his career, but also his life.",4.511,/jw3CFmGrfs4qUf3Aih9xgN5BTqu.jpg,2018-06-15,Affairs of State,False,5.4,9
False,/wBFbpryxsZxLFFSMCFuWFuVLHMR.jpg,[35],523900,en,Spivak,"A self-loathing, failed Eastside novelist living in the ‘hipster’ neighborhood of Echo Park in Los Angeles is shocked to find himself falling in love with everything he hates, including a simple All-American blonde girl from the Westside.",4.158,/cngzHQUI0awWycL0XkYhCMEUPS9.jpg,2018-05-11,Spivak,False,5.9,14
False,/nHMDV9T4zlGm1jBbjNCYA3rwgs5.jpg,[99],490818,en,Seeing Allred,"Gloria Allred overcame trauma and personal setbacks to become one of the nation’s most famous women’s rights attorneys. Now the feminist firebrand takes on two of the biggest adversaries of her career, Bill Cosby and Donald Trump, as sexual violence allegations grip the nation and keep her in the spotlight.",3.652,/aJPw57sMUlYtmD8WvYvOrzMBt9I.jpg,2018-01-21,Seeing Allred,False,7.3,14
False,/ziz3XX1pF2j3n31EnBSP2V2kYJc.jpg,"[10749, 10770]",550022,en,Mingle All the Way,"Molly is determined to prove to her family that her new networking app—designed to pair busy professionals together for upcoming events, without long-term romance—is a success. When Molly joins Mingle All the Way and is matched with Jeff, they are both horrified to realize they’ve already had not one, but two disastrous previous encounters.",4.525,/kUSeiqBWSiOA1mYRVPlaJjJRp5t.jpg,2018-12-01,Mingle All the Way,False,7.0,19
False,/5RtpoYfCiyDC9WLzUiIIBHxdjs1.jpg,"[35, 18]",434596,en,An Actor Prepares,"After suffering a heart attack, a world-famous and hard-drinking actor is forced to drive across country with his estranged son—who testified against him in his parents' divorce—on one last madcap adventure.",3.444,/8rSc59ajnmV9EsNWdLFSjRlFfT3.jpg,2018-08-31,An Actor Prepares,False,6.3,15
