adult,backdrop_path,genre_ids,id,original_language,original_title,overview,popularity,poster_path,release_date,title,video,vote_average,vote_count
False,/4lS6cGtmvPGKKmROfoRNdXEi6HX.jpg,[18],458293,en,Michael Jackson: Searching for Neverland,"Based on the best-selling book, Remember the Time: Protecting Michael Jackson in His Final Days, and told through the eyes of Jackson's trusted bodyguards, Bill Whitfield and Javon Beard. The movie will reveal firsthand the devotion Michael Jackson had to his children, and the hidden drama that took place during the last two years of his life.",4.746,/pyCYfKn5HFgamOuKOEzNR0dfj3l.jpg,2017-05-29,Michael Jackson: Searching for Neverland,False,6.5,82
False,/hQyT8tnzI4shrTnL5RTE484LGYL.jpg,"[35, 99]",438493,en,Becoming Bond,"The stranger-than-fiction true story of George Lazenby, a poor Australian car mechanic who, through an unbelievable set of circumstances, landed the role of James Bond despite having never acted a day in his life.",4.414,/oRyVYIqegDB5rWjfloeu1Zgk332.jpg,2017-03-11,Becoming Bond,False,7.2,26
False,/bGDr4FcQzzcWlJEPVdUosZTxMCv.jpg,"[80, 99]",430448,en,I Am Jane Doe,"Chronicles the epic battle that several American mothers are waging on behalf of their middle-school daughters, victims of sex-trafficking on Backpage.com, the adult classifieds section that for years was part of the Village Voice.",3.773,/cQw2jh60Ey3zY90B8965JRclKQ2.jpg,2017-02-10,I Am Jane Doe,False,6.4,38
False,/nooS7lL0zoUMPdhOjlN51lDanKm.jpg,"[99, 10402]",430156,en,David Bowie: The Last Five Years,"In the last five years of his life, David Bowie ended nearly a decade of silence to engage in an extraordinary burst of activity, producing two groundbreaking albums and a musical. David Bowie: The Last Five Years explores this unexpected end to a remarkable career. Made with remarkable access, Francis Whately’s documentary is a revelatory follow-up to his acclaimed 2013 documentary David Bowie: Five Years, which chronicled Bowie’s golden ‘70s and early-‘80s period.",4.292,/9PrCrifbO5gf8jMmhqj6b0RfUL8.jpg,2018-01-08,David Bowie: The Last Five Years,False,7.2,22
False,/zVITKJxmvzvi5sBECmfDK1i3wA7.jpg,"[27, 53]",480007,id,Mata Batin,"When her little sister claims she sees the dead, Alia consults a psychic, who opens her own eyes to the vengeful ghosts haunting their childhood home.",4.31,/qSQoJvlvovg1Gd6q3NfjYckQiEE.jpg,2018-09-28,The 3rd Eye,False,5.3,39
False,/7SsA6Ac1Fx7IswJ3cKMm7n0naoT.jpg,[99],444526,en,Rock and a Hard Place,"A look at the Miami-Dade County Corrections and Rehabilitation Boot Camp Program, which allows young inmates undergo a strict six-week course in order to learn from their past mistakes and make a better future for themselves.",3.582,/xM40r6PbzaumRyJyuxrtSvwtfAF.jpg,2017-03-27,Rock and a Hard Place,False,6.7,15
False,/wBRZjOBXLrenb9mHVyw6z6mwwdc.jpg,"[28, 27, 878]",460962,en,Alien Convergence,"When flying reptilian creatures wreak havoc all over the world, the survivors’ only hope of stopping them is a new, state-of-the-art fighter jet piloted by the only team that knows how to use the technology.",4.821,/96xgOCz2li0IiqKYcLQh5bK7CiU.jpg,2017-06-27,Alien Convergence,False,4.0,23
False,/cvEKztuuOirbfXG7MkcIai26b5U.jpg,[35],451709,en,Lucas Brothers: On Drugs,"Deadpan twin comics Keith and Kenny Lucas take the stage in Brooklyn with a set that touches on drugs, race, Deion Sanders, teachers and O.J. Simpson.",3.49,/vTxUOKuXJVOYo3Y5erJZU7h2GUm.jpg,2017-04-18,Lucas Brothers: On Drugs,False,5.1,12
False,/y5Ru8EiBi3eMCYywTfsu25AlPFQ.jpg,"[18, 35]",458836,en,The Good Catholic,"An idealistic young priest is dedicated to his calling until he meets a woman at confession. After the meeting, he seeks guidance from his fellow priests.",2.912,/iPvggWYCZblEG2ldObR6GHmkEjz.jpg,2017-09-08,The Good Catholic,False,5.6,26
False,/3fUule7CGt4Eq1lPPqyz3qSXa8C.jpg,"[16, 10751]",430474,en,Deep,"In 2100, when humanity has abandoned the earth, a colony of extravagant creatures still thrives in the deepest abyss of the ocean.",3.764,/zMZTBbBa9eevwpWoVIVHh4Gm1ij.jpg,2017-11-25,Deep,False,5.3,46
False,/xdZHfzxMKjz2kuNZk6yHAk3WMDD.jpg,[99],433084,en,Joshua: Teenager vs. Superpower,"When the Chinese Communist Party backtracks on its promise of autonomy to Hong Kong, teenager Joshua Wong decides to save his city. Rallying thousands of kids to skip school and occupy the streets, Joshua becomes an unlikely leader in Hong Kong and one of China’s most notorious dissidents.",5.147,/2vlRtD1ApgW49YW5qDndy16XU6Z.jpg,2017-01-20,Joshua: Teenager vs. Superpower,False,7.2,19
False,/1nMWPC9DEW7fTnakxhHoDAwGsvi.jpg,"[10749, 10770]",474987,en,Marry Me at Christmas,"Organizing a Christmas wedding is a true treat for bridal boutique owner Madeline Krug. She loves the challenge of finding the perfect dress for the bride and orchestrating an exquisite event. What Madeline didn’t expect was to be swept off her feet by the bride’s gorgeous brother, movie star, Jonny Blaze. Jonny came to the quirky town of Fool’s Gold to support his sister -- not to fall in love. Yet Madeline is the most extraordinary woman he’s ever met, and she finds the real Jonny even more captivating than her celebrity crush. Will the action star be brave enough to take on the role of a lifetime?",5.685,/4fD798kQmsJeUd9zj0WENSA7PRD.jpg,2017-10-28,Marry Me at Christmas,False,6.3,30
False,,"[18, 35]",433018,en,Frat Star,"""Frat Star"" explores the alluring, superficial, manipulative, and dark world of Ivy League fraternity culture. An insecure, poor, and broken-hearted Nick enters freshman year with no interest in fraternities. This all changes when his old money roommate Billy convinces him to pledge.",3.175,/snUZhnYfF7VUacZrq0WBWezJDlf.jpg,2017-01-03,Frat Star,False,4.6,10
False,/h7fpSLYLwjX71vTszUZwb6zxLVD.jpg,[99],432972,en,The Force,"The Force presents a cinema vérité look deep inside the long-troubled Oakland Police Department as it struggles to confront federal demands for reform, a popular uprising following events in Ferguson, MO, and an explosive scandal.",3.205,/d6JrnZBu2LbpRTdpCsyjX0X3yPn.jpg,2017-01-22,The Force,False,7.0,11
False,/nk40GcxEm8JDxhaC6X6Ebdlhcpe.jpg,[18],341287,en,Breath,A pair of teenagers in Western Australia looking to escape the monotony of life in a small town take up surfing lessons from a guy named Sando.,4.898,/a5VZBFNObZQiuKkzAarrQ2R91EA.jpg,2017-11-10,Breath,False,6.9,34
False,/yPgR5tc7y83aUAAx5DvAvsi0cIv.jpg,"[35, 18, 10749]",457258,en,Ali's Wedding,"After a ""white lie"" which spirals out of control, a neurotic, naive and musically gifted Muslim cleric's eldest son must follow through with an arranged marriage, except he is madly in love with an Australian born-Lebanese girl.",3.629,/e27BoM25FfABoEpZ2NU4jlzrNlY.jpg,2018-06-08,Ali's Wedding,False,8.0,25
False,/zGPLKEasLyKMpeQPOxK6uytjv5G.jpg,"[12, 35, 9648, 10749]",401285,hi,जग्गा जासूस,A gifted teenage detective searches for his missing father with his ladylove assistant.,4.188,/aAvF8e5w4xETbx8TUesCnVFJqSF.jpg,2017-07-14,Jagga Jasoos,False,5.9,52
False,/91fNFKPf3gL7g0nxpYiIHN63YaX.jpg,[99],433056,en,Oklahoma City,The bombing of the Alfred P. Murrah Federal Building in Oklahoma City in April 1995 is the worst act of domestic terrorism in American history. This documentary explores how a series of deadly encounters between American citizens and federal law enforcement—including the standoffs at Ruby Ridge and Waco—led to it.,4.054,/tWzjeZjdoOVmcq7FBsRKRtFp183.jpg,2017-01-21,Oklahoma City,False,7.1,31
False,/e0915w6IijaXuMwlkTBvlElkerP.jpg,"[10770, 10749, 18]",474981,en,Christmas in the Air,"Lydia, a successful professional organizer, is constantly trying to grow her business, but even her ambition takes a back seat to love when she meets Robert, a frazzled widower with two young children. A toy inventor, Robert is asked to present his new Christmas toy line to a superstore. His challenge is he only has 12 days to get his life and his business in order. Talk about a Christmas rush! Lydia shows Robert that this task goes way deeper than messy junk drawers and encompasses every aspect of his life. While she’s intent on helping him straighten out details he had long ignored, Robert teaches the buttoned-up Lydia that messiness can be a delightful part of life.",3.791,/fq4oaBOE9UNUfkuRJ2lmlLLRE7H.jpg,2017-11-05,Christmas in the Air,False,6.3,22
False,/tMwNQl6dfEm76xr8SkHg5tR6IE2.jpg,[35],462108,en,Chris D'Elia: Man on Fire,"Unbridled comic Chris D'Elia reconsiders his approach to major life events like marriage, not having kids and buying pants for your friends.",3.286,/fn0tN4xEv8rdfWLOe7gU0eoC94Q.jpg,2017-06-27,Chris D'Elia: Man on Fire,False,6.1,22
False,/5vgamHn13iKvT4narVlTEZukaRi.jpg,[28],492402,en,Cops and Robbers,"A police hostage negotiator plays a dangerous game of cat and mouse with a cornered bank robber who is hell bent on getting out of the bank and humiliating his brother, the police hostage negotiator, in the process.",2.429,/jtcEfJs4pKuJBEcTjnk3H9KCo0E.jpg,2017-12-12,Cops and Robbers,False,4.8,8
False,/wauKko8jmeoz6vzjJTOxotK7eqZ.jpg,"[28, 35, 80, 10751]",461297,en,Cop and a Half: New Recruit,"In this family-friendly action reboot of the 1993 film, Karina Foley, an ambitious and spunky 12-year-old, inserts herself in a police investigation of the Badge Bandit, led by the grizzled, veteran detective Mark Simmons. Much to Simmons' disapproval, Karina partners up with him to stop the Badge Bandit from further wreaking havoc on the city. Through wit, skill, and green smoothies, Karina and Detective Simmons save the day and build a strong relationship in the process.",3.829,/hammyqlXnWWxl9nbZl1cbTM5xLH.jpg,2017-08-01,Cop and a Half: New Recruit,False,5.6,15
False,/3TExm3dpbd4c5sDDhqhdWOn7YXM.jpg,"[35, 18, 10749, 10751]",488063,en,My Christmas Prince,"Samantha, a dedicated teacher in Manhattan, returns to her home town of Maple Falls, Wyoming every year for Christmas. This year, she’s delighted when her boyfriend Alex, a European diplomat from the tiny country of Madelvia, decides to joins her. Samantha later discovers Alex is actually a prince destined for the throne, turning her entire world upside down. Realizing that staying with Alex means spending her life in the constant glare of publicity and giving up the job opportunity of a lifetime, Samantha must decide if she loves Alex enough to make the transition from teacher to royal – or will it be too big a leap",3.541,/awlaxSs334x2ngmMgs1IYvhPAbP.jpg,2017-12-03,My Christmas Prince,False,6.3,22
False,/vQaqXNUzhab6MoJdEjn2p2O2YMR.jpg,"[12, 16, 35]",315064,en,Animal Crackers,A family must use a magical box of Animal Crackers to save a rundown circus from being taken over by their evil uncle Horatio P. Huntington.,2.71,/4Z80OqqLV9t5bFuE9itUN8YhgFa.jpg,2019-01-04,Animal Crackers,False,6.5,11
False,/dIfg4CVFlntoAEiCRJwsVZmbgXF.jpg,"[12, 16, 18, 14, 878]",428288,ja,ひるね姫～知らないワタシの物語～,"Japan, 2020, a few days before the opening of the Tokyo Olympics. Although she should be studying for her final exams, Kokone, a schoolgirl who lives in a small town with her widowed father, a mysterious and talented mechanic, falls asleep often, anywhere, anytime, entering, over and over, a dream-world where a squad of fantastic motorized contraptions fights against magic, a world close to reality where she will find out the keys of her true past.",4.393,/9d27l5z9B2zyqoEtKkieBcbclMG.jpg,2017-09-08,Napping Princess,False,6.6,34
False,/r0MnA2AqIAUqAkWfsy2ZHsnMXFh.jpg,[99],426546,en,Food Evolution,"As society tackles the problem of feeding our expanding population safely and sustainably, a schism has arisen between scientists and consumers, motivated by fear and distrust. Food Evolution, narrated by Neil deGrasse Tyson, explores the polarized debate surrounding GMOs. Looking at the real-world application of food science in the past and present, the film argues for sound science and open-mindedness in a culture that increasingly shows resistance to both.",2.835,/fkH4U7ka1EoPsexkoudXJ619OMb.jpg,2017-06-23,Food Evolution,False,7.1,7
False,/m7a6ug1MMougC80saevYhuYD9Hv.jpg,[35],486331,en,DeRay Davis: How to Act Black,"Dynamic comic DeRay Davis hits the stage like a ball of fire, nailing the finer points of living, dating and handling show business as a black man.",2.424,/pNq6O6e3QbR9FzO9CeQwT12xhAo.jpg,2017-11-14,DeRay Davis: How to Act Black,False,6.1,11
False,/d27DB7vly93SXbtmpIjRFs1w59t.jpg,"[18, 10770]",450679,en,The Perfect Catch,"When Jessica Parker’s former high school boyfriend, superstar baseball player Chase Taynor, returns to town, she finds the inspiration to reinvent her struggling diner… and revisits the past to find something even better for the future.",4.973,/wLO64np21v6uKlHSMUGsRDG16II.jpg,2017-04-22,The Perfect Catch,False,6.6,20
False,/2YGamnmkJZuEmGQEuTVOlxUr8oK.jpg,[28],435848,en,"Blood, Sand & Gold","When an archaeologist discovers Sir Francis Drake's lost treasure in the Sahara Desert, it is promptly stolen and she sets off on a global quest to steal it back.",2.982,/ezNvYf6zCqzR3BipH5iFW5iQdIb.jpg,2017-03-10,"Blood, Sand & Gold",False,6.6,12
False,/6l5nPBoKIPScVZ7v55O1Hm01Wk9.jpg,[37],473165,en,Dead Again in Tombstone,"The devil’s outlaw and reluctant servant, Guerrero (Danny Trejo, Machete) returns from the dead again in this action-packed western which promises to be one hell of a ride. Guerrero is forced to protect a stolen relic from getting into the hands of Jackson Boomer (Jake Busey, Starship Troopers) and his gang of soldiers, but Jackson will stop at nothing to raise his comrades from the dead and bring the wrath of hell upon earth. Guerrero must use all his dark powers in order to defeat Jackson and find redemption…or die again trying.",4.106,/2qCQLZWLRotE5BSUVMN4ZWSIshc.jpg,2017-08-30,Dead Again in Tombstone,False,4.9,41
False,/t8hYaY0ZCX0ukmE9NGjOsmtt2K.jpg,[16],446370,en,Hi Stranger,I made this film especially for you. I needed to check in with you. I needed to tell you how I feel.,3.822,/lXMydNXO2IeZlkkolqNfmwJDRVH.jpg,2017-03-10,Hi Stranger,False,6.0,40
False,/oHOE5bd9TqgUnlIZJwp4JFMr8iO.jpg,[18],432942,en,Gook,"Eli and Daniel, two Korean American brothers who own a struggling women's shoe store, have an unlikely friendship with 11-year-old Kamilla. On the first day of the 1992 L.A. riots, the trio must defend their store—and contemplate the meaning of family, their personal dreams and the future.",3.124,/Ij6zyFnVd3ha5uR5b4na3LYux6.jpg,2017-08-18,Gook,False,6.7,25
False,/jhsvuHwwnJ1ZJMSJ41wVi6XGXje.jpg,"[10749, 10770]",459840,en,The Perfect Bride,Fitness trainer/former marriage counselor Molly White (Pascale Hutton) runs “Bridal Boot Camp:” classes combining fitness and yoga with pre-marital counseling exercises to brides and grooms before their big day.,4.572,/ogy6TOTPFIf0ipDFt5SgALEULoY.jpg,2017-06-10,The Perfect Bride,False,6.6,15
False,/mTQIqIQd8puoDcn3RBYIARc7mmq.jpg,[99],464207,en,The Truth Is in the Stars,"William Shatner sits down with scientists, innovators and celebrities to discuss how the optimism of 'Star Trek' influenced multiple generations.",4.05,/7UfW2pnvACZzYoz6HUnuxtO9cJL.jpg,2017-05-01,The Truth Is in the Stars,False,6.8,6
False,/lq15xQuW66mGikgf7ea2lQamv9v.jpg,"[53, 27]",436285,en,Serpent,"A romantic escape into nature turns into the ultimate moment of reckoning when a husband and wife are trapped in a tent with a deadly snake. Unable to escape and with certain death looming, the tent becomes a heated confessional to a cataclysmic truth. Betrayed, the couple finds themselves spiraling into a dark and dangerous space of which only one can survive.",3.63,/ixy6FurEeQwx4iuvntHCFLRP6CW.jpg,2017-06-17,Serpent,False,5.7,17
False,/mcRYV6GxRKSwcI6APldERbZCi01.jpg,[99],433010,en,Step,"The senior year of a girls’ high school step team in inner-city Baltimore is documented, as they try to become the first in their families to attend college. The girls strive to make their dancing a success against the backdrop of social unrest in their troubled city.",3.2,/427ZSBDRQ3nTst3ljrEKfQP6mx9.jpg,2017-07-28,Step,False,8.1,11
False,/jIrlyDQEqJGMRI29Ji4i6BVMCPB.jpg,"[99, 36]",451974,en,Let It Fall: Los Angeles 1982-1992,An in-depth look at the culture of Los Angeles in the ten years leading up to the 1992 uprising that erupted after the verdict of police officers cleared of beating Rodney King.,2.508,/sfMHsRoO64j6yfZCPosfQWi5y5y.jpg,2017-04-21,Let It Fall: Los Angeles 1982-1992,False,7.8,13
False,/6XNweR07KivNLK1ZODDL0tn1nCT.jpg,[99],433051,en,Cries from Syria,"An attempt to re-contextualize the European migrant crisis and ongoing hostilities in Syria, through eyewitness and participant testimony. Children and parents recount the revolution, civil war, air strikes, atrocities and ongoing humanitarian aid crises, in a portrait of recent history and the consequences of violence.",5.415,/eNfvQKttsz9Gw1veOi05FxeHQRL.jpg,2017-01-22,Cries from Syria,False,7.2,10
False,/sTdO8hEhlyd2Ior9NN8y8Gi3BBD.jpg,"[18, 10751]",470205,en,The Stray,"A young father takes his nine year old son, the family dog, and two of his son's friends backpacking in the mountains of Colorado only for all five of them to be struck by lightning.",4.161,/bxw9tRRPZHIQ3vYOubS3DVfgnDo.jpg,2017-10-06,The Stray,False,7.2,18
False,/tdCHGB6Syji3xg8LRvv5tmvPtRY.jpg,"[35, 18, 53]",421044,en,Best F(r)iends: Volume 1,"When a drifter befriends a quirky mortician, an unlikely business partnership is formed. Paranoia soon develops, however, and both men are forced to come to terms with the fragility of friendship and loyalty.",4.15,/3vDQbXCliqQCsH0EcC2v5NMuLgp.jpg,2017-09-04,Best F(r)iends: Volume 1,False,5.1,36
False,/uzTpnkeKDqCu7DtMTHZut2sD2GQ.jpg,"[18, 10749, 10770]",428586,en,Love Locks,"Lindsey Wilson first found love in the romantic city of Paris when she was a university student studying art there. Now, twenty years later, she is returning to the City of Light to take her daughter on an adventure there. With a little inspiration from the city's famed ""love locks"" on its scenic bridges, the adventure proves to be a journey of romance and rediscovery for the divorced Lindsey when she reconnects with her college flame in Paris and finds that her first love just might be the lasting love of her life after all.",4.625,/r3tn7a90Dy0QZM5cBQCdFADPkn1.jpg,2017-01-28,Love Locks,False,5.9,17
False,/kQ429IGjJroW0rGQAMb0J09ziIi.jpg,"[18, 10749, 10770]",479614,en,Christmas Homecoming,"A military widow, whose faith in Christmas has lapsed, rents an apartment to a handsome Army Captain, recovering from an injury in battle, and whose faith in Christmas is inspirational. As they team up to save the town’s military museum with a Christmas fundraising event, these two ‘wounded birds’ find themselves falling in love — and being healed by the magic of Christmas.",3.701,/3UWxy97nl7Nrgy1giZx6YnQlotw.jpg,2017-11-18,Christmas Homecoming,False,6.3,11
False,/cDxzujjknN45A14EUmjy9iFZAar.jpg,[27],436369,en,Cut Shoot Kill,"Serena Brooks, an ambitious young actress, signs on as the star of a horror film with a crew of backwoods filmmakers that have worked together for years. When the cast starts disappearing, Serena has to become her character if she wants to survive.",4.697,/xDJAZWq7kS1G6eps4oJCKOgutHU.jpg,2017-08-08,Cut Shoot Kill,False,5.7,11
False,/iF9ZzVF6hbib2fkkJ9vyVHWVlF1.jpg,"[18, 10770, 10749]",480622,en,Christmas at Holly Lodge,"Sophie Bennett begins a new holiday tradition of spending every holiday at the Evergreen Inn and Ski Lodge, which she inherited from her parents. Evergreen Inn is a special place filled with people who cannot make it home for the holidays or who have had such wonderful experiences that it has become their home-away-from-holiday-home. This Christmas, Sophie will meet an unforgettable family, and her own life will be forever changed.",3.689,/6CXRf9lNARQwCWyzVKXRD31EcUr.jpg,2017-12-03,Christmas at Holly Lodge,False,5.4,19
False,/spNNhupZ7kb5Vulqrc8s8wCKQcr.jpg,"[18, 10749, 10770]",483551,en,A Joyous Christmas,"Just before Christmas, bestselling author Rachel Kennedy returns to her hometown to host an event for her upcoming book. Though being home is difficult since losing her parents and losing touch with her brother, David, she finds strength from unexpected sources, namely her local producer, Jack and a selfless stranger, Joy. Jack and Joy help Rachel connect with the community, reunite with her brother and reevaluate her motivational message. Rachel and Jack develop an undeniable bond, but Rachel is torn between their relationship and career pressure from her manager, Stuart. As the event approaches, Joy reveals a secret from her past that has a lasting impact on Jack, and Rachel must find a message that brings her fans — and herself – lasting joy.",3.965,/HepGTcrZXntj9kVbWdtiGhwc9I.jpg,2017-11-26,A Joyous Christmas,False,5.4,14
False,/jJU6SJLbrMdYuytaDTTiqXJnmtW.jpg,"[35, 27]",426565,en,The Devil's Restaurant,A restaurant manager in New York City has made a deal with a demonic entity in order to bolster his business. What could possibly go wrong?,2.766,/csfuL0KzwtIW77PO0TzyBpXrMyd.jpg,2017-09-23,The Devil's Restaurant,False,5.0,5
False,/9xe0c5cgkjyZC06vujkfcO1pwLU.jpg,"[35, 27]",381032,en,Another Evil,"After encountering a ghost in his family's vacation home, Dan and his wife Mary hire an ""industrial-grade exorcist"" named Os to get rid of the beings.",3.742,/fC73oC0xwssWc7ty6dspPvgqfyz.jpg,2017-05-05,Another Evil,False,5.9,21
False,/3B3E5lWz3tEpq8A5sEosqtSIew1.jpg,[35],470906,en,Brad Paisley's Comedy Rodeo,"Country music star Brad Paisley hosts a night of music and laughs with comics Nate Bargatze, John Heffron, Jon Reep, Sarah Tiana and Mike E. Winfield.",3.204,/3FWHG4zuucAtvE10a25kfZk3SRP.jpg,2017-08-15,Brad Paisley's Comedy Rodeo,False,6.7,3
False,/pqonS4IXyHYQQGp4T5L0Kho9YvM.jpg,[99],376389,en,Sky Ladder: The Art of Cai Guo-Qiang,"Known for his spectacular pyrotechnic displays, Chinese artist Cai Guo-Qiang creates his most ambitious project yet: Sky Ladder, a visionary, explosive event that he pulls off in his hometown in China after 20 years of failed attempts.",4.154,/jgZRDRRbhEWHWm86yidF0Dyckz0.jpg,2016-01-21,Sky Ladder: The Art of Cai Guo-Qiang,False,7.1,18
False,/rfyWwNwKLZzqRyridsqR87yI07J.jpg,[35],461634,en,Rory Scovel Tries Stand-Up for the First Time,"Comedian Rory Scovel storms the stage in Atlanta, where he shares unfocused thoughts about things that mystify him, relationships and the ""Thong Song.""",2.662,/z4ppR4BpnXUQhIDIvQKTq0pAi6Z.jpg,2017-06-20,Rory Scovel Tries Stand-Up for the First Time,False,7.7,10
False,/nX8KyzWXWW31nRX5hTBlNXVhanF.jpg,"[878, 16, 18, 27]",361705,es,"Psiconautas, los niños olvidados","Birdboy and his animal friends plan their escape from an ecologically devastated island in this surreal, animated fantasy.",3.24,/xS6M8jigRzQ0oFG0SdAQBfmEYtd.jpg,2017-12-15,Birdboy: The Forgotten Children,False,7.6,46
False,/ul44d1kuWVFo5iG5FwAP7lTk36U.jpg,"[18, 10751]",334537,en,We Don't Belong Here,A matriarch of a dysfunctional family is pushed to her tipping point by the disappearance of her son.,3.06,/uppSRvzL8CW4dzHNzousMeaijvm.jpg,2017-04-04,We Don't Belong Here,False,6.9,15
False,/es3mYGKt6qOwDIMA54gOcbPzUaM.jpg,[27],454417,en,Unhinged,"Four American best friends decide to take the back roads travelling to a wedding in England, on their way a deadly secret forces the girls to be...",3.573,/bgniCEPwReRKkvDwgvDr1lnuLFg.jpg,2017-08-08,Unhinged,False,4.5,7
False,/vaPKGAp62QrUkm93lWSHovJGj4P.jpg,[35],488669,en,Todd Barry: Spicy Honey,"With bone-dry wit, stand-up comic Todd Barry dissects texting emergencies, Hitler's taste in wine, pricey soap, cheap pizza and much more.",3.317,/sdOmJ4Ha1rg9IW6Q1NlJ6xL91K8.jpg,2017-12-26,Todd Barry: Spicy Honey,False,7.4,15
False,/mo74Ns8wqqiacUsVX08aiZchkcR.jpg,"[27, 53, 9648]",512926,en,Against the Night,"A group of friends sneak into an abandoned prison with the intention of making a ghost hunting video, until they start to go missing one by one.",3.41,/t28BqgsQqwsgwTge37InGTshySQ.jpg,2017-09-15,Against the Night,False,4.8,10
False,/inncnFMW1eNNDzVFlVOeFdfkvIR.jpg,[99],431391,en,Saving Banksy,"Internationally known graffiti artist, Banksy, left his mark on San Francisco in April 2010. Little did he know that this act of vandalism would spark a chain of events that includes one of his rats being removed from a wall, Museums ignorantly turning down a free Banksy street work, and a NY gallerist who has made it his business model to remove Banksy street works from all over the globe doing whatever it takes to get the rat in his possession.",3.545,/6jLnufHLel6y98HJ3e2W8q30CNi.jpg,2017-01-27,Saving Banksy,False,6.6,23
False,/Am98IEySHzntGi5ecFfQ1Ozd1Mi.jpg,"[53, 18, 27]",498596,en,The Ballerina,"A man and his 9-year-old daughter disappear into the swampy Virginia backwoods. Haunted by tragedy and destitution, they must both face the painful past if they are to ever have a future.",4.531,/fJahEblmfyoeha9yws0ozYyAty5.jpg,2017-10-20,The Ballerina,False,6.4,14
False,/lOA8GjNcsE7QKfMrJMcBjNG6SJ3.jpg,"[16, 35, 10751]",484809,en,The Secret Life of Kyle,"After the events of Despicable Me 3, we follow Kyle and his secret life when Gru and his family are gone.",3.072,/5HFlCZUb12FbBpuiwkyuooMVUHQ.jpg,2017-12-05,The Secret Life of Kyle,False,6.5,7
False,/m4rVdK6GCawo2dv0jhZS4WqGIIj.jpg,"[10749, 10770]",483558,en,Sharing Christmas,"A real estate developer is given the opportunity of his career to transform an old shopping complex into a prime location. Unfortunately, there is one tenant who is holding out—the Christmas shop owner he met by happenstance just days ago.",3.832,/rbcQlnr10rmpyqGftTeZvtbKCeq.jpg,2017-12-10,Sharing Christmas,False,6.3,24
