adult,backdrop_path,genre_ids,id,original_language,original_title,overview,popularity,poster_path,release_date,title,video,vote_average,vote_count
False,/iEYDBciiuW68Q5bLCzkVBgKnfi7.jpg,"[18, 27, 9648, 53]",470229,en,Summer of 84,"Summer is usually a time for fun and games, but some teens get much more danger than they bargained for after beginning to suspect their neighbor is a serial murderer.",10.265,/qPitgXPCIFh23yCEjqnCZnfhBig.jpg,2018-08-10,Summer of 84,False,6.8,454
False,/rVwRwzu70stgEoVUJW5S1XtDh94.jpg,"[18, 36, 53]",476678,en,Backstabbing for Beginners,An idealistic young employee at the U.N. investigates the grizzly murder of his predecessor – and uncovers a vast global conspiracy that may involve his own boss.,8.663,/sAtQcotXBPAJDBPYOl47lGid5X6.jpg,2018-04-27,Backstabbing for Beginners,False,6.3,97
False,/brZ6uY49Htby7zzLB40IXhfbwH2.jpg,"[28, 27, 53]",467938,fr,Revenge,Jen's romantic getaway with her wealthy (married) boyfriend is disrupted when his friends arrive for an impromptu hunting trip. Tension mounts at the house until the situation culminates in an unexpected way.,9.003,/lDjY67pqcIoQCe0kK91TVgL14om.jpg,2018-05-11,Revenge,False,6.3,805
False,/5uayF96i4JWtdNH3uJy5IpImDBT.jpg,[35],399796,en,Life of the Party,"Dumped by her husband, longtime housewife Deanna turns regret into reset by going back to college. Winding up at the same school as her daughter, Deanna plunges headlong into the campus experience – embracing fun, freedom and frat boys.",11.752,/749iUAWQWeutQuTd9excjmigecw.jpg,2018-05-11,Life of the Party,False,6.2,526
False,/1lyoDlPPbNqLkgr8hEG9mLZDApI.jpg,[99],493099,en,RBG,"Justice Ruth Bader Ginsburg now 84, and still inspired by the lawyers who defended free speech during the Red Scare, Ginsburg refuses to relinquish her passionate duty, steadily fighting for equal rights for all citizens under the law. Through intimate interviews and unprecedented access to Ginsburg’s life outside the court, RBG tells the electric story of Ginsburg’s consuming love affairs with both the Constitution and her beloved husband Marty—and of a life’s work that led her to become an icon of justice in the highest court in the land.",8.249,/vIenhDe9DuvxODJOIpMjBheYlcS.jpg,2018-05-04,RBG,False,7.8,144
False,/wXZ2JmuQq58E9A4OcP9e8yeKFGR.jpg,"[80, 18, 53]",486947,da,Den skyldige,"Police officer Asger Holm, demoted to desk work as an alarm dispatcher, answers a call from a panicked woman who claims to have been kidnapped. Confined to the police station and with the phone as his only tool, Asger races against time to get help and find her.",8.75,/42QPG6p7oLcLd4LQOPeSTLhqfMx.jpg,2018-10-19,The Guilty,False,7.3,559
False,/i60mGxEh6NT8qcR1sHDefmSTSCT.jpg,"[35, 10749, 18]",450489,en,Irreplaceable You,A couple who have known each other since 8 are destined to be together until death do them apart.,8.241,/hkflwtWCJffdDSwg63fdDFbwOvS.jpg,2018-02-16,Irreplaceable You,False,7.1,459
False,/wLal2P43d2v4AziqkB8i1E8FjAU.jpg,"[16, 14, 10751]",475215,ja,未来のミライ,The movie follows a 4-year old boy who is struggling to cope with the arrival of a little sister in the family until things turn magical. A mysterious garden in the backyard of the boy's home becomes a gateway allowing the child to travel back in time and encounter his mother as a little girl and his great-grandfather as a young man. These fantasy-filled adventures allow the child to change his perspective and help him become the big brother he was meant to be.,10.248,/b9XvI4Nehzi0nXyNVD6DtT39P6l.jpg,2018-11-30,Mirai,False,7.3,228
False,/x5xxJhbS2PCdwf8n4NzYZISspN1.jpg,"[878, 28, 53, 18]",467824,ko,인랑,"In 2029, the elite police squad Illang combats a terrorist group opposing reunification of the two Koreas. But another enemy may be lurking nearby.",9.827,/rqyAuWM56VBUDY9DUN75yllXhJe.jpg,2018-10-19,Illang: The Wolf Brigade,False,6.3,86
False,/2reDfi3bl3givTawULOVvjEF1rR.jpg,"[18, 10749, 10752]",426618,en,Where Hands Touch,"Germany, 1944. Leyna, the 15-year old daughter of a white German mother and a black African father, meets Lutz, a compassionate member of the Hitler Youth whose father is a prominent Nazi soldier, and they form an unlikely connection in this quickly changing world.",6.996,/omKzydOrom9kpdfQUE0G9Y9sPl0.jpg,2018-09-14,Where Hands Touch,False,7.6,130
False,/aEitmeLoFACS2hUEJSo1cDyWosn.jpg,"[28, 80, 53]",497814,en,Breaking In,"Shaun Russell takes her son and daughter on a weekend getaway to her late father's secluded, high-tech vacation home in the countryside. The family soon gets an unwelcome surprise when four men break into the house to find hidden money. After managing to escape, Shaun must now figure out a way to turn the tables on the desperate thieves and save her captive children.",9.736,/60WQEFuSxb1K7q44ypDhknkscOm.jpg,2018-05-13,Breaking In,False,5.8,345
False,/9ojJB7vZR2uDqXdxOzYaADthEBT.jpg,"[28, 16, 878, 53]",471474,en,Batman: Gotham by Gaslight,"In an alternative Victorian Age Gotham City, Batman begins his war on crime while he investigates a new series of murders by Jack the Ripper.",10.228,/7souLi5zqQCnpZVghaXv0Wowi0y.jpg,2018-01-12,Batman: Gotham by Gaslight,False,6.5,311
False,/zeJCq3FU51GpGlkuGm2LLthL4hI.jpg,"[35, 18]",535437,en,Swiped,"James, a college freshman and computer genius, is enlisted by his womanizing roommate, Lance, to code the ultimate hook-up app. But when James discovers that his divorced mother is using the app, unexpected consequences ensue.",10.249,/ogVwcP644iHm9jGSajzodpoPZhK.jpg,2018-11-06,Swiped,False,4.4,345
False,/g3MUGPpNcx9cZ94TAeJGXpJK8Iv.jpg,[35],353576,en,The Con Is On,"In an effort to avoid paying off a massive gambling debt to a notorious mobster in England, a couple flees to Los Angeles and hatch a jewel theft plot.",9.712,/d4ZzzFOokK356jf6L6vUp3RKNvM.jpg,2018-05-04,The Con Is On,False,4.2,66
False,/n6ZGbtog7MiSJ7ZXToMErHUvQH0.jpg,"[35, 99]",493100,en,Robin Williams: Come Inside My Mind,"A funny, intimate and heartbreaking portrait of one of the world’s most beloved and inventive comedians, Robin Williams, told largely through his own words. Celebrates what he brought to comedy and to the culture at large, from the wild days of late-1970s L.A. to his death in 2014.",7.06,/ak9DZnzInl9oIUlXxsFsUd37ueh.jpg,2018-01-19,Robin Williams: Come Inside My Mind,False,8.1,78
False,/apjcuU7u2MsSVmJCMaIIQwnlvNl.jpg,"[28, 18, 36, 53]",401200,en,Kursk,"Barents Sea, August 12th, 2000. During a Russian naval exercise, and after suffering a serious accident, the K-141 Kursk submarine sinks with 118 crew members on board. While the few sailors who are still alive barely manage to survive, their families push for accurate information and a British officer struggles to obtain from the Russian government a permit to attempt a rescue before it is late. But general incompetence are against all their efforts.",10.24,/1Y09MkMJ8CESSPW4fcbDm9s5cAS.jpg,2019-06-21,Kursk,False,6.7,184
False,/ljZOlqLtMa6gnTHcYn9y9lP0bK3.jpg,"[53, 36, 18]",528949,es,El fotógrafo de Mauthausen,"Spanish photographer Francesc Boix, imprisoned in the Mauthausen-Gusen concentration camp, works in the SS Photographic Service. Between 1943 and 1945, he hides, with the help of other prisoners, thousands of negatives, with the purpose of showing the freed world the atrocities committed by the Nazis, exhaustively documented. He will be a key witness during the Nuremberg Trials.",8.737,/1GzwDodNHSQM7Wu8VIbvTmYXJQB.jpg,2019-02-22,The Photographer of Mauthausen,False,7.0,241
False,/yxpuqA8oK20t4BzdGUjz7sp62qu.jpg,"[18, 36, 53]",453201,en,The 15:17 to Paris,"In August 2015, an ISIS terrorist boarded train #9364 from Brussels to Paris. Armed with an AK-47 and enough ammo to kill more than 500 people, the terrorist might have succeeded except for three American friends who refused to give in to fear. One was a college student, one was a martial arts enthusiast and airman first class in the U.S. Air Force, and the other was a member of the Oregon National Guard, and all three pals proved fearless as they charged and ultimately overpowered the gunman after he emerged from a bathroom armed and ready to kill.",13.419,/qxJQ0VBCuJkJhJmuWzxI408ngwd.jpg,2018-02-09,The 15:17 to Paris,False,5.4,888
False,/qFPSiVDvhuL7E30r83R2ZxGQjWe.jpg,"[28, 12, 9648, 878, 53]",475210,en,How It Ends,A desperate father tries to return home to his pregnant wife after a mysterious apocalyptic event turns everything to chaos.,10.721,/prdFM08mGvVDA6uQxKJh8n8Vek1.jpg,2018-07-13,How It Ends,False,5.1,1059
False,/799DUUN8HnmU0gCrbsDgTFUx7z2.jpg,"[35, 18]",399725,en,Ideal Home,A couple is going through marital troubles made worse when a previously unknown grandson shows up.,7.437,/nG1LGKXuxhzgmheGxZqDYekCzCr.jpg,2018-06-29,Ideal Home,False,6.5,84
False,/2o5knHXrenSTk7vfVbxlKoJykSi.jpg,"[28, 80, 53]",531593,en,Reprisal,"Jacob, a bank manager haunted by a violent heist that took the life of a coworker, teams up with his ex-cop neighbor, James, to bring down the assailant. While the two men work together to figure out the thief’s next move, Gabriel, the highly-trained criminal, is one step ahead. When Gabriel kidnaps Jacob’s wife and daughter, Jacob barrels down a path of bloodshed that initiates an explosive counterattack and brings all three men to the breaking point.",11.47,/qBsQUK5QSeZjRPLFUVgSGHxj2PI.jpg,2018-08-31,Reprisal,False,5.0,106
False,/6On6nMv3PJAjs38cx6LmfesRXgS.jpg,"[9648, 878, 53]",457041,en,Elizabeth Harvest,"The newly married Elizabeth arrives with her new husband, the scientist Henry, at a magnificent house. He tells her that she can do there anything she pleases, except to enter a certain closed room.",8.976,/oiwY0z17ZqCPVSK1plvL11rSKuK.jpg,2018-08-10,Elizabeth Harvest,False,6.0,92
False,/AniELE0qB56s91edib9Hn0ufwqh.jpg,"[35, 18]",437586,en,Mid90s,"Stevie is a sweet 13-year-old about to explode. His mom is loving and attentive, but a little too forthcoming about her romantic life. His big brother is a taciturn and violent bully. So Stevie searches his working-class Los Angeles suburb for somewhere to belong. He finds it at the Motor Avenue skate shop.",10.219,/3HkP9ale8G43vqOF3F6wt5h86RN.jpg,2018-10-19,Mid90s,False,7.4,470
False,/7oy4miyq4WYYy0xtX6lbNVPrEsr.jpg,"[18, 878, 53]",401905,en,Fahrenheit 451,"In an oppressive future, a 'fireman' whose duty is to destroy all books begins to question his task.",11.705,/urH9H50gKbUK8U6qTVd89SLQPjx.jpg,2018-06-18,Fahrenheit 451,False,5.4,412
False,/n0z49k6qSB9QilogdbMHblUSZxp.jpg,"[28, 18]",564147,kn,ಕೆಜಿಎಫ್ ಅಧ್ಯಾಯ ೧,"A period drama set in the 1970s, KGF follows the story of a fierce rebel who rises against the brutal oppression in Kolar Gold Fields and becomes the symbol of hope to legions of downtrodden people.",9.416,/ltHlJwvxKv7d0ooCiKSAvfwV9tX.jpg,2018-12-20,K.G.F: Chapter 1,False,7.5,48
False,/cQc910ajfkO9peNiiApfcmxwycD.jpg,"[18, 35]",347866,en,Hot Summer Nights,"A teen winds up in over his head while dealing drugs with a rebellious partner and chasing the young man's enigmatic sister during the summer of 1991 that he spends in Cape Cod, Massachusetts.",8.454,/gsWdYsXkpJx2CYkveEw779O5eMg.jpg,2017-03-14,Hot Summer Nights,False,6.6,187
False,/23SZepxYhpeaBeEGiMrtWA84ANu.jpg,"[80, 18, 9648]",199928,en,The Outsider,A former American G.I. joins a yakuza family after his release from prison in post-World War II Osaka.,8.694,/m2riQcEzjVrkP8wKHDXwC5EQpHQ.jpg,2018-03-09,The Outsider,False,6.2,274
False,/f91l9YEUGRlq4NRnYdIKbYf5FJv.jpg,[18],401545,es,Todos lo saben,"Laura, a Spanish woman living in Buenos Aires, returns to her hometown outside Madrid with her Argentinian husband and children. However, the trip is upset by unexpected events that bring secrets into the open.",9.693,/1TuuM451os3NaltCwGfPCVL2BST.jpg,2019-02-08,Everybody Knows,False,6.5,499
False,/e4eeJjON17Cv7Cio3QEyC4xv5uZ.jpg,"[35, 27]",472226,en,Blood Fest,"Fans flock to a festival celebrating the most iconic horror movies, only to discover that the charismatic showman behind the event has a diabolical agenda. As attendees start dying off, three teenagers with more horror-film wits than real-world knowledge must band together and battle through every madman, monstrosity, and terrifying scenario if they have any hope of surviving.",6.728,/iy6mJ8EvVQrrSrSblK7GRYFq1Mp.jpg,2018-03-09,Blood Fest,False,5.4,76
False,/inhn4rTCAhvnu9yR5Kl1ZCRjBki.jpg,"[28, 35]",456750,en,"Game Over, Man!",Three friends are on the verge of getting their video game financed when their benefactor is taken hostage by terrorists.,10.184,/58BnnYeQOTzdMBghZIH1tSH0REx.jpg,2018-03-23,"Game Over, Man!",False,5.5,523
False,/aFabIYJSWt6mycYmCiSiJqkdFHX.jpg,"[27, 9648, 53]",521935,en,Cam,A young camgirl discovers that she’s inexplicably been replaced on her site with an exact replica of herself.,8.697,/p7m3sSQhnoT2uuxUsxF4mQX6opr.jpg,2018-11-16,Cam,False,5.9,716
False,/aZYjP0cS1zsDHgyvDo6ymxF5JEY.jpg,"[35, 18]",443009,en,"Don't Worry, He Won't Get Far on Foot","On the rocky path to sobriety after a life-changing accident, John Callahan discovers the healing power of art, willing his injured hands into drawing hilarious, often controversial cartoons, which bring him a new lease on life.",7.432,/rKsiN37qMt8jad5GikZzSeevyI9.jpg,2018-07-13,"Don't Worry, He Won't Get Far on Foot",False,6.6,256
False,/ePUiV46j9YpSVhd6runagzqVDX3.jpg,"[80, 9648, 53]",544431,en,The Clovehitch Killer,A picture-perfect family is torn apart after Tyler finds a cache of disturbing images in his father's possession. He begins to suspect that the man he trusts most in the world may be responsible for the murder of 13 girls ten years prior.,8.698,/6NmsbUJqnopbnLun2E4KvtVNj8T.jpg,2018-11-16,The Clovehitch Killer,False,6.4,189
False,/1w3liZqanWFcLn0DvvxOyWJONOC.jpg,"[18, 37]",453278,en,The Rider,"Once a rising star of the rodeo circuit, and a gifted horse trainer, young cowboy Brady is warned that his riding days are over, after a horse crushed his skull at a rodeo. Back home on the Pine Ridge Reservation, with little desire or alternatives for a different way of life, Brady’s sense of inadequacy mounts as he is unable to ride or rodeo – the essentials of being a cowboy. In an attempt to regain control of his own fate, Brady undertakes a search for new identity and what it means to be a man in the heartland of America.",9.422,/cFsrA0Is5xode2INrPj1VJcQ18n.jpg,2018-04-13,The Rider,False,7.3,180
False,/jqoGbSNsl5aO3JzeoWEf6EDoncD.jpg,"[28, 80]",500475,en,SuperFly,"Career criminal Youngblood Priest wants out of the Atlanta drug scene, but as he ramps up sales, one little slip up threatens to bring the whole operation down before he can make his exit.",9.422,/gGk9H5PVpWzbsYkmnBeKevQkwwf.jpg,2018-06-13,SuperFly,False,6.4,142
False,/cDbJAqGIsnpJfiNiYNBQYQs0ZWY.jpg,"[28, 16]",485942,ja,ニンジャバットマン,"Gorilla Grodd's time displacement machine transports many of Batman's worst enemies to feudal Japan, along with the Dark Knight and a few of his allies.",9.669,/5xSB0Npkc9Fd9kahKBsq9P4Cdzp.jpg,2018-04-24,Batman Ninja,False,5.7,487
False,/mgfxkCJLvudtnTOJml5mFbHWbk0.jpg,"[80, 18, 53]",483184,it,Dogman,"Marcello, a small and gentle dog groomer, finds himself involved in a dangerous relationship of subjugation with Simone, a former violent boxer who terrorizes the entire neighborhood. In an effort to reaffirm his dignity, Marcello will submit to an unexpected act of vengeance.",10.619,/eaZq1G8sJHv9f9a5IzioQlS3REX.jpg,2019-04-12,Dogman,False,7.7,1029
False,/euAMcJLG26pW1kv4kPEtVEwwroQ.jpg,[36],476968,en,"Paul, Apostle of Christ","Risking his life, Luke ventures to Rome to visit Paul -- the apostle who's bound in chains and held captive in Nero's darkest and bleakest prison cell. Haunted by the shadows of his past misdeeds, Paul wonders if he's been forgotten as he awaits his grisly execution. Before Paul's death, Luke resolves to write another book that details the birth of what will come to be known as the church.",11.165,/2NUXG94dGMKYgJL1BkJGKynMb3l.jpg,2018-03-28,"Paul, Apostle of Christ",False,7.0,104
False,/2UNya4dc9D6rfAeGdaNaiJXLHMB.jpg,[99],446663,en,Andre the Giant,"An ambitious and wide-ranging documentary exploring Andre’s upbringing in France, his celebrated career in WWE, and his forays in the entertainment world.",8.643,/n4t2g7NbHGu0c51jlQ2qlOZEhvr.jpg,2018-04-10,Andre the Giant,False,7.3,66
False,/xCF6Vkq1L5tTGENb07vzlQyXwKv.jpg,"[28, 12, 14]",437543,zh,西游记·女儿国,"The third installment of the blockbuster fantasy series sees the return of the Monkey King (Aaron Kwok) in his most action-packed adventure yet! While continuing their epic journey to the West, the Monkey King and his companions are taken captive by the Queen of an all-female land, who believes them to be part of an ancient prophecy heralding the fall of her kingdom. With a lot of sorcery and a little bit of charm, the travelers devise a plan to escape. But when their trickery angers the mighty River God, they realize they might just bring about the foretold destruction - unless they can find a way to quell her wrath.",7.82,/5x3rbATpy0obvtUn1kVpCj3Rvtv.jpg,2018-02-16,The Monkey King 3,False,5.8,22
False,/tq5Dq9IvXlag9iOdqoMWDx9cw7z.jpg,"[18, 53, 10752]",467952,en,The Catcher Was a Spy,"Major league baseball player, Moe Berg, a probably gay man lives a double life working for the Office of Strategic Services.",9.169,/eF6LubTEp1KI6NXUP2o5G4g9AOP.jpg,2018-06-22,The Catcher Was a Spy,False,6.3,84
False,/JLm1nRqzh8yjbzimGKa16ZFjGn.jpg,"[80, 18, 9648]",513223,es,Perdida,"A policewoman whose childhood friend disappeared in Patagonia years ago starts a new search to find answers, and soon finds her own life in danger.",8.654,/6V5rUvf4wqqkqsJGPIleOAx7Qn2.jpg,2018-08-09,Perdida,False,6.2,102
False,/kylCZCAHU1O4srE0G6MoTfIiMPd.jpg,[35],391710,en,A Futile and Stupid Gesture,"The National Lampoon name became globally recognized after the monumental success of Animal House—but before the glory days, it was a scrappy yet divinely subversive magazine and radio show that introduced the world to comedic geniuses like Bill Murray, Chevy Chase, John Belushi, and Gilda Radner. The driving force behind National Lampoon was Doug Kenney (Will Forte), and his truly wild and crazy story unfolds in A Futile and Stupid Gesture from Harvard to Hollywood to Caddyshack and beyond.",9.349,/kyHBeRgbbhs7kVrZYblVj9u2Xbd.jpg,2018-01-24,A Futile and Stupid Gesture,False,6.6,161
False,/6GyzqGMUMmSTcCdkOoEFEq2FUWD.jpg,"[35, 10402]",538604,en,The After Party,"When an aspiring rapper goes viral for the wrong reasons, he thinks his career is sunk. But a wild party gives him one more chance to make it right.",9.408,/wFPGheX6X4bt1ZqP1870MPlUvGu.jpg,2018-08-24,The After Party,False,6.3,113
False,/tKh2Gr84MBUyk8f4ClH7ZHNiAlj.jpg,"[35, 18, 10749]",514619,en,Nobody's Fool,"A woman, who gets released from prison and reunites with her sister, discovers she is in an online relationship with a man who may be ""catfishing"" her.",9.365,/2VTHRTwLlnFDlNUxc8MEeFwCQTm.jpg,2018-11-02,Nobody's Fool,False,6.2,125
False,/3Z0GbJ3NKBEbotdHxsllRBKRMmj.jpg,[18],472451,en,Boy Erased,"Jared, the son of a Baptist pastor in a small American town, is outed to his parents at age 19. Jared is faced with an ultimatum: attend a gay conversion therapy program – or be permanently exiled and shunned by his family, friends, and faith.",11.36,/oZbhTdi0ZQY7iiSQ0L7h3ya6NDF.jpg,2018-11-02,Boy Erased,False,7.2,592
False,/ikSJWKUZEgXYsB1UMAYlNxqzXwT.jpg,"[28, 80, 53]",455236,en,Accident Man,"Mike Fallon, the Accident Man, is a stone cold killer.  When a loved one is murdered by his own crew, Fallon is forced to avenge the one person who actually meant something to him.",9.645,/bHFKej3Dbr8kGRSRHpkoFHq9TJQ.jpg,2018-02-06,Accident Man,False,5.1,174
False,/xKVUBTS6UcQJ9Xptfz2luHZgQmy.jpg,"[35, 27, 53]",446101,en,Assassination Nation,"High school senior Lily and her group of friends live in a haze of texts, posts, selfies and chats just like the rest of the world. So, when an anonymous hacker starts posting details from the private lives of everyone in their small town, the result is absolute madness leaving Lily and her friends questioning whether they'll live through the night.",10.158,/q2Nmyqh84rMiBwNfC2jMjuQluW4.jpg,2018-09-21,Assassination Nation,False,6.2,330
False,/tN6iBBb5HvqqvTiURQeeMimij95.jpg,"[35, 18, 9648, 10749]",522921,zh,超时空同居,"Gu Xiaojiao, a young girl from 2018 and Lu Ming, a man from 1999, discover that they have both woken up in the same bed at the same space-time. More surprisingly, they realize that they can time travel by exiting the bedroom door. The fun begins when they start to plan a number of changes within these two eras. However, they do not know that their destiny is in the hands of a mysterious person.",6.728,/ud0N7ot24votfoMAu6BxjPGXqOV.jpg,2018-05-17,How Long Will I Love U,False,7.4,11
False,/riE6pDN9PGRenopJ8v5hNyJ2kYo.jpg,"[12, 18]",414001,en,The Mercy,"In 1968, Donald Crowhurst, an amateur sailor, endangers the fate of his family and business, and his own life, blinded by his ambition to compete in the Sunday Times Golden Globe Race, attempting to become the first person in history to single-handedly circumnavigate the world without making any stopover.",7.892,/51qWwl16Mb0hqorgffCtyENwTPP.jpg,2018-11-30,The Mercy,False,5.9,131
False,/3VUKpgrssr9iQYFAZiAbN5lbw7g.jpg,[18],418472,tr,Ahlat Ağacı,"Sinan is passionate about literature and has always wanted to be a writer. Returning to the village where he was born, he pours his heart and soul into scraping together the money he needs to be published, but his father’s debts catch up with him.",6.204,/9QNUj1e6MdyuRKxWg4v2riG97In.jpg,2019-01-30,The Wild Pear Tree,False,7.7,77
False,/tmsddF6G7vIbJ2Lg6DZDVbnhBxs.jpg,"[18, 9648, 878, 53, 10770]",569547,en,Black Mirror: Bandersnatch,"In 1984, a young programmer begins to question reality as he adapts a dark fantasy novel into a video game. A mind-bending tale with multiple endings.",11.866,/fR0VZ0VE598zl1lrYf7IfBqEwQ2.jpg,2018-12-28,Black Mirror: Bandersnatch,False,6.9,2275
False,/vDNRa1QAQqExIzmaYpGlkZw1vGL.jpg,[35],520594,en,John Mulaney: Kid Gorgeous at Radio City,"John Mulaney relays stories from his childhood and ""SNL,"" eviscerates the value of college and laments getting older in this electric comedy special.",6.606,/fERO7sktbElVbGS1SGDKzQJWxtn.jpg,2018-05-01,John Mulaney: Kid Gorgeous at Radio City,False,8.2,99
False,/99LvuMDXJ6A6I7FW61OvjDjvvAx.jpg,"[27, 53]",529962,en,The Perfection,"When troubled musical prodigy Charlotte seeks out Elizabeth, the new star pupil of her former school, the encounter sends both musicians down a sinister path with shocking consequences.",9.297,/tPDe68PDsgIGMs6wdJLtcwVVxA7.jpg,2018-09-20,The Perfection,False,6.5,525
False,/7TyDMtoylbeeH05o50OJ6wSrqV1.jpg,"[18, 10770]",467867,en,Paterno,"After becoming the winningest coach in college football history, Joe Paterno is embroiled in Penn State's Jerry Sandusky sexual abuse scandal, challenging his legacy and forcing him to face questions of institutional failure regarding the victims.",5.853,/Ad4y2Cc2FcY1wOk3DH7HVWlrgEM.jpg,2018-04-07,Paterno,False,6.4,74
False,/wMiJPxdZ4avOtqijP62T6yR1wqo.jpg,"[18, 35]",456086,en,Support the Girls,"Lisa Conroy is general manager at a highway-side 'sports bar with curves', Double Whammies. She nurtures and protects her employees fiercely - but over the course of one trying day, her optimism is battered from every direction... Double Whammies sells a big, weird American fantasy, but what happens when reality pokes a bunch of holes in it?",7.149,/hXfwrs8g3pY4mmaO5WDAowWLqBg.jpg,2018-08-24,Support the Girls,False,6.3,67
False,/oqBTd53lYKJ63vbQpAxjDS6Pxvt.jpg,"[28, 53]",416194,no,Skjelvet,"A geologist races against time to save his estranged wife and two children when a devastating earthquake strikes Oslo, Norway.",9.788,/jht2FrJLaRH1lpsRHCownjIcgcO.jpg,2018-12-14,The Quake,False,6.6,139
False,/fdFIVBpq57ZbHok07SI3gNLWUbO.jpg,"[35, 18, 10749]",462919,en,Sierra Burgess Is a Loser,A case of mistaken identity results in unexpected romance when the most popular girl in high school and the biggest loser must come together to win over their crushes.,10.339,/vjnHRySiVM4YcBYzjCxw344y9g.jpg,2018-09-07,Sierra Burgess Is a Loser,False,6.4,2507
False,/7m0UQtFp3KQxUvKNr2DN9lDPdE.jpg,"[12, 35, 14]",297725,en,The Man Who Killed Don Quixote,"Toby, a cynical advertising director finds himself trapped in the outrageous delusions of an old Spanish shoe-maker who believes himself to be Don Quixote. In the course of their comic and increasingly surreal adventures, Toby is forced to confront the tragic repercussions of a film he made in his idealistic youth.",8.88,/4o4zw2c9sfHvszIb5xpuFagnouR.jpg,2019-04-10,The Man Who Killed Don Quixote,False,7.0,459
False,/o8kdF2dZNzjEzuVZfgaSLUSVqNH.jpg,[35],399131,en,Dude,Four best friends negotiate loss and major life changes during the last two weeks of high school.,9.626,/vh4K737r0ZjrioIjHcs7ktV8RFO.jpg,2018-04-20,Dude,False,5.6,547
False,/7GR03LqwB7ePPPhaK5BAYNzt3Vm.jpg,"[35, 14, 27, 10402]",461928,en,Anna and the Apocalypse,"A zombie apocalypse threatens the sleepy town of Little Haven – at Christmas – forcing Anna and her friends to fight, slash and sing their way to survival, facing the undead in a desperate race to reach their loved ones. But they soon discover that no one is safe in this new world, and with civilization falling apart around them, the only people they can truly rely on are each other.",8.202,/36HmDXMzeLpTPEhjEbpzI3Kv4Vk.jpg,2018-11-30,Anna and the Apocalypse,False,6.4,77
False,/ljTYcQ3pkzYF52Z8ev1Z1UThnPy.jpg,"[35, 10749]",519035,en,Nappily Ever After,"After an accident at the hair salon, Violet realizes she's not living life to the fullest. A soulful barber helps her put the pieces back together.",10.082,/lxXsGqxUwSxypffv8hn3r332jf4.jpg,2018-09-21,Nappily Ever After,False,7.3,603
