adult,backdrop_path,genre_ids,id,original_language,original_title,overview,popularity,poster_path,release_date,title,video,vote_average,vote_count
False,/de2WEhXwV8CwsRAzboJz4qTCJI6.jpg,"[80, 18, 53]",500682,en,The Highwaymen,"In 1934, Frank Hamer and Manny Gault, two former Texas Rangers, are commissioned to put an end to the wave of vicious crimes perpetrated by Bonnie Parker and Clyde Barrow, a notorious duo of infamous robbers and cold-blooded killers who nevertheless are worshiped by the public.",14.589,/4bRYg4l12yDuJvAfqvUOPnBrxno.jpg,2019-03-15,The Highwaymen,False,6.7,822
False,/vA539E1zzCTO7vbHd2RGPlZdIKa.jpg,"[53, 18]",510298,en,Seberg,An ambitious young FBI agent is assigned to investigate iconic actress Jean Seberg when she becomes embroiled in the tumultuous civil rights movement in late 1960s Los Angeles.,7.781,/mPFBMfqcKgf8QOmEYCrVYZpLhxd.jpg,2019-12-13,Seberg,False,0.0,0
False,/zk56t0E9Urj17t5p0L6P2etconL.jpg,[14],636698,it,L'uomo senza gravità,A gravity-defying boy raised in seclusion matures into an extraordinary man -- and an international celebrity -- who longs for human connection.,10.405,/ukDD174mBv4IxXXho8R8CS3ocLK.jpg,2019-11-01,The Man Without Gravity,False,7.7,72
False,/eRdD7fhchQ1tdNDvIEcAkIz76bB.jpg,"[18, 878]",441183,en,Light of My Life,"Parent and child journey through the outskirts of society a decade after a pandemic has wiped out half the world's population. As a father struggles to protect his child, their bond—and the character of humanity—is tested.",10.559,/3gLH2WSY9IykYaiqDHkCCGbY7nw.jpg,2019-08-09,Light of My Life,False,6.7,61
False,,[35],642739,en,Mike Birbiglia: The New One,Comedian Mike Birbiglia hits Broadway with a hilarious yet profound one-man show that recounts his emotional and physical journey to parenthood.,12.902,/5LPwTP1PmvE0woEqblqmEHjqzpV.jpg,2019-11-26,Mike Birbiglia: The New One,False,0.0,0
False,/9HyNgy6xYikHRP3veDN26AwCLsB.jpg,"[28, 53]",531503,en,Point Blank,A nurse is forced to spring a wounded murder suspect from the hospital when the man’s brother kidnaps his pregnant wife and wants to make a trade.,10.677,/weAvkxl0dnPevIKD8fwHjiOi6tc.jpg,2019-07-12,Point Blank,False,6.0,206
False,/qfMvkKqBAZEdHLUT5Zmslu5rV5H.jpg,[36],584044,en,The Viking War,"Ingrid and her siblings are on the run from the Beserkers who have begun invading the villages, taking over, savagely using the residents on a game where they vs a Beserker, and if they win, they get to survive - only, no one ever wins. The siblings are trying to escape the Beserkers after they violently murdered and took over their town. However, the Beserkers are on their trail, and want to put them in the game.",11.148,/4Qlg1KNg8EAhOifp2ttvbi4rOI2.jpg,2019-02-05,The Viking War,False,4.2,5
False,/1EViUic4KEYukYVwolwCU2z4DE7.jpg,"[35, 10749]",582186,en,"Oh, Ramona!","Oh, Ramona! seeks the transformation of Andrew from a teenager into an adult who lives candidly and selflessly his first love story, innocent and uninvolved, alternating with the second, intense and insane story, incapable of making a choice. Oh, Ramona! is the cinematic rewriting of Andrei Ciobanu's book ""Suge-o, Ramona!"".",13.606,/mscdZrk8k6VTVOgbVF5IpsaA8sK.jpg,2019-02-14,"Oh, Ramona!",False,5.6,148
False,,"[10749, 10770]",626285,en,A Christmas Wish,"Every December in the small town of Ponchatoula, Louisiana a wooden wishing box is placed in the park as a Christmas tradition. After a night out together, Maddie encourages her sister Faith to put a wish in the box - a wish to experience true love for the first time. Faith and Maddie are surprised the next day when she meets the very handsome and eligible Andrew. As Christmas nears, Faith begins to wonder if Andrew is really perfect for her, or if the wish is leading her to her best friend, Wyatt.",11.9,,2019-11-28,A Christmas Wish,False,0.0,0
False,/h9cKOZs5z0fVmM9cZ4RPBvcojK5.jpg,[35],582570,en,Sextuplets,An expecting father-to-be discovers he has many other siblings and tries to track them down before his baby is born.,8.917,/ztGSEcowBoHyRwcK0s5kIKVVXwy.jpg,2019-08-16,Sextuplets,False,5.9,241
False,/3xqkD4QaB9qYrOgcc5YdfMvof7Z.jpg,[18],519465,da,Dronningen,"Anne, a brilliant and dedicated advocacy lawyer specialising in society’s most vulnerable, children and young adults, lives what appears to be the picture-perfect life with her doctor-husband, Peter, and their twin daughters. When her estranged teenage stepson, Gustav, moves in with them, Anne’s escalating desire leads her down a dangerous rabbit hole which, once exposed, unleashes a sequence of events destined to destroy her world.",14.196,/dfFVDIgovEfQZn53VRKLV2JQnRJ.jpg,2019-01-26,Queen of Hearts,False,7.4,35
False,/20c61yHYB92Y6M0grs9pBM62N1i.jpg,"[35, 18, 27]",503125,en,Little Monsters,A washed-up musician teams up with a teacher and a kids show personality to protect young children from a sudden outbreak of zombies.,10.121,/oQvUq7UmumBTcAnvgFLFvegY47d.jpg,2019-10-08,Little Monsters,False,7.0,67
False,/gacFeoGjwAJAsbrd90hD5ptcjoe.jpg,"[35, 10749]",513576,en,Always Be My Maybe,"Reunited after 15 years, famous chef Sasha and hometown musician Marcus feel the old sparks of attraction but struggle to adapt to each other's worlds.",9.611,/3BO6pPa7qDcpPYct061Luh9fvst.jpg,2019-05-31,Always Be My Maybe,False,6.7,614
False,/ds9GKAMhxv5AbprmZ2xCpK8FiEG.jpg,"[18, 36, 10752]",530915,en,1917,"At the height of the First World War, two young British soldiers, Schofield and Blake are given a seemingly impossible mission. In a race against time, they must cross enemy territory and deliver a message that will stop a deadly attack on hundreds of soldiers—Blake's own brother among them.",6.903,/3cn0FmkBPu6KzN2SQM0k2JfPvkB.jpg,2019-12-25,1917,False,0.0,0
False,/hpGkXl6iNdtQLXHS7xiv57N217B.jpg,[18],491480,en,The Boy Who Harnessed the Wind,"Against all the odds, a thirteen year old boy in Malawi invents an unconventional way to save his family and village from famine.",10.275,/yOr7RxHw15MMXNxGMXSmngDqHyI.jpg,2019-03-01,The Boy Who Harnessed the Wind,False,8.0,408
False,/sQENipE4TjyTnY8xBZvPKzi23jo.jpg,"[28, 10752]",627879,en,Rogue Warfare,"A group of military elite from the U.S., Russia, UK, China and France join forces to fight an elite underground terrorist network.",9.764,/78hDh9EHDMbox4FlKlOrRfrmgpU.jpg,2019-10-04,Rogue Warfare,False,5.2,5
False,/9AvYdiDWutgsy67klIMVXImmv2G.jpg,"[35, 10749]",537739,en,Can You Keep a Secret?,"Emma Corrigan, a girl with a few secrets on a turbulent plane ride, thinks she’s about to die, Emma spills them all to the handsome stranger sitting next to her. At least, she thought he was a stranger. But then, her company’s young and elusive CEO, arrives at the office. It’s him. And he knows every single humiliating detail about Emma.",10.033,/uNWk5HZfVBHpARcV1z9cwUAbtpF.jpg,2019-09-13,Can You Keep a Secret?,False,6.2,80
False,/gdb1kP1O4DeORvYCD3sElP76dpT.jpg,"[18, 10402]",603519,en,Beats,An agoraphobic hip-hop prodigy and a disgraced former music manager cross paths in Chicago’s South Side and help each other face demons of their pasts.,7.883,/b8P13nIvkkizVBzd2RpegsRt5zP.jpg,2019-06-19,Beats,False,6.4,84
False,/fcjOngTcwB2DurqKP2vwMs6qsTl.jpg,"[28, 18, 53]",500922,en,A Score to Settle,A former mob enforcer who is released from prison after serving 22 years for a crime he didn't commit sets out on a path for revenge against the people who wronged him.,13.986,/4PBwZGBP6ziKuOgHRpbVRyGoqy3.jpg,2019-08-02,A Score to Settle,False,5.4,39
False,,[],566621,en,Journey 3: From the Earth to the Moon,"Sean and Hank go on their biggest adventure yet, to the moon.",10.359,,2019-11-28,Journey 3: From the Earth to the Moon,False,0.0,0
False,/lFdAiLuRclyRz1TfY6N4PPCpMC3.jpg,"[10749, 10770]",627491,en,"Sense, Sensibility & Snowmen","Christmas enthusiast party planners Ella  and her sister, Marianne, clash with their client, Edward, who is a not-so-jolly toy company CEO.",9.558,/57WPZHvKzcPvzJn5Ar5DrYuH3QS.jpg,2019-11-30,"Sense, Sensibility & Snowmen",False,0.0,0
False,/zG9La9UUqVCH8oi3gfyuyFVAAtg.jpg,"[10749, 10770]",630916,en,Christmas at the Plaza,"With Christmas approaching in New York City, historian Jessica is hired to create an exhibition honoring the history of Christmas at The Plaza Hotel. When she is paired with Nick, a handsome decorator, they wind up enjoying a host of holiday traditions together and find themselves falling for each other.",11.848,/8jL41ASWGx5TFxRrWHbYgGBUimX.jpg,2019-11-28,Christmas at the Plaza,False,0.0,0
False,/cdCMUHWyXBOsbLL4dOEPdCEtwM4.jpg,"[28, 16, 878]",487672,en,Reign of the Supermen,"In the wake of The Death of Superman, the world is still mourning the loss of the Man of Steel following his fatal battle with the monster Doomsday. However, no sooner as his body been laid to rest than do four new bearers of the Superman shield come forward to take on the mantle. The Last Son of Krypton, Superboy, Steel, and the Cyborg Superman all attempt to fill the vacuum left by the world's greatest champion. Meanwhile, Superman's death has also signaled to the universe that Earth is vulnerable. Can these new Supermen and the rest of the heroes prove them wrong?",12.789,/e9TzqscNRUaG8HqEP3K1jUvi8pC.jpg,2019-02-15,Reign of the Supermen,False,6.8,199
False,/pre228MR8iqF2Z2H277JO5se0ze.jpg,"[18, 10749]",508791,en,The Sun Is Also a Star,"Two young New Yorkers begin to fall in love over the course of a single day, as a series of potentially life-altering meetings loom over their heads - hers concerning her family’s deportation to Jamaica, and his concerning an education at Dartmouth.",10.317,/pYfI62qgone3Ai0tzgxtQq7chDE.jpg,2019-05-17,The Sun Is Also a Star,False,6.8,160
False,/oaOZ3EavXCBKXnkNoVTVZykmoOD.jpg,[18],535845,en,Brian Banks,An All-American football player's dreams to play in the NFL are halted when he is falsely accused of rape and sent to prison.,7.187,/4MnCFcFHYAEMG4NBTUKvjhf5AhU.jpg,2019-08-09,Brian Banks,False,7.5,10
False,/3xxFtGWXybWoixONIgkMTpvbZCb.jpg,"[28, 80, 9648, 53]",552865,en,10 Minutes Gone,"When a man loses his memory after a bank heist goes wrong, he attempts to piece together the missing 10 minutes from his memory to determine who sabotaged him.",9.774,/4SZ0gaObT4rzwZBUsF8EpEoSB2N.jpg,2019-09-30,10 Minutes Gone,False,5.0,20
False,/aVYien6hGy4RQzzepZg1q9cwSzE.jpg,"[35, 10749]",515248,en,Someone Great,"An aspiring music journalist lands her dream job and is about to move to San Francisco when her boyfriend of nine years decides to call it quits. To nurse her broken heart, she and her two best friends spend one outrageous last adventure in New York City.",9.786,/h0nz5lIBXeUZChBNfwL08bLWQaU.jpg,2019-04-19,Someone Great,False,6.5,685
False,/yeRcBQ3TNtrooPPBPLq8Uw8UC8P.jpg,"[12, 16, 35, 14, 10751]",366668,en,Playmobil: The Movie,Marla is forced to abandon her carefully structured life to embark on an epic journey to find her younger brother Charlie who has disappeared into the vast and wondrous animated world of Playmobil toys.,9.189,/zPQzLZnfVw9fbXyxxglyOsmQBlu.jpg,2019-12-06,Playmobil: The Movie,False,5.7,19
False,/sEUmrp9jrKdyFSUslIuxND6CQyU.jpg,"[80, 9648]",529983,en,The Poison Rose,"A down-on-his-luck PI is hired by his old flame to investigate a murder. But while the case at first appears routine, it slowly reveals itself to be a complex interwoven web of crimes, suspects and dead bodies.",9.949,/gSzyUmg719TgAxarFZYWjLLMqvS.jpg,2019-05-24,The Poison Rose,False,4.3,80
False,/fyeWMg5xHptugAXsdfMXlUbYBpO.jpg,[18],500860,en,The Mustang,"While participating in a rehabilitation program training wild mustangs, a convict at first struggles to connect with the horses and his fellow inmates, but he learns to confront his violent past as he soothes an especially feisty horse.",10.52,/sXQzQcjNAYYosymYPVaXh1nYKaJ.jpg,2019-03-15,The Mustang,False,7.1,110
False,/7KBnKmESTfuCNmTlsy5e1KraFdX.jpg,[99],543084,en,The Biggest Little Farm,"The successes and failures of a couple determined to live in harmony with nature on a farm outside of Los Angeles are lovingly chronicled by filmmaking farmer John Chester, in this inspiring documentary.",6.711,/2CmXG3A9JmqvIYSSml2aDxIK9yT.jpg,2018-09-01,The Biggest Little Farm,False,7.8,22
False,/5OoR3aVpxXluSCe9P5mhqOa36Gb.jpg,[28],500852,en,Miss Bala,"Gloria finds a power she never knew she had when she is drawn into a dangerous world of cross-border crime. Surviving will require all of her cunning, inventiveness, and strength.",10.699,/ae9yrSAS7nLZPbbkOm61pSuIqeo.jpg,2019-02-01,Miss Bala,False,6.2,146
False,/wWmLkSZbG6TPGGlA7jFWR794TMl.jpg,"[18, 36, 10752]",489245,en,The Kill Team,"When Andrew Briggman—a young soldier in the US invasion of Afghanistan—witnesses other recruits killing innocent civilians under the direction of a sadistic Sergeant, he considers reporting them to higher-ups. However, the heavily-armed and increasingly-violent platoon becomes suspicious that someone in their ranks has turned on them, and Andrew begins to fear that he'll be the next target.",13.42,/wLRZbtrbV51oQuvqNeK6vhb6btV.jpg,2019-10-25,The Kill Team,False,6.8,17
False,/645T4C9rip5mvK2UrwTmLPIuKYd.jpg,"[28, 16, 14]",537055,en,Wonder Woman: Bloodlines,"When Amazon princess Diana of Themyscira chooses to save fighter pilot Steve Trevor, it’s a choice that will change her world and ours. Fulfilling the role of both ambassador as well as protector, Diana earns the name Wonder Woman from the gracious people of Earth. But her heart is as strong as her will as she is determined to help a troubled and embittered young girl whom has fallen in with a deadly organization known only as Villainy, Inc! Get ready for an exciting adventure packed with brutal battles, myth and wonder!",13.415,/w1SBqj0fn1j72ST5i1jauWo3swT.jpg,2019-10-05,Wonder Woman: Bloodlines,False,6.9,56
False,/uLo9PKstmhuz3LHGQoUIOPPsypT.jpg,"[36, 10749]",428836,en,Ophelia,"Ophelia comes of age as lady-in-waiting for Queen Gertrude, and her singular spirit captures Hamlet's affections. As lust and betrayal threaten the kingdom, Ophelia finds herself trapped between true love and controlling her own destiny.",6.848,/7ItW1N2L2YIWVlZh1cg2Ylh3i8f.jpg,2019-06-28,Ophelia,False,6.7,43
False,/5b5C3S4T1VY3Iz6Jwz0O3tHCisa.jpg,"[35, 18]",291867,en,Zeroville,A young actor arrives in Hollywood in 1969 during a transitional time in the Industry.,8.2,/79ZbOA6mwzuDNICi6l0rVLouNDG.jpg,2019-09-20,Zeroville,False,4.9,8
False,/fSlfaF0Ydfr2SK6hOYHvDsb7a9Z.jpg,"[14, 27, 10402]",616584,en,K-12,"Cry Baby, a strong and sensitive girl, is sent off to a disturbing sleepaway school that’s hidden underneath a grandiose façade. Luckily, she has a sweet and unapologetic best friend who sticks up for her when she gets bullied by the other students whose brains are under control by the Principal and his wicked staff. With the help of the magical friends they meet along the way, as well as an Angelic Spirit Guide, they are able to gain the strength they need to fight off the school’s belligerent patriarchal conditioning.",8.257,/nVi0yBBPj5Z96JgGWVIg94kv7bR.jpg,2019-09-05,K-12,False,7.6,80
False,/o9OlUAD4G6yZlhvjEJy7rfUHcg8.jpg,"[12, 18, 10749]",514921,en,The Aeronauts,Pilot Amelia Wren and scientist James Glaisher find themselves in an epic fight for survival while attempting to make discoveries in a hot air balloon.,7.167,/kZHnblqmTBUBgzYBIxWIz9txsEi.jpg,2019-12-06,The Aeronauts,False,6.6,11
False,/nZ1N5tDpoNm8UJBmWGoTZCRiDoQ.jpg,"[28, 12, 16]",431693,en,Spies in Disguise,"When the world's best spy is turned into a pigeon, he must rely on his nerdy tech officer to save the world.",13.037,/zZxSVoGgoTBIm6cocm6mfwrfAx3.jpg,2019-12-25,Spies in Disguise,False,0.0,0
False,/cJC829KLRYaK9ujJP6LyAqljYb8.jpg,[18],622963,en,American Son,Time passes and tension mounts in a Florida police station as an estranged interracial couple awaits news of their missing teenage son.,8.823,/lEIlxhIyFsia7yCqbfD4UH8iIkN.jpg,2019-11-01,American Son,False,6.1,65
False,/ckNp6LPhp1roR8dVI16q5u3LUMg.jpg,"[53, 9648, 27]",463684,en,Velvet Buzzsaw,"Big money artists and mega-collectors pay a high price when art collides with commerce. After a series of paintings by an unknown artist are discovered, a supernatural force enacts revenge on those who have allowed their greed to get in the way of art.",11.233,/3rViQPcrWthMNecp5XnkKev6BzW.jpg,2019-02-01,Velvet Buzzsaw,False,5.3,1035
False,/txfEqZ0eT5tcPcWnj1XJ6LLKoAZ.jpg,[35],513083,en,Wine Country,"A group of friends head to the land of oaky Chardonnays and big, bold Cabernet Sauvignons for one member of the squad’s 50th birthday party.",9.5,/mi5l29DQFdwrTXxbqM2OLbs830H.jpg,2019-05-08,Wine Country,False,5.7,259
False,/3KvBX0KTSZgw0mVIn8vaeEkEktV.jpg,"[18, 10402]",440918,en,Teen Spirit,"A shy teenager living on the Isle of Wight dreams of pop stardom. With the help of an unlikely mentor, she enters a singing competition that will test her integrity, talent, and ambition.",10.869,/aFPqJZ9vOcH7QroNxXV5wefX2qe.jpg,2019-04-12,Teen Spirit,False,5.8,81
False,/547fjELV7imMeSJrmkK2FeVHjvf.jpg,"[18, 10749]",491473,en,Gloria Bell,"Gloria is a free-spirited divorcée who spends her days at a straight-laced office job and her nights on the dance floor, joyfully letting loose at clubs around Los Angeles. After meeting Arnold on a night out, she finds herself thrust into an unexpected new romance, filled with both the joys of budding love and the complications of dating, identity, and family.",9.175,/oTfAWQXUceUszmifA4AwkIsDccQ.jpg,2019-03-08,Gloria Bell,False,6.0,102
False,/sA50fD5aLbYPRU0fMCHIZ88gc5g.jpg,"[28, 16, 10751]",581997,en,Batman vs. Teenage Mutant Ninja Turtles,"Batman, Batgirl and Robin forge an alliance with the Teenage Mutant Ninja Turtles to fight against the Turtles' sworn enemy, The Shredder, who has apparently teamed up with Ra's Al Ghul and The League of Assassins.",9.479,/yP3h0Pu8htyb9450mWJ9Vu1rU.jpg,2019-03-31,Batman vs. Teenage Mutant Ninja Turtles,False,7.0,111
False,/amj2voMoFxLpsjhQuXYNNZQ7DE0.jpg,[18],642920,en,WELCOME TO THE USA,"ALIYA is a 36-year-old Kazakh lesbian woman. Aliya for the first time in her life tried to play the Green Card Lottery and won. Now she cannot decide whether to leave Kazakhstan or stay. On the one hand, Aliya is tired of the stagnation, corruption, dictatorship of the Kazakh society, she wants changes in her life. But on the other hand, she is afraid of uncertainty and to start all over again in a foreign country.",6.154,/wsIoqWTQ6iE7oytCZArCzPQBy9H.jpg,2019-11-20,WELCOME TO THE USA,False,0.0,0
False,/r9X6Yzbr1ypmFoeh7SgH86GqKO.jpg,"[12, 35]",375785,en,Then Came You,An American hypochondriac who is working as a baggage handler is forced to confront his fears when a British teenager with a terminal illness enlists him to help her carry out her eccentric bucket list.,6.211,/658QP5tmBRUlE5JvxOnnmITfG1F.jpg,2019-02-01,Then Came You,False,7.3,144
False,/Ag1ifCsM2k1g6ZW82rX9kl3aWh5.jpg,"[10749, 10770]",629985,en,Christmas Under the Stars,"When Nick is fired from his high-powered investment firm at Christmastime, he takes a job at a Christmas tree lot. There, he meets Julie, an astronomy teacher who’s always looked to the stars for hope. As the Christmas spirit washes over him—and he begins falling for Julie—the once self-centered Nick discovers the joy of helping others.",6.96,/92MasLsFDc1hAW8hEiDiOwvwy7Y.jpg,2019-11-16,Christmas Under the Stars,False,6.5,2
False,/hhhSXlfPzsuP1bXyZRhZ6fl8Q1u.jpg,"[28, 12, 35, 10751]",520720,en,Kim Possible,"Everyday teen hero Kim Possible and her best friend Ron Stoppable embark on their freshman year of high school, all while saving the world from evil villains. While Kim and Ron have always been one step ahead of their opponents, navigating the social hierarchy of high school is more challenging than the action-hero ever imagined. With Drakken and Shego lurking in the wings, Kim must rely on her family and Team Possible—Ron, tech-genius Wade, new friend Athena, and Rufus, a Naked mole-rat.",10.171,/t37Xa74GFO1R3kebocqSV4hFrPO.jpg,2019-02-15,Kim Possible,False,4.9,74
False,/mGyMkoip5CpfcfNNQFIiuoIQkKb.jpg,[99],566222,en,The Great Hack,"Data—arguably the world’s most valuable asset—is being weaponized to wage cultural and political wars. The dark world of data exploitation is uncovered through the unpredictable, personal journeys of players on different sides of the explosive Cambridge Analytica/Facebook data story.",10.69,/uIrGgUzasEUA7v8uChRhUUFzLwE.jpg,2019-01-26,The Great Hack,False,7.0,164
False,/h23C8CiKyUtnSrlHDiT5eVCI3rY.jpg,[27],537788,en,Daniel Isn't Real,"A troubled college freshman, Luke, suffers a violent family trauma and resurrects his childhood imaginary friend Daniel to help him cope.",6.157,/zFYYFEhKS6JZvNW7gXeKeqnbcS7.jpg,2019-12-06,Daniel Isn't Real,False,0.0,0
False,/yjCW0qLgmyBUuv3KwRkuwy6yfmv.jpg,[18],522369,en,Sorry We Missed You,A story exploring the issue of hardship in modern-day Britain through a young couple scraping to get by in a casual jobs market.  A hard-up delivery driver and his carer wife are pushed to breaking point as they struggle to keep their family afloat in a world of zero-hour contracts and gig work.,11.707,/fHMBgSegb9KihekGG53f0H64YvE.jpg,2020-03-06,Sorry We Missed You,False,7.8,44
False,/m0yUUv4U8AL2RLizSauwZ9TOpXx.jpg,[35],584962,en,Between Two Ferns: The Movie,"Galifianakis dreamed of becoming a star. But when Will Ferrell discovered his public access TV show, 'Between Two Ferns' and uploaded it to Funny or Die, Zach became a viral laughing stock. Now Zach and his crew are taking a road trip to complete a series of high-profile celebrity interviews and restore his reputation.",10.159,/cHxc8v1GkzdjjhF2qnpG6wdXrOT.jpg,2019-09-20,Between Two Ferns: The Movie,False,6.1,226
False,/hTFGxpVQoDTC8kN5aJ7qgY2eWG4.jpg,"[35, 80]",437626,en,Stockholm,"Based on the extraordinary true story of the European city’s 1973 bank heist and hostage crisis that was documented in the 1974 New Yorker article “The Bank Drama” by Daniel Lang. The events grasped the world’s attention when the hostages bonded with their captors and turned against the authorities, giving rise to the psychological phenomenon known as “Stockholm Syndrome.”",7.303,/ko3AS33BLNEBcp1CO4FvdRltTxr.jpg,2019-04-12,Stockholm,False,5.8,95
False,/rYhPZz48tFtMX2KGYLHEJjbdci2.jpg,"[80, 18]",571495,it,Lo spietato,"Milan, Italy, 1967. Santo Russo, a boy of Calabrian origin, arrives north with his parents and younger brother to find better living conditions. Due to an absurd misunderstanding and his father's contempt, Santo ends up in prison, where he gets a “true education.” In 1978, he and his friends Slim and Mario embark on a 15-year criminal career, a successful and ruthless spiral of robberies, kidnappings, murders and heroin smuggling.",7.701,/4dmWp12lQua3Bpqu8CwsaGKNVUE.jpg,2019-04-19,The Ruthless,False,6.2,186
False,/uuCj46exjP6UOo976MAWACWFv1X.jpg,[10749],587693,en,A Christmas Prince: The Royal Baby,"Christmas brings the ultimate gift to Aldovia: a royal baby. But first, Queen Amber must help her family and kingdom by finding a missing peace treaty.",8.283,/8NF0YG30eCDQJ5bRTNauF48C9Bu.jpg,2019-12-05,A Christmas Prince: The Royal Baby,False,0.0,0
False,,"[27, 80, 80, 80, 80, 80, 80]",570704,en,Murdery Christmas,"In this classic home invasion horror, a babysitter has to protect her child and get them out before it's too late.",8.487,,2020-12-25,Murdery Christmas,False,0.0,1
False,/lmGjhhVlmulHCBZs8OANapElHj5.jpg,[18],527385,en,After the Wedding,"Seeking funds for her orphanage in India, Isabelle travels to New York to meet Theresa, a wealthy benefactor. An invitation to attend a wedding ignites a series of events in which the past collides with the present while mysteries unravel.",10.555,/yFLIAWYSB87toA8znkCrEXwKLO3.jpg,2019-08-09,After the Wedding,False,6.4,19
False,/jc25Na5pRA9z0FRitbHIwhU8ZAS.jpg,"[35, 18, 10749]",639609,en,Holiday Rush,"After his sudden firing, a popular radio DJ moves in with his aunt, bringing along his four spoiled children, and a plan to return to the airwaves.",8.976,/26j7TeQpy1GTfHwB7SgNA7T0t8M.jpg,2019-11-28,Holiday Rush,False,0.0,0
False,/fCtikvfjbyIINQyP1JF6qv9jCDD.jpg,"[10749, 10770]",628332,en,The Christmas Club,"Two busy strangers meet when they help an elderly woman find her lost Christmas savings. Thanks to fate and Christmas magic, they also find something they were both missing: true love.",11.535,/sZp3ObcHUbCI1dgKaKlSSYFOQFC.jpg,2019-11-27,The Christmas Club,False,0.0,0
False,/1qvFSpY0cFfhfuJza4hDzcGxypz.jpg,[99],463088,en,The Game Changers,"From the UFC Octagon in Las Vegas and the anthropology lab at Dartmouth, to a strongman gym in Berlin and the bushlands of Zimbabwe, the world is introduced to elite athletes, special ops soldiers, visionary scientists, cultural icons, and everyday heroes—each on a mission to create a seismic shift in the way we eat and live.",10.137,/eufF3xEif5EZ1gTjdubw3KWh9xU.jpg,2019-09-16,The Game Changers,False,7.7,44
False,/vjROML9rfefYS2fJQnpNdEYlXYk.jpg,"[99, 10402]",576712,en,Everybody's Everything,"The story of artist Lil Peep (Gustav Åhr) from his birth in Long Island and meteoric rise as a genre blending pop star & style icon, to his death due to an accidental opioid overdose in Arizona at just 21 years of age.",9.204,/d9Wwh98qgTzNnhNGaBS5J8tQv4B.jpg,2019-03-10,Everybody's Everything,False,9.3,3
False,/kfAefxEcXqTuQNWWSUZwRTtHd9q.jpg,[18],292011,en,Richard Jewell,"The true story of Richard Jewell, hero and then suspect of the 1996 Olympic Park bombing.",8.061,/8t00sQPe2IgPNLnKmG1EnPUu7Ua.jpg,2019-12-13,Richard Jewell,False,0.0,0
False,,"[18, 10751]",524517,en,Undertows,"Seth’s world is falling apart around him, as his hatred towards his brother will cause him to make a bad choice that could lead to his death.",12.403,,2019-11-26,Undertows,False,0.0,0
