adult,backdrop_path,genre_ids,id,original_language,original_title,overview,popularity,poster_path,release_date,title,video,vote_average,vote_count
False,/bOGkgRGdhrBYJSLpXaxhXVstddV.jpg,"[28, 12, 878]",299536,en,Avengers: Infinity War,"As the Avengers and their allies have continued to protect the world from threats too large for any one hero to handle, a new danger has emerged from the cosmic shadows: Thanos. A despot of intergalactic infamy, his goal is to collect all six Infinity Stones, artifacts of unimaginable power, and use them to inflict his twisted will on all of reality. Everything the Avengers have fought for has led up to this moment - the fate of Earth and existence itself has never been more uncertain.",85.768,/7WsyChQLEftFiDOVTGkv3hFpyyt.jpg,2018-04-27,Avengers: Infinity War,False,8.3,15842
False,/sXSp6NSu3fl52jrAc5l7bUPEBWy.jpg,"[28, 12, 878]",540247,en,Jurassic Galaxy,"In the near future, a ship of space explorers crash land on an unknown planet. They're soon met with some of their worst fears as they discover the planet is inhabited by monstrous dinosaurs.",66.493,/uo7u2bRW6KPPe4ipTUqx5RZ9rwC.jpg,2018-08-20,Jurassic Galaxy,False,2.7,18
False,/9QusGjxcYvfPD1THg6oW3RLeNn7.jpg,"[28, 12, 14]",297802,en,Aquaman,"Once home to the most advanced civilization on Earth, Atlantis is now an underwater kingdom ruled by the power-hungry King Orm. With a vast army at his disposal, Orm plans to conquer the remaining oceanic people and then the surface world. Standing in his way is Arthur Curry, Orm's half-human, half-Atlantean brother and true heir to the throne.",52.978,/5Kg76ldv7VxeX9YlcQXiowHgdX6.jpg,2018-12-21,Aquaman,False,6.8,7384
False,/uUiId6cG32JSRI6RyBQSvQtLjz2.jpg,"[28, 12, 16, 878, 35]",324857,en,Spider-Man: Into the Spider-Verse,"Miles Morales is juggling his life between being a high school student and being a spider-man. When Wilson ""Kingpin"" Fisk uses a super collider, others from across the Spider-Verse are transported to this dimension.",39.326,/iiZZdoQBEYBv6id8su7ImL0oCbD.jpg,2018-12-14,Spider-Man: Into the Spider-Verse,False,8.4,5679
False,/3P52oz9HPQWxcwHOwxtyrVV1LKi.jpg,"[28, 12, 35]",383498,en,Deadpool 2,Wisecracking mercenary Deadpool battles the evil and powerful Cable and other bad guys to save a boy's life.,43.848,/to0spRl1CMDvyUbOnbb4fTk3VAd.jpg,2018-05-10,Deadpool 2,False,7.5,9881
False,/mabuNsGJgRuCTuGqjFkWe1xdu19.jpg,"[28, 12, 16, 10751]",260513,en,Incredibles 2,"Elastigirl springs into action to save the day, while Mr. Incredible faces his greatest challenge yet – taking care of the problems of his three children.",26.193,/9lFKBtaVIhP7E2Pk0IY1CwTKTMZ.jpg,2018-06-15,Incredibles 2,False,7.5,7240
False,/3s9O5af2xWKWR5JzP2iJZpZeQQg.jpg,"[28, 12, 878]",351286,en,Jurassic World: Fallen Kingdom,"Three years after the demise of Jurassic World, a volcanic eruption threatens the remaining dinosaurs on the isla Nublar, so Claire Dearing, the former park manager, recruits Owen Grady to help prevent the extinction of the dinosaurs once again.",35.278,/c9XxwwhPHdaImA2f1WEfEsbhaFB.jpg,2018-06-22,Jurassic World: Fallen Kingdom,False,6.5,6595
False,/VuukZLgaCrho2Ar8Scl9HtV3yD.jpg,"[28, 878]",335983,en,Venom,"Investigative journalist Eddie Brock attempts a comeback following a scandal, but accidentally becomes the host of Venom, a violent, super powerful alien symbiote. Soon, he must rely on his newfound powers to protect the world from a shadowy organization looking for a symbiote of their own.",33.936,/2uNW4WbgBXL25BAbXGLnLqX71Sw.jpg,2018-10-05,Venom,False,6.6,7452
False,/88poTBTafMXaz73vYi3c74g0y2k.jpg,"[12, 16, 35, 10751]",404368,en,Ralph Breaks the Internet,"Video game bad guy Ralph and fellow misfit Vanellope von Schweetz must risk it all by traveling to the World Wide Web in search of a replacement part to save Vanellope's video game, ""Sugar Rush."" In way over their heads, Ralph and Vanellope rely on the citizens of the internet -- the netizens -- to help navigate their way, including an entrepreneur named Yesss, who is the head algorithm and the heart and soul of trend-making site BuzzzTube.",35.436,/qEnH5meR381iMpmCumAIMswcQw2.jpg,2018-11-21,Ralph Breaks the Internet,False,7.2,3437
False,/6ELJEzQJ3Y45HczvreC3dg0GV5R.jpg,"[28, 12, 14, 878]",284054,en,Black Panther,"King T'Challa returns home from America to the reclusive, technologically advanced African nation of Wakanda to serve as his country's new leader. However, T'Challa soon finds that he is challenged for the throne by factions within his own country as well as without. Using powers reserved to Wakandan kings, T'Challa assumes the Black Panther mantel to join with girlfriend Nakia, the queen-mother, his princess-kid sister, members of the Dora Milaje (the Wakandan 'special forces') and an American secret agent, to prevent Wakanda from being dragged into a world war.",39.494,/uxzzxijgPIY7slzFvMotPv8wjKA.jpg,2018-02-16,Black Panther,False,7.4,13662
False,/93xA62uLd5CwMOAs37eQ7vPc1iV.jpg,"[18, 10402]",424694,en,Bohemian Rhapsody,"Singer Freddie Mercury, guitarist Brian May, drummer Roger Taylor and bass guitarist John Deacon take the music world by storm when they form the rock 'n' roll band Queen in 1970. Hit songs become instant classics. When Mercury's increasingly wild lifestyle starts to spiral out of control, Queen soon faces its greatest challenge yet – finding a way to keep the band together amid the success and excess.",37.483,/lHu1wtNaczFPGFDTrjCSzeLPTKN.jpg,2018-11-02,Bohemian Rhapsody,False,8.0,9214
False,/qrtRKRzoNkf5vemO9tJ2Y4DrHxQ.jpg,"[12, 14, 10751]",338952,en,Fantastic Beasts: The Crimes of Grindelwald,"Gellert Grindelwald has escaped imprisonment and has begun gathering followers to his cause—elevating wizards above all non-magical beings. The only one capable of putting a stop to him is the wizard he once called his closest friend, Albus Dumbledore. However, Dumbledore will need to seek help from the wizard who had thwarted Grindelwald once before, his former student Newt Scamander, who agrees to help, unaware of the dangers that lie ahead. Lines are drawn as love and loyalty are tested, even among the truest friends and family, in an increasingly divided wizarding world.",31.229,/fMMrl8fD9gRCFJvsx0SuFwkEOop.jpg,2018-11-16,Fantastic Beasts: The Crimes of Grindelwald,False,6.9,5731
False,/mnDvPokXpvsdPcWSjNRPhiiLOKu.jpg,"[18, 10402, 10749]",332562,en,A Star Is Born,"Seasoned musician Jackson Maine discovers — and falls in love with — struggling artist Ally. She has just about given up on her dream to make it big as a singer — until Jack coaxes her into the spotlight. But even as Ally's career takes off, the personal side of their relationship is breaking down, as Jack fights an ongoing battle with his own internal demons.",38.876,/wrFpXMNBRj2PBiN4Z5kix51XaIZ.jpg,2018-10-05,A Star Is Born,False,7.5,6827
False,/r4clWIxKeWoqrHspQP0XunuUmB7.jpg,"[28, 27, 878, 53]",442249,en,The First Purge,"To push the crime rate below one percent for the rest of the year, the New Founding Fathers of America test a sociological theory that vents aggression for one night in one isolated community. But when the violence of oppressors meets the rage of the others, the contagion will explode from the trial-city borders and spread across the nation.",30.297,/litjsBoiydO6JlO70uOX4N3WnNL.jpg,2018-07-04,The First Purge,False,5.8,2109
False,/17nDJQsGVim6oows2TlN98UacbO.jpg,"[28, 12, 878]",424783,en,Bumblebee,"On the run in the year 1987, Bumblebee finds refuge in a junkyard in a small Californian beach town. Charlie, on the cusp of turning 18 and trying to find her place in the world, discovers Bumblebee, battle-scarred and broken.  When Charlie revives him, she quickly learns this is no ordinary yellow VW bug.",33.399,/fw02ONlDhrYjTSZV8XO6hhU3ds3.jpg,2018-12-21,Bumblebee,False,6.5,3057
False,/q7fXcrDPJcf6t3rzutaNwTzuKP1.jpg,"[12, 878]",333339,en,Ready Player One,"When the creator of a popular video game system dies, a virtual contest is created to compete for his fortune.",26.814,/pU1ULUq8D3iRxl1fdX2lZIzdHuI.jpg,2018-03-29,Ready Player One,False,7.6,7949
False,/q1zsnEwcApz9AdMgV4nB0jrg1qg.jpg,"[28, 12, 878]",348350,en,Solo: A Star Wars Story,"Through a series of daring escapades deep within a dark and dangerous criminal underworld, Han Solo meets his mighty future copilot Chewbacca and encounters the notorious gambler Lando Calrissian.",31.066,/3IGbjc5ZC5yxim5W0sFING2kdcz.jpg,2018-05-25,Solo: A Star Wars Story,False,6.6,4416
False,/uZTtVdOEIwPA6vwVRI3217DoPM.jpg,"[35, 10749]",466282,en,To All the Boys I've Loved Before,Lara Jean's love life goes from imaginary to out of control when her secret letters to every boy she's ever fallen for are mysteriously mailed out.,31.235,/hKHZhUbIyUAjcSrqJThFGYIR6kI.jpg,2018-08-16,To All the Boys I've Loved Before,False,7.9,5102
False,/5AijK8OxcTzuT8z6aEcc3kO96eG.jpg,"[80, 18]",470044,en,The Hate U Give,"Raised in a poverty-stricken slum, a 16-year-old girl named Starr now attends a suburban prep school. After she witnesses a police officer shoot her unarmed best friend, she's torn between her two very different worlds as she tries to speak her truth.",24.442,/2icwBom0t5nmOuZI9FVXF3gkMK0.jpg,2018-10-19,The Hate U Give,False,8.3,832
False,/aw4FOsWr2FY373nKSxbpNi3fz4F.jpg,"[28, 12]",353081,en,Mission: Impossible - Fallout,"When an IMF mission ends badly, the world is faced with dire consequences. As Ethan Hunt takes it upon himself to fulfill his original briefing, the CIA begin to question his loyalty and his motives. The IMF team find themselves in a race against time, hunted by assassins while trying to prevent a global catastrophe.",32.413,/AkJQpZp9WoNdj7pLYSj1L0RcMMN.jpg,2018-07-27,Mission: Impossible - Fallout,False,7.3,4333
False,/axjFiijtxdfK3CD9dMwrdgLwblD.jpg,"[28, 12, 53]",375588,en,Robin Hood,A war-hardened Crusader and his Moorish commander mount an audacious revolt against the corrupt English crown.,26.223,/AiRfixFcfTkNbn2A73qVJPlpkUo.jpg,2018-11-21,Robin Hood,False,5.8,1558
False,/s3FDBLH4qc1IcjexB05Qvbn3wxO.jpg,"[28, 80, 53]",449443,en,Den of Thieves,A gritty crime saga which follows the lives of an elite unit of the LA County Sheriff’s Dept. and the state’s most successful bank robbery crew as the outlaws plan a seemingly impossible heist on the Federal Reserve Bank.,24.505,/AfybH6GbGFw1F9bcETe2yu25mIE.jpg,2018-01-19,Den of Thieves,False,6.6,1411
False,/hZqx2JcZVjHSY2lMEMDC0XlObiw.jpg,[18],480530,en,Creed II,"Between personal obligations and training for his next big fight against an opponent with ties to his family's past, Adonis Creed is up against the challenge of his life.",24.367,/v3QyboWRoA4O9RbcsqH8tJMe8EB.jpg,2018-11-21,Creed II,False,6.8,2593
False,/rm2oMykm5nX6SzXFr7TGHkO6r8Z.jpg,"[12, 14]",428078,en,Mortal Engines,"Many thousands of years in the future, Earth’s cities roam the globe on huge wheels, devouring each other in a struggle for ever diminishing resources. On one of these massive traction cities, the old London, Tom Natsworthy has an unexpected encounter with a mysterious young woman from the wastelands who will change the course of his life forever.",26.804,/gLhYg9NIvIPKVRTtvzCWnp1qJWG.jpg,2018-12-14,Mortal Engines,False,6.1,2291
False,/rH79sB6Nkx4cMW3JzsUy7wK0rhX.jpg,"[28, 27, 878]",345940,en,The Meg,"A deep sea submersible pilot revisits his past fears in the Mariana Trench, and accidentally unleashes the seventy foot ancestor of the Great White Shark believed to be extinct.",24.238,/xqECHNvzbDL5I3iiOVUkVPJMSbc.jpg,2018-08-10,The Meg,False,5.9,3377
False,/6P3c80EOm7BodndGBUAJHHsHKrp.jpg,"[28, 12, 35, 878]",363088,en,Ant-Man and the Wasp,"Just when his time under house arrest is about to end, Scott Lang once again puts his freedom at risk to help Hope van Dyne and Dr. Hank Pym dive into the quantum realm and try to accomplish, against time and any chance of success, a very dangerous rescue mission.",25.982,/eivQmS3wqzqnQWILHLc4FsEfcXP.jpg,2018-07-06,Ant-Man and the Wasp,False,7.0,7293
False,/6pT73ACl5N1VekdK3wQI8PLfz1E.jpg,"[28, 12, 14, 878]",268896,en,Pacific Rim: Uprising,"It has been ten years since The Battle of the Breach and the oceans are still, but restless. Vindicated by the victory at the Breach, the Jaeger program has evolved into the most powerful global defense force in human history. The PPDC now calls upon the best and brightest to rise up and become the next generation of heroes when the Kaiju threat returns.",23.605,/v5HlmJK9bdeHxN2QhaFP1ivjX3U.jpg,2018-03-23,Pacific Rim: Uprising,False,5.9,2514
False,/4DUoPZOHdPuROP4nyEIsPaMIiQl.jpg,"[27, 9648, 53]",493922,en,Hereditary,"When Ellen, the matriarch of the Graham family, passes away, her daughter’s family begins to unravel cryptic and increasingly terrifying secrets about their ancestry.",19.668,/lHV8HHlhwNup2VbpiACtlKzaGIQ.jpg,2018-06-08,Hereditary,False,7.0,3093
False,/13VjjUeJ6mcDUB36XRu4YFpYNSm.jpg,"[28, 80, 18, 53]",400535,en,Sicario: Day of the Soldado,Agent Matt Graver teams up with operative Alejandro Gillick to prevent Mexican drug cartels from smuggling terrorists across the United States border.,22.452,/msqWSQkU403cQKjQHnWLnugv7EY.jpg,2018-06-29,Sicario: Day of the Soldado,False,6.7,1537
False,/4PZuqUVwvxPCEMV8LYSAJLuxvcq.jpg,"[28, 35, 80, 53]",402900,en,Ocean's Eight,"Debbie Ocean, a criminal mastermind, gathers a crew of female thieves to pull off the heist of the century at New York's annual Met Gala.",20.747,/MvYpKlpFukTivnlBhizGbkAe3v.jpg,2018-06-08,Ocean's Eight,False,6.9,4296
False,/h51DdjaDD2aPu1fLHsmpJaaJinS.jpg,"[80, 18, 53]",504172,en,The Mule,"Earl Stone, a man in his eighties, is broke, alone, and facing foreclosure of his business when he is offered a job that simply requires him to drive. Easy enough, but, unbeknownst to Earl, he's just signed on as a drug courier for a Mexican cartel. He does so well that his cargo increases exponentially, and Earl hit the radar of hard-charging DEA agent Colin Bates.",23.08,/oeZh7yEz3PMnZLgBPhrafFHRbVz.jpg,2018-12-14,The Mule,False,6.6,2215
False,/9ywA15OAiwjSTvg3cBs9B7kOCBF.jpg,"[18, 10749]",337167,en,Fifty Shades Freed,"Believing they have left behind shadowy figures from their past, newlyweds Christian and Ana fully embrace an inextricable connection and shared life of luxury. But just as she steps into her role as Mrs. Grey and he relaxes into an unfamiliar stability, new threats could jeopardize their happy ending before it even begins.",20.732,/9ZedQHPQVveaIYmDSTazhT3y273.jpg,2018-02-09,Fifty Shades Freed,False,6.2,3802
False,/m03jul0YdVEOFXEQVUv6pOVQYGL.jpg,"[16, 35, 14, 10751]",400155,en,Hotel Transylvania 3: Summer Vacation,"Dracula, Mavis, Johnny and the rest of the Drac Pack take a vacation on a luxury Monster Cruise Ship, where Dracula falls in love with the ship’s captain, Ericka, who’s secretly a descendant of Abraham Van Helsing, the notorious monster slayer.",21.182,/gjAFM4xhA5vyLxxKMz38ujlUfDL.jpg,2018-06-30,Hotel Transylvania 3: Summer Vacation,False,6.8,1930
False,/bLJTjfbZ1c5zSNiAvGYs1Uc82ir.jpg,"[28, 12, 14]",338970,en,Tomb Raider,"Lara Croft, the fiercely independent daughter of a missing adventurer, must push herself beyond her limits when she finds herself on the island where her father disappeared.",22.89,/3zrC5tUiR35rTz9stuIxnU1nUS5.jpg,2018-03-16,Tomb Raider,False,6.3,4771
False,/ph5fElfh4U7O3jwhFljxz2LDp1l.jpg,"[35, 18, 36]",375262,en,The Favourite,"England, early 18th century. The close relationship between Queen Anne and Sarah Churchill is threatened by the arrival of Sarah's cousin, Abigail Hill, resulting in a bitter rivalry between the two cousins to be the Queen's favourite.",20.61,/cwBq0onfmeilU5xgqNNjJAMPfpw.jpg,2018-11-23,The Favourite,False,7.6,2606
False,/7rqpB7coXaNvTVMWb5vL8qU0pBp.jpg,"[14, 53]",448095,en,I Still See You,"A spellbinding and romantic supernatural thriller. Ten years after an apocalyptic event left the world haunted by ghosts, Roni receives a threatening message from beyond the grave. Joining forces with a mysterious classmate, Kirk, Roni descends into a shadow world that blurs the bounds of the living and the dead-and begins a desperate race against time to stop a cunning killer.",21.027,/9fqzZs922V8OmwgO11Eqclof2mQ.jpg,2018-10-12,I Still See You,False,6.8,293
False,/78PjwaykLY2QqhMfWRDvmfbC6EV.jpg,"[35, 18]",490132,en,Green Book,"Tony Lip, a bouncer in 1962, is hired to drive pianist Don Shirley on a tour through the Deep South in the days when African Americans, forced to find alternate accommodations and services due to segregation laws below the Mason-Dixon Line, relied on a guide called The Negro Motorist Green Book.",24.675,/7BsvSuDQuoqhWmU2fL7W2GOcZHU.jpg,2018-11-16,Green Book,False,8.3,4721
False,/roYyPiQDQKmIKUEhO912693tSja.jpg,"[18, 27, 878]",447332,en,A Quiet Place,A family is forced to live in silence while hiding from creatures that hunt by sound.,23.65,/nAU74GmpUk7t5iklEp3bufwDq4n.jpg,2018-04-06,A Quiet Place,False,7.3,6655
False,/jrudoaXcoLyHRPdolyOGemXgPEs.jpg,"[18, 36]",369972,en,First Man,"A look at the life of the astronaut, Neil Armstrong, and the legendary space mission that led him to become the first man to walk on the Moon on July 20, 1969.",20.998,/i91mfvFcPPlaegcbOyjGgiWfZzh.jpg,2018-10-12,First Man,False,7.1,2831
False,/f4E0ocYeToEuXvczZv6QArrMDJ.jpg,"[28, 12, 27, 878, 53]",346910,en,The Predator,"When a kid accidentally triggers the universe's most lethal hunters' return to Earth, only a ragtag crew of ex-soldiers and a disgruntled female scientist can prevent the end of the human race.",23.994,/wMq9kQXTeQCHUZOG4fAe5cAxyUA.jpg,2018-09-14,The Predator,False,5.3,2364
False,/xIAaN3AQqaJiN5RJ0WsmBady8Hq.jpg,[28],440471,en,Escape Plan 2: Hades,"Ray Breslin manages an elite team of security specialists trained in the art of breaking people out of the world's most impenetrable prisons. When his most trusted operative, Shu Ren, is kidnapped and disappears inside the most elaborate prison ever built, Ray must track him down with the help of some of his former friends.",20.344,/Aqhl55vpzxNFqVfc2DpedUsR39L.jpg,2018-06-29,Escape Plan 2: Hades,False,4.7,648
False,/30fm0P60ESjzc5x1CJeTh7padAf.jpg,"[18, 10749]",571346,en,American Kamasutra,A young woman finds herself involved in a dangerous love triangle when she gets involved with the writer of a popular steamy novel.,21.396,/6PlW27Cnaa6mtKeDxZPPBStfRiH.jpg,2018-12-13,American Kamasutra,False,5.2,11
False,/7RqpTZq0mPpTcEwZ6qqwRZAFoLe.jpg,"[28, 35]",567604,en,Once Upon a Deadpool,"A kidnapped Fred Savage is forced to endure Deadpool's PG-13 rendition of Deadpool 2 as a Princess Bride-esque story that's full of magic, wonder & zero F's.",20.077,/5Ka49BWWyKMXr93YMbH5wLN7aAM.jpg,2018-12-11,Once Upon a Deadpool,False,6.9,309
False,/juc9wt7Eh2IarLL5S1yQ1a21O1A.jpg,"[16, 35, 14, 10751]",360920,en,The Grinch,The Grinch hatches a scheme to ruin Christmas when the residents of Whoville plan their annual holiday celebration.,26.448,/smxA8yvZ0LzDPer9BIRd4pyOpx1.jpg,2018-11-09,The Grinch,False,6.4,1266
False,/5zfVNTrkhMu673zma6qhFzG01ig.jpg,"[27, 878]",300668,en,Annihilation,"A biologist signs up for a dangerous, secret expedition into a mysterious zone where the laws of nature don't apply.",22.998,/d3qcpfNwbAMCNqWDHzPQsUYiUgS.jpg,2018-02-23,Annihilation,False,6.3,4957
False,/z6m7s4w4Erxnr5k2jc1TZR1AMva.jpg,"[18, 53]",405774,en,Bird Box,"Five years after an ominous unseen presence drives most of society to suicide, a survivor and her two children make a desperate bid to reach safety.",19.805,/rGfGfgL2pEPCfhIvqHXieXFn7gp.jpg,2018-11-12,Bird Box,False,6.9,5549
False,/grtVFGJ4ts0nDAPpc1JWbBoVKTu.jpg,[28],450001,cn,葉問外傳：張天志,"Following his defeat by Master Ip, Cheung Tin Chi (Zhang) tries to make a life with his young son in Hong Kong, waiting tables at a bar that caters to expats. But it s not long before the mix of foreigners, money, and triad leaders draw him once again to the fight.",20.191,/6VxEvOF7QDovsG6ro9OVyjH07LF.jpg,2019-04-12,Master Z: Ip Man Legacy,False,5.4,196
False,/tNAeOH1SGKN4R7cGN9ZPH1LMpHK.jpg,"[18, 10749]",446696,en,Life Itself,"As a young New York couple goes from college romance to marriage and the birth of their first child, the unexpected twists of their journey create reverberations that echo over continents and through lifetimes.",14.864,/buQjT2YXHwdXQjrMmwiAOl0vO0w.jpg,2018-09-21,Life Itself,False,7.1,145
False,/v6eOq707lwWFIG96Rv9sSR6lnnT.jpg,"[18, 9648, 53]",491584,ko,버닝,"Deliveryman Jongsu is out on a job when he runs into Haemi, a girl who once lived in his neighborhood. She asks if he'd mind looking after her cat while she's away on a trip to Africa. On her return she introduces to Jongsu an enigmatic young man named Ben, who she met during her trip. And one day Ben tells Jongsu about his most unusual hobby...",20.839,/4NScXB4cx4cjN8hBF6Rh8OvAdAc.jpg,2018-11-09,Burning,False,7.4,473
False,/cwiJQXezWz876K3jS57Sq56RYCZ.jpg,"[35, 14, 10751]",400650,en,Mary Poppins Returns,"In Depression-era London, a now-grown Jane and Michael Banks, along with Michael's three children, are visited by the enigmatic Mary Poppins following a personal loss. Through her unique magical skills, and with the aid of her friend Jack, she helps the family rediscover the joy and wonder missing in their lives.",23.355,/uTVGku4LibMGyKgQvjBtv3OYfAX.jpg,2018-12-19,Mary Poppins Returns,False,6.6,1835
False,/a24i4Qw6qFTtkFLQsncv8WPwevj.jpg,"[28, 80, 53]",345887,en,The Equalizer 2,"Robert McCall, who serves an unflinching justice for the exploited and oppressed, embarks on a relentless, globe-trotting quest for vengeance when a long-time girl friend is murdered.",23.425,/cQvc9N6JiMVKqol3wcYrGshsIdZ.jpg,2018-07-20,The Equalizer 2,False,6.5,2397
False,/qJXqEzjJOa93q50mrSSEr1ELsD6.jpg,"[10749, 10751]",540158,en,High Strung Free Dance,"Zander Raines, a dazzling and tempestuous young choreographer, gives the break of a lifetime to two hopeful artists when he casts a stunning contemporary dancer, Barlow, and innovative pianist, Charlie, in New York’s most-anticipated new Broadway show: Free Dance. But the move throws off the show’s delicate creative balance when Charlie falls hard for Barlow while Zander embraces her as his muse.",24.281,/2PKXkTik1sOICveKTNh6BspD5Xj.jpg,2019-10-11,High Strung Free Dance,False,7.2,72
False,/s75CDPm61dDM7C5STW884J6uFk1.jpg,"[12, 18]",453755,en,Arctic,"A man stranded in the Arctic is finally about to receive his long awaited rescue. However, after a tragic accident, his opportunity is lost and he must then decide whether to remain in the relative safety of his camp or embark on a deadly trek through the unknown for potential salvation.",26.312,/dxRc0Y4IjSRLC2fYaguXQtJCI4e.jpg,2019-02-01,Arctic,False,6.3,369
False,/sHNC8hjAu4ZKXYhG3cp8ghRZ02B.jpg,"[27, 878, 10752]",438799,en,Overlord,"France, June 1944. On the eve of D-Day, some American paratroopers fall behind enemy lines after their aircraft crashes while on a mission to destroy a radio tower in a small village near the beaches of Normandy. After reaching their target, the surviving paratroopers realise that, in addition to fighting the Nazi troops that patrol the village, they also must fight against something else.",16.833,/l76Rgp32z2UxjULApxGXAPpYdAP.jpg,2018-11-09,Overlord,False,6.6,1313
False,/n49difnnZ8e0CZTvulnMRoURdQj.jpg,"[35, 18, 36]",429197,en,Vice,"George W. Bush picks Dick Cheney, the CEO of Halliburton Co., to be his Republican running mate in the 2000 presidential election. No stranger to politics, Cheney's impressive résumé includes stints as White House chief of staff, House Minority Whip and defense secretary. When Bush wins by a narrow margin, Cheney begins to use his newfound power to help reshape the country and the world.",16.667,/seqLrPNbWJdcX6PeEhBNkmxjz6h.jpg,2018-12-25,Vice,False,7.1,1637
False,/eZeKHAqNsDAG6r8hi4sMzwqHn5n.jpg,[10749],556803,en,The Princess Switch,"When a down-to-earth Chicago baker and a soon-to-be princess discover they look like twins, they hatch a Christmastime plan to trade places.",20.808,/biRUM4CBgfJtEQDCttf3zca4epp.jpg,2018-11-16,The Princess Switch,False,7.1,1299
False,/qUAGip3XiaVN668WXF2iyukWgUu.jpg,"[28, 53, 878, 27]",500664,en,Upgrade,"A brutal mugging leaves Grey Trace paralyzed in the hospital and his beloved wife dead. A billionaire inventor soon offers Trace a cure — an artificial intelligence implant called STEM that will enhance his body. Now able to walk, Grey finds that he also has superhuman strength and agility — skills he uses to seek revenge against the thugs who destroyed his life.",19.427,/8fDtXi6gVw8WUMWGT9XFz7YwkuE.jpg,2018-06-01,Upgrade,False,7.3,1618
False,/clmYuR1t4TtKcakIOvYIPrjyxDc.jpg,"[28, 53]",399035,en,The Commuter,"A businessman, on his daily commute home, gets unwittingly caught up in a criminal conspiracy that threatens not only his life but the lives of those around him.",20.614,/rDeGK6FIUfVcXmuBdEORPAGPMNg.jpg,2018-01-12,The Commuter,False,6.2,2607
False,/h5BvesqaxL7V3vl1CmaR8waGyiM.jpg,"[12, 35, 14, 27, 10751]",442062,en,Goosebumps 2: Haunted Halloween,"Two boys face an onslaught from witches, monsters, ghouls and a talking dummy after they discover a mysterious book by author R. L. Stine.",18.235,/t2wy38iiMpB8WsgJi3lYeDnGh2H.jpg,2018-10-12,Goosebumps 2: Haunted Halloween,False,5.7,600
False,/fgsHxz21B27hOOqQBiw9L6yWcM7.jpg,"[27, 9648, 53]",439079,en,The Nun,"When a young nun at a cloistered abbey in Romania takes her own life, a priest with a haunted past and a novitiate on the threshold of her final vows are sent by the Vatican to investigate. Together they uncover the order’s unholy secret. Risking not only their lives but their faith and their very souls, they confront a malevolent force in the form of the same demonic nun that first terrorized audiences in “The Conjuring 2” as the abbey becomes a horrific battleground between the living and the damned.",19.511,/sFC1ElvoKGdHJIWRpNB3xWJ9lJA.jpg,2018-09-07,The Nun,False,5.6,3225
