adult,backdrop_path,genre_ids,id,original_language,original_title,overview,popularity,poster_path,release_date,title,video,vote_average,vote_count
False,/ypyz71O2YtI5rdJ7Y3s03SwwORQ.jpg,"[10752, 28, 36, 53]",339259,en,The Man with the Iron Heart,"With the Third Reich is at his peak in 1942, the Czech resistance in London plans the most ambitious military operation of WWII –  Anthropoid. Two young recruits are sent to Prague to assassinate the most ruthless Nazi leader – Reinhardt Heydrich – head of the SS, the Gestapo and the architect of the Final Solution.",11.786,/ZVQfCY2DgCjrm8w2saXvT8Ao3B.jpg,2017-07-07,The Man with the Iron Heart,False,6.5,332
False,/ixD3JT1tUGKu1l6MtwI1jKIuer0.jpg,"[18, 878, 53]",286538,en,Bokeh,"On a romantic getaway to Iceland, a young American couple wake up one morning to discover every person on Earth has disappeared. Their struggle to survive and to reconcile the mysterious event lead them to reconsider everything they know about themselves and the world.",6.581,/cedeEgSeKpsFZH9z9LgWbEqILlW.jpg,2017-03-24,Bokeh,False,5.4,157
False,/hgn5SrO9lRh6yRkoubBH9x1NqHm.jpg,"[27, 53]",416160,en,The Vault,Two estranged sisters are forced to rob a bank in order to save their brother. But this is no ordinary bank.,8.583,/ycK6nMAEjViBT4b3scuKpNRnilB.jpg,2017-09-01,The Vault,False,4.8,211
False,/p0UpMWsISGexlFccIg4baEjyj76.jpg,[53],76812,en,Black Butterfly,"Paul is a down-on-his-luck screenwriter who picks up a drifter and offers him a place to stay. However, when the deranged stranger takes Paul hostage and forces him to write, their unhinged relationship brings buried secrets to light.",10.83,/cbFMuxF8p6C7Sbutbxsc4M57jrH.jpg,2017-05-26,Black Butterfly,False,6.3,321
False,/nCNZvdDBT985FUENHNGFGtO6LGS.jpg,"[35, 18]",415401,en,The Party,"Various individuals think they’re coming together for a party in a private home, but a series of revelations results in a huge crisis that throws their belief systems – and their values – into total disarray.",9.582,/jh8xTXmP3omSMo4pg8lXaI8EiWN.jpg,2018-02-16,The Party,False,6.3,244
False,/ipJvjRyXMOIbOf9Ivr5QU5kSOGC.jpg,"[18, 80]",468284,fr,L'Insulte,"After an emotional exchange between a Lebanese Christian and a Palestinian refugee escalates, the men end up in a court case that gets national attention.",7.28,/w9mlrckg3ZU2rsAlKUbLD1CgBTk.jpg,2018-01-12,The Insult,False,7.6,244
False,/3uwyXMZN93PRkShUxvLrufwVAc2.jpg,"[80, 18, 27, 9648, 53]",452507,en,1922,"A simple yet proud rancher conspires to murder his wife for financial gain, convincing his teenage son to participate.",11.68,/q4FQOiSRhTLWulHl5Vpg37FMArH.jpg,2017-10-20,1922,False,5.9,1423
False,/yCRYYGldFGVa4cmZVpTVCRQMfjA.jpg,"[28, 18]",350312,te,Baahubali 2: The Conclusion,"When Mahendra, the son of Bahubali, learns about his heritage, he begins to look for answers. His story is juxtaposed with past events that unfolded in the Mahishmati Kingdom.",9.325,/sXf30F2HFpsFPXlNz7jpOySSV9I.jpg,2017-04-27,Baahubali 2: The Conclusion,False,7.0,273
False,/2cFFvMkApD552jkCXbGVp449HZC.jpg,"[18, 9648, 53]",363126,en,Berlin Syndrome,A passionate holiday romance leads to an obsessive relationship when an Australian photojournalist wakes one morning in a Berlin apartment and is unable to leave.,9.571,/qvJeDDYKlfvtYayfOj5sAUXxUju.jpg,2017-05-26,Berlin Syndrome,False,6.1,368
False,/lEcyWri5upHP86NO2LyRBEiC7Rn.jpg,"[35, 18]",396810,en,The Last Word,"A retired businesswoman – who tries to control everything around her – decides to write her own obituary. A young journalist takes up the task of finding out the truth, and the result is a life-altering friendship.",7.32,/zvwBd0nsW5OqTs4ndEJLQY62leF.jpg,2017-03-03,The Last Word,False,6.6,203
False,/lc2AI7UHqLgp9VkY91BgfUonYY8.jpg,"[99, 10402]",472424,en,Gaga: Five Foot Two,Go behind the scenes with pop provocateur Lady Gaga as she releases a bold new album and prepares for her Super Bowl halftime show.,8.072,/g0NONcnzzvWoASFjFoDqXZUW6SV.jpg,2017-09-22,Gaga: Five Foot Two,False,7.7,400
False,/sUKRP2rDqi2Kfh8c2xO8WJKi0sU.jpg,"[53, 27]",433244,en,Clinical,"A psychiatrist tries to put her life back together after a violent attack by seeking to repair the life of a new patient, but he has his own terrifying history.",8.814,/yDnaWPY7MNVaHA0IuUtkgkxGI1c.jpg,2017-01-13,Clinical,False,5.3,226
False,/pMYSFleKKpLGhIbTiqd3o5r96jo.jpg,"[878, 53]",473072,en,2036: Nexus Dawn,"This in-world short film takes place in the year 2036 and revolves around Jared Leto’s character, Niander Wallace. In this short, Wallace introduces a new line of “perfected” replicants called the Nexus 9, seeking to get the prohibition on replicants repealed. This no doubt has serious ramifications that will be crucial to the plot of Blade Runner 2049.",8.819,/qPci3811kFmPPEevGrnjeKWokD4.jpg,2017-08-29,2036: Nexus Dawn,False,7.1,172
False,/gkBaeafV5wBUnnb1EZct5kqQm2Z.jpg,[53],301355,en,Message from the King,"On a relentless quest to avenge his sister's murder, a man from Cape Town infiltrates a sprawling network of lowlifes and elites in Los Angeles.",9.062,/jHaBKUJaVuTRh66sua70ikg9Fts.jpg,2017-08-04,Message from the King,False,6.4,218
False,/u3hiCBwJ2yGCiJb3kOoqXThTQ7Z.jpg,"[28, 16, 878]",460790,en,Starship Troopers: Traitor of Mars,"Federation trooper Johnny Rico is ordered to work with a group of new recruits on a satellite station on Mars, where giant bugs have decided to target their next attack.",10.852,/dzqEq8Jbvb5SYGoYPqLyIRrt6Cm.jpg,2017-08-21,Starship Troopers: Traitor of Mars,False,5.6,124
False,/rGLBrKj6D8mrehruZoHsVktqGl6.jpg,"[18, 14, 9648, 53]",397837,en,Before I Fall,"Samantha Kingston has everything. Then, everything changes. After one fateful night, she wakes up with no future at all. Trapped into reliving the same day over and over, she begins to question just how perfect her life really was.",11.76,/eowzonDJMCuNXoJGVkP9Z7oCmiM.jpg,2017-03-03,Before I Fall,False,7.0,2340
False,/3vSrGsnMjzAycIU80udh7NFAJkP.jpg,"[878, 18, 9648]",395814,en,Rememory,The widow of a wise professor stumbles upon one of his inventions that's able to record and play a person's memory.,7.807,/qz3mvkpTOQOEqzxenvaaObOMarj.jpg,2017-09-08,Rememory,False,6.0,237
False,/aQ06MnEDLh9X3ZOtY21UD2XB197.jpg,"[18, 27, 53]",316154,en,The Bad Batch,"In a desert wasteland in Texas, a muscled cannibal breaks one important rule: don’t play with your food.",9.053,/7o14VaMphEIzPwzeW6FP3A6zb4W.jpg,2017-06-23,The Bad Batch,False,5.2,537
False,/4cuMgrl1TVGjMaRQ3bKWTu61nem.jpg,"[18, 10749]",257785,en,Tulip Fever,An artist falls for a married young woman while he's commissioned to paint her portrait. The two invest in the risky tulip market in hopes to build a future together.,10.053,/qoOWoobioQckgbk4B9Dqn2mBMSJ.jpg,2017-08-25,Tulip Fever,False,6.5,335
False,/nmWcy1bkUiRe5CkJSxAIbNWPS2X.jpg,"[99, 10402]",448449,en,Whitney: Can I Be Me,The life and tragic death of Whitney Houston.,8.301,/lTIpS9tlEn625aWMK8DvPR5S335.jpg,2017-04-27,Whitney: Can I Be Me,False,6.4,109
False,/uousshudWOwQrDmAI23oCGpKD7m.jpg,"[10749, 10752, 35, 18]",340101,en,Their Finest,"During the Blitz of World War II, a female screenwriter (Gemma Arterton) works on a film celebrating England's resilience as a way to buoy a weary populace's spirits. Her efforts to dramatise the true story of two sisters (Lily Knight and Francesca Knight) who undertook their own maritime mission to rescue wounded soldiers are met with mixed feelings by a dismissive all-male staff.",7.797,/tF0dhJfxzOjvkybJVfNPuuj5ClH.jpg,2017-04-07,Their Finest,False,6.8,225
False,/enwPgakYeduofhVxvS2KGR0nIpm.jpg,"[35, 18]",411741,en,Ingrid Goes West,"Ingrid becomes obsessed with a social network star named Taylor Sloane who seemingly has a perfect life. But when Ingrid decides to drop everything and move west to be Taylor's friend, her behaviour turns unsettling and dangerous.",8.548,/3LEyW11onDltXHo0L1X23j9Nnvg.jpg,2017-08-11,Ingrid Goes West,False,6.5,462
False,/eDw3ydtUpCE541mBFnEnSHyYuaH.jpg,"[18, 53, 10752]",405775,en,The Wall,An American sniper and his spotter engage in a deadly cat-and-mouse game with an Iraqi sniper.,8.146,/8POAZwZpp24l1IgKKM8ZRAQ2kid.jpg,2017-05-12,The Wall,False,6.1,435
False,/lkCDvf3QjXpAycm896oH1LRTK5X.jpg,"[16, 35, 10751]",462883,en,Woody Woodpecker,"Woody Woodpecker is back with his signature laugh, wacky antics and wisecracks in the first ever live-action/animated film. Woody must protect his forest home from Lance Walters (Timothy Omundson) who starts building his dream mansion in the forest with his son, Tommy and fiancee Vanessa (Thaila Ayala). To make matters worse, he must avoid the clutches of two grizzly poachers. With a series of crazy hijinks to sabotage their plans, Woody proves he'll stop at nothing to defend his turf. Get ready for big laughs in this hilarious comedy about everyone's favourite woodpecker!",9.55,/vFGUsJTa8z0OfDTbjdyppAireeB.jpg,2018-02-06,Woody Woodpecker,False,5.8,167
False,/yFZG86Zvdy6JuIlMW9eHxlVkct5.jpg,"[28, 12, 16, 14, 878, 10749]",413594,ja,劇場版 ソードアート・オンライン -オーディナル・スケール-,"People everywhere were enjoying a new game called Ordinal Scale, an ARMMORPG developed exclusively for the Augma, a new wearable console designed for AR (augmented reality) gaming. But, the players had no idea that a nightmare from the virtual world was starting to spread into reality! As his fellow players find themselves in danger, the hero is called upon once again.",11.043,/2szdEK0Mr0RG0nWGFVTseNQHbnP.jpg,2017-03-09,Sword Art Online: The Movie - Ordinal Scale,False,7.6,263
False,/cRXRb5vAOPVDRKrQ0L6cmGSvSeF.jpg,[35],432787,en,Fun Mom Dinner,"Four women, whose kids attend the same preschool class, get together for a ""fun mom dinner"". When the night takes an unexpected turn, these unlikely new friends realize they have more in common than just marriage and motherhood.",6.794,/6mtqrfp56Xa4DS64wrqVN9AZwkS.jpg,2017-08-04,Fun Mom Dinner,False,5.8,130
False,/niiRlDEJFH6nbNA4D7A09ANA7tK.jpg,"[53, 27, 35]",401561,en,Mom and Dad,"In a suburban community, moms and dads, one after the other, mysteriously feel the irresistible impulse to attack and kill their own offspring.",10.743,/fSaeahvo1GU7v4W6CX2y0j7fxMG.jpg,2018-01-19,Mom and Dad,False,5.2,424
False,/wb1hz8m3snCBN1wdF3SZxrdKgRH.jpg,"[18, 9648, 53]",488623,ko,기억의 밤,"Seoul, South Korea, 1997. When the young but extremely anxious student Jin-seok, his parents and his successful older brother Yoo-seok move to a new home, mysterious and frightening events begin to happen around them, unexplained events that threaten to ruin their seemingly happy lives. Unable to understand what is happening, Jin-seok wonders if he is losing his mind.",8.993,/cBgj41y1RvmW1zJCEX0uNWL0UjW.jpg,2018-02-21,Forgotten,False,7.8,191
False,/wtzJihFG4aBTat6QG9BoOWud7rG.jpg,"[28, 18]",426284,ja,無限の住人,"Manji, a highly skilled samurai, becomes cursed with immortality after a legendary battle. Haunted by the brutal murder of his sister, Manji knows that only fighting evil will regain his soul. He promises to help a young girl named Rin avenge her parents, who were killed by a group of master swordsmen led by ruthless warrior Anotsu. The mission will change Manji in ways he could never imagine.",9.285,/bFaxg006Dt6J1k7qa7a5YuqbAhe.jpg,2017-11-03,Blade of the Immortal,False,6.5,225
False,/a09NeywCuAevxKDG8JmqBpittTT.jpg,[18],340027,en,Brain on Fire,"Susannah Cahalan, an up-and-coming journalist at the New York Post becomes plagued by voices in her head and seizures, causing a rapid descent into insanity.",10.984,/ulOCM9UYjiXxggjDBtNmGTmsJDA.jpg,2017-06-06,Brain on Fire,False,7.2,764
False,/jUI42ShKFPy0oLZFXbXzXMEq9Zg.jpg,"[80, 18, 9648, 53]",317091,en,November Criminals,"When Addison investigates the murder of his friend Kevin with the help of Phoebe, they discover that the truth is darker than they had ever imagined.",7.989,/m2JxGgarPvtemudLZ1CB6gLJeUb.jpg,2017-12-08,November Criminals,False,5.1,356
False,/vlZykF6qPk6Hc6fvX67DxnCUBue.jpg,"[80, 18]",423646,de,Aus dem Nichts,"Katja's life collapses after a senseless act impacts her. After a time of mourning and injustice, she seeks revenge.",7.534,/qaLbKxjHaOkY7lT6jmsS1lsRocy.jpg,2017-12-27,In the Fade,False,7.0,415
False,/w363f25W1YoQNPdkTwDWUXga9db.jpg,"[18, 10749]",359784,en,Maudie,Canadian folk artist Maud Lewis falls in love with a fishmonger while working for him as a live-in housekeeper.,6.529,/wu9RPdV0uEemFEewJQ6fWwJ9ZcU.jpg,2017-06-16,Maudie,False,7.7,142
False,/4d9dnfVT8O0ko9ZTILymFRz4575.jpg,[18],424998,en,The Case for Christ,"Based on the true story of an award-winning investigative journalist -- and avowed atheist -- who applies his well-honed journalistic and legal skills to disprove the newfound Christian faith of his wife... with unexpected, life-altering results.",8.778,/hTKwkxMv5MCkN8vMXiEmMmAHafh.jpg,2017-04-07,The Case for Christ,False,6.8,129
False,/shwQgS3MqjjU2X47MV6SCqSaekq.jpg,[18],425751,en,The Hero,"Lee, a former Western film icon, is living a comfortable existence lending his golden voice to advertisements and smoking weed. After receiving a lifetime achievement award and unexpected news, Lee reexamines his past, while a chance meeting with a sardonic comic has him looking to the future.",7.569,/1xz4ggwOJi8FUsjsLDbFrCxyK0e.jpg,2017-06-09,The Hero,False,6.2,93
False,/gUebSn2HgWchRx2sUwYAXpbxCfV.jpg,"[18, 27, 9648, 53]",420707,en,Cage Dive,"Three friends from California are filming an audition tape for an extreme reality game show. They document their journey to Australia where they will be doing their most dangerous activity.... Shark Cage Diving. A catastrophic turn of events leaves them in baited water full of Great White Sharks, turning their recording into a blood chilling diary of survival... and death.",9.029,/3uUO9eDxHeDREIX77BaQiI88ajp.jpg,2017-08-11,Cage Dive,False,4.4,161
False,/8pXUXMe1LFXvpPFb5CaObacDN9J.jpg,"[35, 80, 18, 53]",425591,en,I Don't Feel at Home in This World Anymore,"When a depressed woman is burglarized, she finds a new sense of purpose by tracking down the thieves alongside her obnoxious neighbor. But they soon find themselves dangerously out of their depth against a pack of degenerate criminals.",8.77,/1stdUlXBc3nxqhdWvZ6wWWEbCQW.jpg,2017-01-19,I Don't Feel at Home in This World Anymore,False,6.5,658
False,/dA7YLnc5ztTGiVPWz3GsaMRRz9r.jpg,"[18, 10749, 878, 53, 9648]",376134,en,The Discovery,"In the near future, due to a breakthrough scientific discovery by Dr. Thomas Harbor, there is now definitive proof of an afterlife. While countless people have chosen suicide to reset their existence, others try to decide what it all means. Among them is Dr. Harbor's son Will, who has arrived at his father's isolated compound with a mysterious young woman named Isla. There, they discover the strange acolytes who help Dr. Harbor with his experiments.",10.517,/nLIDouFvreSrs8xK62zuvpEPDw0.jpg,2017-01-20,The Discovery,False,6.2,703
False,/wK0V1wsdsJrTEv1fLLitXADpAsx.jpg,"[18, 10749]",413998,en,My Cousin Rachel,"A young Englishman plots revenge against his mysterious, beautiful cousin, believing that she murdered his guardian. But his feelings become complicated as he finds himself falling under the beguiling spell of her charms.",8.769,/yz9Pnx5tbpZOHWsCD0LtoTCgmLi.jpg,2017-06-09,My Cousin Rachel,False,5.6,369
False,/kvH4HlJGp4lllpzgHKch1TkW15T.jpg,"[28, 35]",412547,en,Killing Gunther,"A group of eccentric assassins are fed up with Gunther, the world's greatest hitman, and decide to kill him – but their plan turns into a series of bungled encounters as Gunther seems to always be one step ahead.",8.771,/5jm2l2qRq8jEzXzOZgD2wEgFznq.jpg,2017-09-22,Killing Gunther,False,4.6,144
False,/pnZFXKS546ibquVfr2SN6DGe6jp.jpg,[99],469019,en,Jim & Andy: The Great Beyond,Offbeat documentarian Chris Smith provides a behind-the-scenes look at how Jim Carrey adopted the persona of idiosyncratic comedian Andy Kaufman on the set of Man on the Moon.,7.52,/kKzopOFXz9YfsCTqg3XpF0GoypX.jpg,2017-11-11,Jim & Andy: The Great Beyond,False,7.7,340
False,/45zVQcCegFVyvImzXyfXy63XDlr.jpg,"[28, 16, 14, 878, 53]",408220,en,Justice League Dark,Beings with supernatural powers join together to fight against supernatural villains.,8.514,/lGa2sK2LdcHQjasYyukl3P2nras.jpg,2017-01-24,Justice League Dark,False,6.9,432
False,/kTw2tPDtOK6GkCA2f720kzoqXQ9.jpg,[99],450945,en,I Am Heath Ledger,"The life and career of an actor, artist, and icon. His own journey through his own camera.",8.016,/96ScsrVx2tAlWuiZYgqwcuGYdYK.jpg,2017-04-23,I Am Heath Ledger,False,7.6,118
False,/3Z4wHSd3tFhNTFzhBBwJBlI9di6.jpg,"[18, 10751]",457262,en,Rip Tide,"There comes a point in everyone’s life when you have to make a decision about the direction you’re going to take. For newly-18 American fashion model Cora, that time is now. She’s moved to an Australian coastal town to be with her favourite aunt, after a 'fashion faux pas’ back home.",8.27,/zQZJPhjLGxQWdxDlrtgagUa4Fak.jpg,2017-10-03,Rip Tide,False,6.1,307
False,/A3MpZcwdyeklyciwkDjJS02ZdNU.jpg,"[53, 18, 10402]",451751,en,American Satan,"A young rock band, half from England and half from the US, drop out of college and move to the Sunset Strip to chase their dreams.",6.659,/hM9dOYWPh5pcQ3ruFXDayXsqgHw.jpg,2017-10-13,American Satan,False,5.8,63
False,/h3ir8VfpSEtoEBJjEarEludkjKL.jpg,"[28, 878, 53]",460648,zh,机器之血,"Jackie Chan stars as a hardened special forces agent who fights to protect a young woman from a sinister criminal gang. At the same time, he feels a special connection to the young woman, like they met in a different life.",9.265,/8qqPmQr0s2bZHPBMASpBXOKUZoi.jpg,2017-12-22,Bleeding Steel,False,5.4,147
False,/bgtlK6qnCet3Zx6Rt2wT5PLEp7C.jpg,"[27, 12, 9648, 16, 28, 878]",400136,ja,バイオハザード ヴェンデッタ,BSAA Chris Redfield enlists the help of government agent Leon S. Kennedy and Professor Rebecca Chambers from Alexander Institute of Biotechnology to stop a death merchant with a vengeance from spreading a deadly virus in New York.,7.76,/88qfHWhlOBYXp69277QFhdPYnWf.jpg,2017-06-19,Resident Evil: Vendetta,False,6.4,381
False,/mOPR6T2lYvtH1daPJXmCeKu0eie.jpg,"[28, 12, 878]",456048,en,The Humanity Bureau,In 2030 the world is in a permanent state of economic recession and facing serious environmental problems as a result of global warming.,7.005,/2qf4wJoaYAXwY0Lov4OfBhSGbTQ.jpg,2017-07-11,The Humanity Bureau,False,5.0,130
False,/1ltcMaCX5kPOEA4NFTSBnvBFNbY.jpg,"[35, 18, 14]",423949,en,Unicorn Store,"A woman named Kit moves back to her parent's house, where she receives a mysterious invitation that would fulfill her childhood dreams.",8.252,/rGe3eWy3F3qggDZMc86bASN4I7C.jpg,2019-04-05,Unicorn Store,False,6.2,508
False,/fhDzf6AGyytro5cFIxzSacPW6AB.jpg,"[80, 9648, 878]",411999,en,OtherLife,"Ren Amari is the driven inventor of a revolutionary new drug. OtherLIfe expands the brain's sense of time and creates virtual reality directly in the user's mind. With OtherLife, mere seconds in real life feel like hours or days of exciting adventures. As Ren and her colleagues race around the clock to launch OtherLife, the government muscles in to use the drugs as a radical solution to prison overcrowding. They will create virtual cells where criminals serve long sentences in just minutes of real time. When Ren resists, she finds herself an unwilling guinea pig trapped in a prison cell in her mind. She must escape before she descends into madness, and then regain control of OtherLife before others suffer the same fate.",8.748,/stSDsKsb4fS6NPzuHwfAWD2jim8.jpg,2017-10-05,OtherLife,False,6.5,207
False,/zZLvILFQO2RrW0JsMDOonFS0gl4.jpg,"[35, 10749]",441728,en,Hampstead,"Emily Walters is an American widow living a peaceful, uneventful existence in the idyllic Hampstead Village of London, when she meets  local recluse, Donald Horner. For 17 years, Donald has lived—wildly yet peacefully—in a ramshackle hut near the edge of the forest. When Emily learns his home is the target of developers who will stop at nothing to remove him, saving Donald and his property becomes her personal mission. Despite his gruff exterior and polite refusals for help, Emily is drawn to him—as he is to her—and what begins as a charitable cause evolves into a relationship that will grow even as the bulldozers close in.",7.686,/svyFdV8QrOyheU2lEDuBnrcCQT5.jpg,2019-06-14,Hampstead,False,6.0,98
False,/oNgwgGiUruDMn8MklEwPWx9fOnO.jpg,[18],455558,en,9/11,"A group of 5 people find themselves trapped in an elevator in the World Trade Center's North Tower on 9/11. They work together, never giving up hope, to try to escape before the unthinkable happens.",8.247,/pGkjEL7RkMogMI6aznsKmZOhd8I.jpg,2017-09-08,9/11,False,4.9,115
False,/iiUizZMPhzGFo743aH0mz1GTLdx.jpg,"[878, 53, 28]",475759,en,2048: Nowhere to Run,"“2048: Nowhere to Run” takes place one year before the events of Blade Runner 2049. The short film focuses on Sapper, a man who is trying to make it through life day-by-day without turning back to his old ways. We’re introduced to both the gentle nature of Sapper and the violence he’s capable of when set off.",8.497,/l8JKbUCIe4y1LujxMMjbxG6ueH.jpg,2017-09-14,2048: Nowhere to Run,False,6.9,147
False,/2s4laxseAR9E7EIMxkrmCi1fdFP.jpg,"[99, 10751]",464593,en,Earth: One Amazing Day,"An astonishing journey revealing the awesome power of the natural world. Over the course of one single day, we track the sun from the highest mountains to the remotest islands to exotic jungles.",7.484,/7OKStVtpeptnfIgxXEyQubMMTey.jpg,2017-10-06,Earth: One Amazing Day,False,7.8,93
False,/e18uwlwjnhxFJ9CxL8BQVDkdG2K.jpg,"[18, 10749]",444539,en,The Bookshop,"Set in an small English town in 1959, the story of a woman who decides, against polite but ruthless local opposition, to open a bookshop, a decision which becomes a political minefield.",7.743,/nh2ZpwuTKjY0tTGcsGu7TwOpT4p.jpg,2018-08-24,The Bookshop,False,6.6,180
False,/ynJO5IHwgrLjBFDGkvBV8vKAvGe.jpg,"[18, 9648, 80]",419835,en,Crooked House,"A private investigator helps a former flame solve the murder of her wealthy grandfather, who lived in a sprawling estate surrounded by his idiosyncratic family.",8.242,/AewyKG2cvgZQBG4XU6SVomfu1k5.jpg,2017-12-22,Crooked House,False,6.4,390
False,/5QAc8dsyOwJBGQ71mhOLMEivOsF.jpg,"[28, 12, 16, 878]",449574,ja,GODZILLA 怪獣惑星,"In the year 2048, the human race is forced to leave Earth after decades of losing against Godzilla and other giant monsters. They take a twenty-year journey to another planet called Tau Ceti-e, but upon arrival, they discover that the planet has become uninhabitable. As living conditions on their ship deteriorate, a young man named Haruo spearheads a movement to return to Earth and take it back from the monsters. The ship successfully makes the return voyage, but the crew realizes that twenty thousand years have passed, with Earth's ecosystem having evolved to become centered around Godzilla.",11.372,/hAuZ7g6TqDLv5fOqXIPgYRguOkm.jpg,2018-01-17,Godzilla: Planet of the Monsters,False,6.1,199
False,/39XQf9sk2qyyleVOX6QdS9o8v53.jpg,"[12, 16, 14, 10751]",462677,ja,映画ドラえもん のび太の南極カチコチ大冒険,"Unable to endure the midsummer heat, Doraemon transports Nobita and his friends to a huge iceberg floating in the South Pacific. While creating an amusement parks with the secret tool ""Ice-working Iron"" the group finds a mysterious golden ring in the ice. Upon closer examination, they determine that the ring was buried in Antarctica 100,000 years ago - before people could have lived there. Doraemon and friends head to Antarctica looking for the owner of the ring and come across the ruins of a huge city buried in the ice. Using Doraemon's Time Belt, the group travels back 100,000 years ago and meets the young girl Kara who is connected to the mysterious ring. But now the group must fight for survival as Doraemon faces the crisis of the entire Earth freezing.",8.116,/oUvhVQ6wyO7qssQSJ1CiM93Di7P.jpg,2017-12-31,Doraemon the Movie: Nobita's Great Adventure in the Antarctic Kachi Kochi,False,8.5,11
False,/fFOc75GSXsWzMKoekBMK4cu2kPY.jpg,"[12, 878]",455839,en,Time Trap,A group of students become trapped inside a mysterious cave where they discover time passes differently underground than on the surface.,7.234,/3qIBGXM6oXOu3wBYH6QpamXdXuB.jpg,2017-05-19,Time Trap,False,6.4,100
False,/uoNpFDFQOdaMvyqD8zxP3yezzCJ.jpg,[99],415086,en,What the Health,"Filmmaker Kip Andersen uncovers the secret to preventing and even reversing chronic diseases, and he investigates why the nation's leading health organizations doesn't want people to know about it.",6.478,/sz9cPeSmiGLA1EDUPszlrWfSrId.jpg,2017-03-16,What the Health,False,7.3,182
False,/izx7Dh8GwEVQIPxsHzr8imzM5HW.jpg,"[12, 16, 14]",430447,ja,メアリと魔女の花,"Mary Smith, a young girl who lives with her great-aunt in the countryside, follows a mysterious cat into the nearby forest where she finds a strange flower and an old broom, none of which is as ordinary as it seems.",10.678,/lq3OJQiJ8hlCr23LAdHbeU3eqBF.jpg,2018-01-17,Mary and the Witch's Flower,False,7.1,377
False,/eo4R4evfKGv1xDKesFpF5sZuG00.jpg,"[18, 10749]",364733,en,Blind,A novelist is blinded in a car crash that killed his wife and several years later rediscovers his passion for life and writing when he embarks on an affair with the neglected wife of an indicted businessman.,6.298,/cXyObe5aB63ueOndEXxXabgAvIi.jpg,2017-07-14,Blind,False,5.8,69
False,/wiRJsxQd5pFUmjw77IR9n0Lv0IX.jpg,[35],488223,en,Dave Chappelle: Equanimity,"Comedy legend Dave Chappelle returns to his roots with an all-new stand-up special filmed at the Warner Theatre in Washington, D.C.",7.302,/1fy9tDNs5c8hMVegLjU6YnnrwJp.jpg,2017-12-30,Dave Chappelle: Equanimity,False,7.6,94
